BOAMP_AVIS_NUM,D_05_01_Objet_Titremarche,D_05_02_Objet_Refmarche,D_05_03_Objet_Typemarche,D_05_03_01_Objet_Typemarche_Travaux,D_05_03_01_01_Objet_Typemarche_Travaux_Execution,D_05_03_01_02_Objet_Typemarche_Travaux_Conceptrealisation,D_05_03_01_03_Objet_Typemarche_Travaux_Executionouvrage,D_05_03_02_Objet_Typemarche_Fournitures,D_05_03_02_01_Objet_Typemarche_Fournitures_Achat,D_05_03_02_02_Objet_Typemarche_Fournitures_Loc,D_05_03_02_03_Objet_Typemarche_Fournitures_Creditbail,D_05_03_02_04_Objet_Typemarche_Fournitures_Locvente,D_05_03_02_05_Objet_Typemarche_Fournitures_Plusieursformes,D_05_03_03_Objet_Typemarche_Service,D_05_04_Objet_Objetcomplet,D_05_05_Objet_Cpv,D_05_05_01_Objet_Cpv_Principal,D_05_05_02_Objet_Cpv_Supplementaire,D_05_06_Objet_Lieuexeclivr,D_05_06_01_Objet_Lieuexeclivr_Adresse,D_05_06_02_Objet_Lieuexeclivr_Cp,D_05_06_03_Objet_Lieuexeclivr_Ville,D_05_06_04_Objet_Lieuexeclivr_Codenuts,D_05_07_Objet_Delegation,D_05_07_01_Objet_Delegation_Texteapplication,D_05_07_02_Objet_Delegation_Domaine,D_05_07_02_01_Objet_Delegation_Domaine_Eaupotable,D_05_07_02_02_Objet_Delegation_Domaine_Assainissement,D_05_07_02_03_Objet_Delegation_Domaine_Orduresmendechets,D_05_07_02_04_Objet_Delegation_Domaine_Transports,D_05_07_02_05_Objet_Delegation_Domaine_Energie,D_05_07_02_06_Objet_Delegation_Domaine_Telecommunication,D_05_07_02_07_Objet_Delegation_Domaine_Autre,D_05_07_03_Objet_Delegation_Natureconvention,D_05_07_04_Objet_Delegation_Dureean,D_05_07_05_Objet_Delegation_Dureemois,D_05_07_06_Objet_Delegation_Datedebut,D_05_07_07_Objet_Delegation_Autresprecisions,D_05_08_Objet_Ampoui,D_05_09_Objet_Ampnon,D_05_10_Objet_Aviscorrespond,D_05_10_01_Objet_Aviscorrespond_Avisperiodiqueindicatif,D_05_10_02_Objet_Aviscorrespond_Systemequalification,D_05_11_Objet_Avisimplique,D_05_11_01_Objet_Avisimplique_Marchepublic,D_05_11_02_Objet_Avisimplique_Accordcadre,D_05_11_03_Objet_Avisimplique_Sad,D_05_12_Objet_Accordcadre,D_05_12_01_Objet_Accordcadre_Plusieursoperateurs,D_05_12_02_Objet_Accordcadre_Unseuloperateur,D_05_12_03_Objet_Accordcadre_Nbparticipants,D_05_12_04_Objet_Accordcadre_Nbmaxparticipants,D_05_12_05_Objet_Accordcadre_Dureean,D_05_12_06_Objet_Accordcadre_Dureemois,D_05_12_07_Objet_Accordcadre_Supquatreansjustification,D_05_12_08_Objet_Accordcadre_Valeur,D_05_12_08_01_Objet_Accordcadre_Valeur_Value,D_05_12_08_02_Objet_Accordcadre_Valeur_Devise,D_05_12_09_Objet_Accordcadre_Valeurmin,D_05_12_09_01_Objet_Accordcadre_Valeurmin_Value,D_05_12_09_02_Objet_Accordcadre_Valeurmin_Devise,D_05_12_10_Objet_Accordcadre_Valeurmax,D_05_12_10_01_Objet_Accordcadre_Valeurmax_Value,D_05_12_10_02_Objet_Accordcadre_Valeurmax_Devise,D_05_12_11_Objet_Accordcadre_Frequenceetvaleurdesmarches,D_05_12_12_Objet_Accordcadre_Oui,D_05_12_13_Objet_Accordcadre_Non,D_05_13_Objet_Variantesoui,D_05_14_Objet_Variantesnon,D_05_15_Objet_Caracteristiques,D_05_15_01_Objet_Caracteristiques_Principales,D_05_15_02_Objet_Caracteristiques_Quantite,D_05_15_03_Objet_Caracteristiques_Valeurtotale,D_05_15_03_01_Objet_Caracteristiques_Valeurtotale_Value,D_05_15_03_02_Objet_Caracteristiques_Valeurtotale_Devise,D_05_15_04_Objet_Caracteristiques_Valeur,D_05_15_04_01_Objet_Caracteristiques_Valeur_Value,D_05_15_04_02_Objet_Caracteristiques_Valeur_Devise,D_05_15_05_Objet_Caracteristiques_Valeurmin,D_05_15_05_01_Objet_Caracteristiques_Valeurmin_Value,D_05_15_05_02_Objet_Caracteristiques_Valeurmin_Devise,D_05_15_06_Objet_Caracteristiques_Valeurmax,D_05_15_06_01_Objet_Caracteristiques_Valeurmax_Value,D_05_15_06_02_Objet_Caracteristiques_Valeurmax_Devise,D_05_15_07_Objet_Caracteristiques_Titre,D_05_15_08_Objet_Caracteristiques_Table,D_05_15_09_Objet_Caracteristiques_Options,D_05_15_09_01_Objet_Caracteristiques_Options_Oui,D_05_15_09_02_Objet_Caracteristiques_Options_Description,D_05_15_09_03_Objet_Caracteristiques_Options_Dureemois,D_05_15_09_04_Objet_Caracteristiques_Options_Dureejours,D_05_15_09_05_Objet_Caracteristiques_Options_Non,D_05_15_10_Objet_Caracteristiques_Reconductions,D_05_15_10_01_Objet_Caracteristiques_Reconductions_Oui,D_05_15_10_02_Objet_Caracteristiques_Reconductions_Nbreconductions,D_05_15_10_03_Objet_Caracteristiques_Reconductions_Nbreconductionsmin,D_05_15_10_04_Objet_Caracteristiques_Reconductions_Nbreconductionsmax,D_05_15_10_05_Objet_Caracteristiques_Reconductions_Calendrier,D_05_15_10_06_Objet_Caracteristiques_Reconductions_Dureemois,D_05_15_10_07_Objet_Caracteristiques_Reconductions_Dureejours,D_05_15_10_08_Objet_Caracteristiques_Reconductions_Description,D_05_15_10_09_Objet_Caracteristiques_Reconductions_Non,D_05_16_Objet_Dureedelai,D_05_16_01_Objet_Dureedelai_Dureemois,D_05_16_02_Objet_Dureedelai_Dureejours,D_05_16_03_Objet_Dureedelai_Datedebut,D_05_16_04_Objet_Dureedelai_Datefin,D_05_16_05_Objet_Dureedelai_Dateexecution,D_05_16_06_Objet_Dureedelai_Datelivraison,D_05_17_Objet_Divenlots,D_05_17_01_Objet_Divenlots_Oui,D_05_17_02_Objet_Divenlots_Offreun,D_05_17_03_Objet_Divenlots_Offreplusieurs,D_05_17_04_Objet_Divenlots_Offretous,D_05_17_05_Objet_Divenlots_Non,D_05_18_Objet_Nblotoffremax,D_05_19_Objet_Nblotattribmax,D_05_20_Objet_Lotsreservepouvoiradjudicateur,D_05_21_Objet_Datelancement,D_05_22_Objet_Lots,D_05_22_01_Objet_Lots_Lot,D_05_22_01_01_Objet_Lots_Lot_Num,D_05_22_01_02_Objet_Lots_Lot_Intitule,D_05_22_01_03_Objet_Lots_Lot_Description,D_05_22_01_04_Objet_Lots_Lot_Cpv,D_05_22_01_04_01_Objet_Lots_Lot_Cpv_Principal,D_05_22_01_04_02_Objet_Lots_Lot_Cpv_Supplementaire,D_05_22_01_05_Objet_Lots_Lot_Codenuts,D_05_22_01_06_Objet_Lots_Lot_Lieuprincipal,D_05_22_01_07_Objet_Lots_Lot_Criteresattribution,D_05_22_01_07_01_Objet_Lots_Lot_Criteresattribution_Criterescctp,D_05_22_01_07_02_Objet_Lots_Lot_Criteresattribution_Criteresqualite,D_05_22_01_07_02_01_Objet_Lots_Lot_Criteresattribution_Criteresqualite_Critere,D_05_22_01_07_02_01_01_Objet_Lots_Lot_Criteresattribution_Criteresqualite_Critere_Value,D_05_22_01_07_02_01_02_Objet_Lots_Lot_Criteresattribution_Criteresqualite_Critere_Poids,D_05_22_01_07_03_Objet_Lots_Lot_Criteresattribution_Criterescout,D_05_22_01_07_03_01_Objet_Lots_Lot_Criteresattribution_Criterescout_Critere,D_05_22_01_07_03_01_01_Objet_Lots_Lot_Criteresattribution_Criterescout_Critere_Value,D_05_22_01_07_03_01_02_Objet_Lots_Lot_Criteresattribution_Criterescout_Critere_Poids,D_05_22_01_07_04_Objet_Lots_Lot_Criteresattribution_Criteresprix,D_05_22_01_07_04_01_Objet_Lots_Lot_Criteresattribution_Criteresprix_Poids,D_05_22_01_08_Objet_Lots_Lot_Quantite,D_05_22_01_09_Objet_Lots_Lot_Valeur,D_05_22_01_09_01_Objet_Lots_Lot_Valeur_Value,D_05_22_01_09_02_Objet_Lots_Lot_Valeur_Devise,D_05_22_01_10_Objet_Lots_Lot_Valeurmin,D_05_22_01_10_01_Objet_Lots_Lot_Valeurmin_Value,D_05_22_01_10_02_Objet_Lots_Lot_Valeurmin_Devise,D_05_22_01_11_Objet_Lots_Lot_Valeurmax,D_05_22_01_11_01_Objet_Lots_Lot_Valeurmax_Value,D_05_22_01_11_02_Objet_Lots_Lot_Valeurmax_Devise,D_05_22_01_12_Objet_Lots_Lot_Dureemois,D_05_22_01_13_Objet_Lots_Lot_Dureejours,D_05_22_01_14_Objet_Lots_Lot_Datedebut,D_05_22_01_15_Objet_Lots_Lot_Datefin,D_05_22_01_16_Objet_Lots_Lot_Dureesystemequalification,D_05_22_01_17_Objet_Lots_Lot_Supquatreansjustification,D_05_22_01_18_Objet_Lots_Lot_Suphuitansjustification,D_05_22_01_19_Objet_Lots_Lot_Dateexecution,D_05_22_01_20_Objet_Lots_Lot_Datelivraison,D_05_22_01_21_Objet_Lots_Lot_Datelancement,D_05_22_01_22_Objet_Lots_Lot_Renouvellementoui,D_05_22_01_23_Objet_Lots_Lot_Renouvellementnon,D_05_22_01_24_Objet_Lots_Lot_Renouvellementdescription,D_05_22_01_25_Objet_Lots_Lot_Nbcandidats,D_05_22_01_25_01_Objet_Lots_Lot_Nbcandidats_Nbmaxoffre,D_05_22_01_25_02_Objet_Lots_Lot_Nbcandidats_Nbminoffre,D_05_22_01_25_03_Objet_Lots_Lot_Nbcandidats_Nboffre,D_05_22_01_25_04_Objet_Lots_Lot_Nbcandidats_Limitationcandidats,D_05_22_01_26_Objet_Lots_Lot_Variantesoui,D_05_22_01_27_Objet_Lots_Lot_Variantesnon,D_05_22_01_28_Objet_Lots_Lot_Optionsoui,D_05_22_01_29_Objet_Lots_Lot_Optionsnon,D_05_22_01_30_Objet_Lots_Lot_Optionsdescription,D_05_22_01_31_Objet_Lots_Lot_Catalogueelectroniqueoui,D_05_22_01_32_Objet_Lots_Lot_Catalogueelectroniquenon,D_05_22_01_33_Objet_Lots_Lot_Fondscommunautairesoui,D_05_22_01_34_Objet_Lots_Lot_Fondscommunautairesnon,D_05_22_01_35_Objet_Lots_Lot_Fondscommunautairesdescription,D_05_22_01_36_Objet_Lots_Lot_Infocompl,D_05_23_Objet_Infocompl
21-139374,,,CF_NIV_SUIV,CF_NIV_SUIV,False,False,False,CF_NIV_SUIV,False,False,,,,12.0,Missions de contrôle technique et de coordination de sécurité et de protection de la santé afférentes à la rénovation énergétique d'un bâtiment au Lycée Schuman à Metz,CF_NIV_SUIV,71631300.0,,CF_NIV_SUIV,,,,FRF33,CF_NIV_SUIV,,CF_NIV_SUIV,,,,,,,,,,,,,False,True,CF_NIV_SUIV,False,,CF_NIV_SUIV,False,False,,CF_NIV_SUIV,,,,,,,,CF_NIV_SUIV,,,CF_NIV_SUIV,,,CF_NIV_SUIV,,,,,,False,False,CF_NIV_SUIV,,,CF_NIV_SUIV,,,CF_NIV_SUIV,,,CF_NIV_SUIV,,,CF_NIV_SUIV,,,,--None--,CF_NIV_SUIV,False,,,,False,CF_NIV_SUIV,,,,,,,,,False,CF_NIV_SUIV,,,,,,,CF_NIV_SUIV,False,False,False,False,False,,,,,CF_NIV_SUIV,,,,,,,,,,,,,,,,,,,,,,,,,,,,,,,,,,,,,,,,,,,,,,,,,,,,,,,,,,,,,
21-139374,,,CF_NIV_SUIV,CF_NIV_SUIV,False,False,False,CF_NIV_SUIV,False,False,,,,12.0,Missions de contrôle technique et de coordination de sécurité et de protection de la santé afférentes à la rénovation énergétique d'un bâtiment au Lycée Schuman à Metz,CF_NIV_SUIV,71317210.0,,CF_NIV_SUIV,,,,FRF33,CF_NIV_SUIV,,CF_NIV_SUIV,,,,,,,,,,,,,False,True,CF_NIV_SUIV,False,,CF_NIV_SUIV,False,False,,CF_NIV_SUIV,,,,,,,,CF_NIV_SUIV,,,CF_NIV_SUIV,,,CF_NIV_SUIV,,,,,,False,False,CF_NIV_SUIV,,,CF_NIV_SUIV,,,CF_NIV_SUIV,,,CF_NIV_SUIV,,,CF_NIV_SUIV,,,,--None--,CF_NIV_SUIV,False,,,,False,CF_NIV_SUIV,,,,,,,,,False,CF_NIV_SUIV,,,,,,,CF_NIV_SUIV,False,False,False,False,False,,,,,CF_NIV_SUIV,,,,,,,,,,,,,,,,,,,,,,,,,,,,,,,,,,,,,,,,,,,,,,,,,,,,,,,,,,,,,
21-141208,,,CF_NIV_SUIV,CF_NIV_SUIV,False,False,False,CF_NIV_SUIV,False,False,,,,,Rénovation énergétique du bâtiment du SICECO à Dijon,CF_NIV_SUIV,45000000.0,,CF_NIV_SUIV,,,,FRC11,CF_NIV_SUIV,,CF_NIV_SUIV,,,,,,,,,,,,,False,False,CF_NIV_SUIV,False,,CF_NIV_SUIV,False,False,,CF_NIV_SUIV,,,,,,,,CF_NIV_SUIV,,,CF_NIV_SUIV,,,CF_NIV_SUIV,,,,,,False,False,CF_NIV_SUIV,,,CF_NIV_SUIV,,,CF_NIV_SUIV,,,CF_NIV_SUIV,,,CF_NIV_SUIV,,,,--None--,CF_NIV_SUIV,False,,,,False,CF_NIV_SUIV,,,,,,,,,False,CF_NIV_SUIV,,,,,,,CF_NIV_SUIV,False,False,False,False,False,,,,,CF_NIV_SUIV,,,,,,,,,,,,,,,,,,,,,,,,,,,,,,,,,,,,,,,,,,,,,,,,,,,,,,,,,,,,,
21-161297,,,CF_NIV_SUIV,CF_NIV_SUIV,False,False,False,CF_NIV_SUIV,False,False,,,,12.0,Missions de contrôle technique et de coordination de sécurité et de protection de la santé afférentes à la construction d'un gymnase pour sportifs de haut niveau au CREPS d'Essey-lès-Nancy,CF_NIV_SUIV,71631300.0,,CF_NIV_SUIV,Essey-lès-Nancy,,,FRF3,CF_NIV_SUIV,,CF_NIV_SUIV,,,,,,,,,,,,,False,True,CF_NIV_SUIV,False,,CF_NIV_SUIV,False,False,,CF_NIV_SUIV,,,,,,,,CF_NIV_SUIV,,,CF_NIV_SUIV,,,CF_NIV_SUIV,,,,,,False,False,CF_NIV_SUIV,,,CF_NIV_SUIV,,,CF_NIV_SUIV,,,CF_NIV_SUIV,,,CF_NIV_SUIV,,,,--None--,CF_NIV_SUIV,False,,,,False,CF_NIV_SUIV,,,,,,,,,False,CF_NIV_SUIV,,,,,,,CF_NIV_SUIV,False,False,False,False,False,,,,,CF_NIV_SUIV,,,,,,,,,,,,,,,,,,,,,,,,,,,,,,,,,,,,,,,,,,,,,,,,,,,,,,,,,,,,,
21-161297,,,CF_NIV_SUIV,CF_NIV_SUIV,False,False,False,CF_NIV_SUIV,False,False,,,,12.0,Missions de contrôle technique et de coordination de sécurité et de protection de la santé afférentes à la construction d'un gymnase pour sportifs de haut niveau au CREPS d'Essey-lès-Nancy,CF_NIV_SUIV,71317210.0,,CF_NIV_SUIV,Essey-lès-Nancy,,,FRF3,CF_NIV_SUIV,,CF_NIV_SUIV,,,,,,,,,,,,,False,True,CF_NIV_SUIV,False,,CF_NIV_SUIV,False,False,,CF_NIV_SUIV,,,,,,,,CF_NIV_SUIV,,,CF_NIV_SUIV,,,CF_NIV_SUIV,,,,,,False,False,CF_NIV_SUIV,,,CF_NIV_SUIV,,,CF_NIV_SUIV,,,CF_NIV_SUIV,,,CF_NIV_SUIV,,,,--None--,CF_NIV_SUIV,False,,,,False,CF_NIV_SUIV,,,,,,,,,False,CF_NIV_SUIV,,,,,,,CF_NIV_SUIV,False,False,False,False,False,,,,,CF_NIV_SUIV,,,,,,,,,,,,,,,,,,,,,,,,,,,,,,,,,,,,,,,,,,,,,,,,,,,,,,,,,,,,,
21-161714,,,CF_NIV_SUIV,CF_NIV_SUIV,True,False,False,CF_NIV_SUIV,False,False,,,,,Mise en conformité accessibilité au LPR René Cassin à Metz,CF_NIV_SUIV,45454000.0,,CF_NIV_SUIV,,,,FRF33,CF_NIV_SUIV,,CF_NIV_SUIV,,,,,,,,,,,,,False,True,CF_NIV_SUIV,False,,CF_NIV_SUIV,False,False,,CF_NIV_SUIV,,,,,,,,CF_NIV_SUIV,,,CF_NIV_SUIV,,,CF_NIV_SUIV,,,,,,False,False,CF_NIV_SUIV,,,CF_NIV_SUIV,,,CF_NIV_SUIV,,,CF_NIV_SUIV,,,CF_NIV_SUIV,,,,--None--,CF_NIV_SUIV,False,,,,False,CF_NIV_SUIV,,,,,,,,,False,CF_NIV_SUIV,,,,,,,CF_NIV_SUIV,False,False,False,False,False,,,,,CF_NIV_SUIV,,,,,,,,,,,,,,,,,,,,,,,,,,,,,,,,,,,,,,,,,,,,,,,,,,,,,,,,,,,,,
21-161714,,,CF_NIV_SUIV,CF_NIV_SUIV,True,False,False,CF_NIV_SUIV,False,False,,,,,Mise en conformité accessibilité au LPR René Cassin à Metz,CF_NIV_SUIV,45262311.0,,CF_NIV_SUIV,,,,FRF33,CF_NIV_SUIV,,CF_NIV_SUIV,,,,,,,,,,,,,False,True,CF_NIV_SUIV,False,,CF_NIV_SUIV,False,False,,CF_NIV_SUIV,,,,,,,,CF_NIV_SUIV,,,CF_NIV_SUIV,,,CF_NIV_SUIV,,,,,,False,False,CF_NIV_SUIV,,,CF_NIV_SUIV,,,CF_NIV_SUIV,,,CF_NIV_SUIV,,,CF_NIV_SUIV,,,,--None--,CF_NIV_SUIV,False,,,,False,CF_NIV_SUIV,,,,,,,,,False,CF_NIV_SUIV,,,,,,,CF_NIV_SUIV,False,False,False,False,False,,,,,CF_NIV_SUIV,,,,,,,,,,,,,,,,,,,,,,,,,,,,,,,,,,,,,,,,,,,,,,,,,,,,,,,,,,,,,
21-80026,"Etude, réalisation, installation et MCO d'un système d'asservissement en vitesse et de codage en position d'une cible suspendue dans la base de mesures SOLANGE (PAMELA)",,CF_NIV_SUIV,CF_NIV_SUIV,False,False,False,CF_NIV_SUIV,True,False,,,,,"Etude, réalisation, installation et MCO d'un système d'asservissement en vitesse et de codage en position d'une cible suspendue dans la base de mesures solange (pamela).",CF_NIV_SUIV,38432000.0,,CF_NIV_SUIV,,,,FRH03,CF_NIV_SUIV,,CF_NIV_SUIV,,,,,,,,,,,,,False,False,CF_NIV_SUIV,False,,CF_NIV_SUIV,False,False,,CF_NIV_SUIV,,,,,,,,CF_NIV_SUIV,,,CF_NIV_SUIV,,,CF_NIV_SUIV,,,,,,False,False,CF_NIV_SUIV,,,CF_NIV_SUIV,,,CF_NIV_SUIV,,,CF_NIV_SUIV,,,CF_NIV_SUIV,,,,--None--,CF_NIV_SUIV,False,,,,False,CF_NIV_SUIV,,,,,,,,,False,CF_NIV_SUIV,,,,,,,CF_NIV_SUIV,False,False,False,False,False,,,,,CF_NIV_SUIV,,,,,,,,,,,,,,,,,,,,,,,,,,,,,,,,,,,,,,,,,,,,,,,,,,,,,,,,,,,,,
22-11778,,,CF_NIV_SUIV,CF_NIV_SUIV,True,False,False,CF_NIV_SUIV,False,False,,,,,Réalisation de la couverture du terrain de sport de Café,CF_NIV_SUIV,,,CF_NIV_SUIV,,,,,CF_NIV_SUIV,,CF_NIV_SUIV,,,,,,,,,,,,,True,False,CF_NIV_SUIV,False,,CF_NIV_SUIV,False,False,,CF_NIV_SUIV,,,,,,,,CF_NIV_SUIV,,,CF_NIV_SUIV,,,CF_NIV_SUIV,,,,,,False,False,CF_NIV_SUIV,,,CF_NIV_SUIV,,,CF_NIV_SUIV,,,CF_NIV_SUIV,,,CF_NIV_SUIV,,,,--None--,CF_NIV_SUIV,False,,,,False,CF_NIV_SUIV,,,,,,,,,False,CF_NIV_SUIV,,,,,,,CF_NIV_SUIV,False,False,False,False,False,,,,,CF_NIV_SUIV,,,,,,,,,,,,,,,,,,,,,,,,,,,,,,,,,,,,,,,,,,,,,,,,,,,,,,,,,,,,,
22-12870,,,CF_NIV_SUIV,CF_NIV_SUIV,False,False,False,CF_NIV_SUIV,False,False,,,,,Préparation et suivi du marché de conception-réalisation pour la requalification et l'extension de la piscine de Sevran dans le cadre du projet HERITAGE JOP 2024,CF_NIV_SUIV,,,CF_NIV_SUIV,,,,,CF_NIV_SUIV,,CF_NIV_SUIV,,,,,,,,,,,,,False,False,CF_NIV_SUIV,False,,CF_NIV_SUIV,False,False,,CF_NIV_SUIV,,,,,,,,CF_NIV_SUIV,,,CF_NIV_SUIV,,,CF_NIV_SUIV,,,,,,False,False,CF_NIV_SUIV,,,CF_NIV_SUIV,,,CF_NIV_SUIV,,,CF_NIV_SUIV,,,CF_NIV_SUIV,,,,--None--,CF_NIV_SUIV,False,,,,False,CF_NIV_SUIV,,,,,,,,,False,CF_NIV_SUIV,,,,,,,CF_NIV_SUIV,False,False,False,False,False,,,,,CF_NIV_SUIV,,,,,,,,,,,,,,,,,,,,,,,,,,,,,,,,,,,,,,,,,,,,,,,,,,,,,,,,,,,,,
22-12932,,,CF_NIV_SUIV,CF_NIV_SUIV,False,False,False,CF_NIV_SUIV,False,False,,,,,Marché de travaux de parachèvement du nouveau palais de justice de pointe à pitre,CF_NIV_SUIV,,,CF_NIV_SUIV,,,,,CF_NIV_SUIV,,CF_NIV_SUIV,,,,,,,,,,,,,False,False,CF_NIV_SUIV,False,,CF_NIV_SUIV,False,False,,CF_NIV_SUIV,,,,,,,,CF_NIV_SUIV,,,CF_NIV_SUIV,,,CF_NIV_SUIV,,,,,,False,False,CF_NIV_SUIV,,,CF_NIV_SUIV,,,CF_NIV_SUIV,,,CF_NIV_SUIV,,,CF_NIV_SUIV,,,,--None--,CF_NIV_SUIV,False,,,,False,CF_NIV_SUIV,,,,,,,,,False,CF_NIV_SUIV,,,,,,,CF_NIV_SUIV,False,False,False,False,False,,,,,CF_NIV_SUIV,,,,,,,,,,,,,,,,,,,,,,,,,,,,,,,,,,,,,,,,,,,,,,,,,,,,,,,,,,,,,
22-13432,,,CF_NIV_SUIV,CF_NIV_SUIV,True,False,False,CF_NIV_SUIV,False,False,,,,,Confortement et Réhabilitation du Groupe Scolaire de BRAGELOGNE- Lot 01,CF_NIV_SUIV,45111100.0,,CF_NIV_SUIV,Bragelogne,97122.0,Baie-mahault,FRY10,CF_NIV_SUIV,,CF_NIV_SUIV,,,,,,,,,,,,,True,False,CF_NIV_SUIV,False,,CF_NIV_SUIV,False,False,,CF_NIV_SUIV,,,,,,,,CF_NIV_SUIV,,,CF_NIV_SUIV,,,CF_NIV_SUIV,,,,,,False,False,CF_NIV_SUIV,,,CF_NIV_SUIV,,,CF_NIV_SUIV,,,CF_NIV_SUIV,,,CF_NIV_SUIV,,,,--None--,CF_NIV_SUIV,False,,,,False,CF_NIV_SUIV,,,,,,,,,False,CF_NIV_SUIV,,,,,,,CF_NIV_SUIV,False,False,False,False,False,,,,,CF_NIV_SUIV,,,,,,,,,,,,,,,,,,,,,,,,,,,,,,,,,,,,,,,,,,,,,,,,,,,,,,,,,,,,,
22-14239,,,CF_NIV_SUIV,CF_NIV_SUIV,False,False,False,CF_NIV_SUIV,False,False,,,,,Appui à la rédaction du Schéma Régional des Carrières en région Grand-Est,CF_NIV_SUIV,,,CF_NIV_SUIV,,,,,CF_NIV_SUIV,,CF_NIV_SUIV,,,,,,,,,,,,,False,False,CF_NIV_SUIV,False,,CF_NIV_SUIV,False,False,,CF_NIV_SUIV,,,,,,,,CF_NIV_SUIV,,,CF_NIV_SUIV,,,CF_NIV_SUIV,,,,,,False,False,CF_NIV_SUIV,"Tranche ferme : Appui à la rédaction du schéma régional des carrières de la région Grand-Est.Tranche optionnelle 1 : Rédaction de la partie relative aux enjeux socio-économiques.Tranche optionnelle 2 : Rédaction des parties relatives aux besoins, production et approvisionnement sur la base de l'étude de l'UNICEM. Tranche optionnelle 3 : Intégration des remarques des différentes consultations au projet de SRC pour produire le SRC final.",,CF_NIV_SUIV,,,CF_NIV_SUIV,,,CF_NIV_SUIV,,,CF_NIV_SUIV,,,,--None--,CF_NIV_SUIV,False,,,,False,CF_NIV_SUIV,,,,,,,,,False,CF_NIV_SUIV,,,,,,,CF_NIV_SUIV,False,False,False,False,False,,,,,CF_NIV_SUIV,,,,,,,,,,,,,,,,,,,,,,,,,,,,,,,,,,,,,,,,,,,,,,,,,,,,,,,,,,,,,
22-14629,,,CF_NIV_SUIV,CF_NIV_SUIV,True,False,False,CF_NIV_SUIV,False,False,,,,,Construction d'une chaufferie automatique au bois déchiqueté avec réseau de chaleur - Commune de FONTAINE FRANCAISE (21610),CF_NIV_SUIV,45232140.0,,CF_NIV_SUIV,,,,FRC11,CF_NIV_SUIV,,CF_NIV_SUIV,,,,,,,,,,,,,False,False,CF_NIV_SUIV,False,,CF_NIV_SUIV,False,False,,CF_NIV_SUIV,,,,,,,,CF_NIV_SUIV,,,CF_NIV_SUIV,,,CF_NIV_SUIV,,,,,,False,False,CF_NIV_SUIV,,,CF_NIV_SUIV,,,CF_NIV_SUIV,,,CF_NIV_SUIV,,,CF_NIV_SUIV,,,,--None--,CF_NIV_SUIV,False,,,,False,CF_NIV_SUIV,,,,,,,,,False,CF_NIV_SUIV,,,,,,,CF_NIV_SUIV,False,False,False,False,False,,,,,CF_NIV_SUIV,,,,,,,,,,,,,,,,,,,,,,,,,,,,,,,,,,,,,,,,,,,,,,,,,,,,,,,,,,,,,
22-14646,,,CF_NIV_SUIV,CF_NIV_SUIV,False,False,False,CF_NIV_SUIV,False,False,,,,,Assistance à maîtrise d'ouvrage pour la réalisation d'études et essais complémentaires autour du bassin de Paris,CF_NIV_SUIV,,,CF_NIV_SUIV,Bassin de Paris,76200.0,Dieppe,,CF_NIV_SUIV,,CF_NIV_SUIV,,,,,,,,,,,,,False,False,CF_NIV_SUIV,False,,CF_NIV_SUIV,False,False,,CF_NIV_SUIV,,,,,,,,CF_NIV_SUIV,,,CF_NIV_SUIV,,,CF_NIV_SUIV,,,,,,False,True,CF_NIV_SUIV,"Ports de Normandie souhaite déterminer les conditions d'exploitation des engins portuaires, sur les quais autour du bassin de Paris. Une campagne d'essais, de modélisation des quais, puis un recalcul a été menée entre 2013 et 2015 par la société ANTEA. Aujourd'hui, il est demandé de mettre à jour ces études, en les complétant par d'autres essais, sondages, dans le but de déterminer avec une plus grande précision les conditions d'exploitation des engins portuaires. Les quais concernés sont les quais autour du bassin de Paris, qui est le bassin de commerce du Port de Dieppe et plus précisément : - Le quai des Indes, - Le quai du Maroc, - Le quai de Québec. La prestation demandée a pour but d'établir les conditions d'exploitation des quais et de rédiger les consignes d'exploitation des 3 grues portuaires. Les principales charges d'exploitation liées au stockage sont des pièces d'éoliennes. Forme de marché : à tranches. Attribution d'un marché unique.","Prestations réparties en 5 tranches.TF Durée : 112 joursPrécisions : Le marché prend effet à sa notification et prendra fin à la validation du rapport définitif de la dernière tranche optionnelle.Le délai d'exécution de chaque tranche se décompose en 2 phases : - Phase 1 : Analyse des études existantes, définition d'un programme d'essais et de de sondages, rédaction des pièces de consultation : 6 semaines - Phase 2 : Analyse des essais et sondages, modélisation et recalcul des ouvrages, rédaction des consignes d'exploitation : 20 semainesLe délai d'exécution de chacune des phases et pour chaque tranche, court à compter de la date prescrite dans l'ordre de service de démarrage de la phase concernée, par dérogation à l'article 13 du CCAG PI.Le délai limite de notification des ordres de service prescrivant de commencer l'exécution des tranches optionnelles, à dater de la notification du marché, est de 24 mois. TO001 Durée : 112 jours TO002 Durée : 112 jours TO003 Durée : 112 jours TO004 Durée : 112 jours .",CF_NIV_SUIV,,,CF_NIV_SUIV,,,CF_NIV_SUIV,,,CF_NIV_SUIV,,,,--None--,CF_NIV_SUIV,False,,,,False,CF_NIV_SUIV,,,,,,,,,False,CF_NIV_SUIV,,,,,,,CF_NIV_SUIV,False,False,False,False,False,,,,,CF_NIV_SUIV,,,,,,,,,,,,,,,,,,,,,,,,,,,,,,,,,,,,,,,,,,,,,,,,,,,,,,,,,,,,,
22-15481,,,CF_NIV_SUIV,CF_NIV_SUIV,False,False,False,CF_NIV_SUIV,False,False,,,,16.0,Collecte et traitement des déchets pneumatiques pour les besoins duDépartement de l'Oise,CF_NIV_SUIV,90500000.0,,CF_NIV_SUIV,,,,FRE22,CF_NIV_SUIV,,CF_NIV_SUIV,,,,,,,,,,,,,False,True,CF_NIV_SUIV,False,,CF_NIV_SUIV,False,False,,CF_NIV_SUIV,,,,,,,,CF_NIV_SUIV,,,CF_NIV_SUIV,,,CF_NIV_SUIV,,,,,,False,False,CF_NIV_SUIV,,,CF_NIV_SUIV,,,CF_NIV_SUIV,,,CF_NIV_SUIV,,,CF_NIV_SUIV,,,,--None--,CF_NIV_SUIV,False,,,,False,CF_NIV_SUIV,,,,,,,,,False,CF_NIV_SUIV,,,,,,,CF_NIV_SUIV,False,False,False,False,False,,,,,CF_NIV_SUIV,,,,,,,,,,,,,,,,,,,,,,,,,,,,,,,,,,,,,,,,,,,,,,,,,,,,,,,,,,,,,
22-15481,,,CF_NIV_SUIV,CF_NIV_SUIV,False,False,False,CF_NIV_SUIV,False,False,,,,16.0,Collecte et traitement des déchets pneumatiques pour les besoins duDépartement de l'Oise,CF_NIV_SUIV,44613700.0,,CF_NIV_SUIV,,,,FRE22,CF_NIV_SUIV,,CF_NIV_SUIV,,,,,,,,,,,,,False,True,CF_NIV_SUIV,False,,CF_NIV_SUIV,False,False,,CF_NIV_SUIV,,,,,,,,CF_NIV_SUIV,,,CF_NIV_SUIV,,,CF_NIV_SUIV,,,,,,False,False,CF_NIV_SUIV,,,CF_NIV_SUIV,,,CF_NIV_SUIV,,,CF_NIV_SUIV,,,CF_NIV_SUIV,,,,--None--,CF_NIV_SUIV,False,,,,False,CF_NIV_SUIV,,,,,,,,,False,CF_NIV_SUIV,,,,,,,CF_NIV_SUIV,False,False,False,False,False,,,,,CF_NIV_SUIV,,,,,,,,,,,,,,,,,,,,,,,,,,,,,,,,,,,,,,,,,,,,,,,,,,,,,,,,,,,,,
22-15481,,,CF_NIV_SUIV,CF_NIV_SUIV,False,False,False,CF_NIV_SUIV,False,False,,,,16.0,Collecte et traitement des déchets pneumatiques pour les besoins duDépartement de l'Oise,CF_NIV_SUIV,19630000.0,,CF_NIV_SUIV,,,,FRE22,CF_NIV_SUIV,,CF_NIV_SUIV,,,,,,,,,,,,,False,True,CF_NIV_SUIV,False,,CF_NIV_SUIV,False,False,,CF_NIV_SUIV,,,,,,,,CF_NIV_SUIV,,,CF_NIV_SUIV,,,CF_NIV_SUIV,,,,,,False,False,CF_NIV_SUIV,,,CF_NIV_SUIV,,,CF_NIV_SUIV,,,CF_NIV_SUIV,,,CF_NIV_SUIV,,,,--None--,CF_NIV_SUIV,False,,,,False,CF_NIV_SUIV,,,,,,,,,False,CF_NIV_SUIV,,,,,,,CF_NIV_SUIV,False,False,False,False,False,,,,,CF_NIV_SUIV,,,,,,,,,,,,,,,,,,,,,,,,,,,,,,,,,,,,,,,,,,,,,,,,,,,,,,,,,,,,,
22-15717,Remplacement du poste électrique Malbousquet 63/10kV-50Hz dans la zone Malbousquet de la Base Navale de Toulon,,CF_NIV_SUIV,CF_NIV_SUIV,True,False,False,CF_NIV_SUIV,False,False,,,,,L'opération consiste au remplacement du poste électrique Malbousquet 63/10kV-50Hz dans la zone Malbousquet de la Base Navale de Toulon,CF_NIV_SUIV,45213250.0,,CF_NIV_SUIV,BASE NAVALE DE TOULON,83000.0,Toulon,FRL05,CF_NIV_SUIV,,CF_NIV_SUIV,,,,,,,,,,,,,False,False,CF_NIV_SUIV,False,,CF_NIV_SUIV,False,False,,CF_NIV_SUIV,,,,,,,,CF_NIV_SUIV,,,CF_NIV_SUIV,,,CF_NIV_SUIV,,,,,,True,False,CF_NIV_SUIV,,"Les travaux se décomposent en 3 phases techniques:Phase 1 - Etudes d'exécution et préparation du chantier;Phase 2 - Fabrication et essais usine;Phase 3 - Réalisation des exécutions sur site, essais et OPR.",CF_NIV_SUIV,,,CF_NIV_SUIV,,,CF_NIV_SUIV,,,CF_NIV_SUIV,,,,--None--,CF_NIV_SUIV,True,"<?xml version=""1.0"" encoding=""UTF-16""?>
<DESCRIPTION xmlns:xsi=""http://www.w3.org/2001/XMLSchema-instance"">Opportunité d'une clause de réexamen R. 2394-1</DESCRIPTION>",,,False,CF_NIV_SUIV,,,,,,,,,True,CF_NIV_SUIV,24.0,,,,,,CF_NIV_SUIV,False,False,False,False,True,,,,,CF_NIV_SUIV,,,,,,,,,,,,,,,,,,,,,,,,,,,,,,,,,,,,,,,,,,,,,,,,,,,,,,,,,,,,,
22-15764,,,CF_NIV_SUIV,CF_NIV_SUIV,True,False,False,CF_NIV_SUIV,False,False,,,,,"Numéro de la consultation : 2021-MGN-T002 Entretien, réparations et petits travaux neufs dans les piscines métropolitaines",CF_NIV_SUIV,45240000.0,,CF_NIV_SUIV,,,,FRF31,CF_NIV_SUIV,,CF_NIV_SUIV,,,,,,,,,,,,,False,False,CF_NIV_SUIV,False,,CF_NIV_SUIV,False,False,,CF_NIV_SUIV,,,,,,,,CF_NIV_SUIV,,,CF_NIV_SUIV,,,CF_NIV_SUIV,,,,,,False,False,CF_NIV_SUIV,,,CF_NIV_SUIV,,,CF_NIV_SUIV,,,CF_NIV_SUIV,,,CF_NIV_SUIV,,,,--None--,CF_NIV_SUIV,False,,,,False,CF_NIV_SUIV,,,,,,,,,False,CF_NIV_SUIV,,,,,,,CF_NIV_SUIV,False,False,False,False,False,,,,,CF_NIV_SUIV,,,,,,,,,,,,,,,,,,,,,,,,,,,,,,,,,,,,,,,,,,,,,,,,,,,,,,,,,,,,,
22-15764,,,CF_NIV_SUIV,CF_NIV_SUIV,True,False,False,CF_NIV_SUIV,False,False,,,,,"Numéro de la consultation : 2021-MGN-T002 Entretien, réparations et petits travaux neufs dans les piscines métropolitaines",CF_NIV_SUIV,45259000.0,,CF_NIV_SUIV,,,,FRF31,CF_NIV_SUIV,,CF_NIV_SUIV,,,,,,,,,,,,,False,False,CF_NIV_SUIV,False,,CF_NIV_SUIV,False,False,,CF_NIV_SUIV,,,,,,,,CF_NIV_SUIV,,,CF_NIV_SUIV,,,CF_NIV_SUIV,,,,,,False,False,CF_NIV_SUIV,,,CF_NIV_SUIV,,,CF_NIV_SUIV,,,CF_NIV_SUIV,,,CF_NIV_SUIV,,,,--None--,CF_NIV_SUIV,False,,,,False,CF_NIV_SUIV,,,,,,,,,False,CF_NIV_SUIV,,,,,,,CF_NIV_SUIV,False,False,False,False,False,,,,,CF_NIV_SUIV,,,,,,,,,,,,,,,,,,,,,,,,,,,,,,,,,,,,,,,,,,,,,,,,,,,,,,,,,,,,,
