22-8139,Commune de Pierres,None,Daniel MORIN,,,1 place Jean Moulin,28130,Pierres,,,,,,,,,,,,False,False,,False,False
22-8142,Saint-Brieuc Agglomération,None,M. le Président de Saint-Brieuc Armor Agglomération,,,"5, rue du 71ème Régiment d'infanterie CS 54403",22000,Saint-Brieuc,,02-96-77-20-00,,,marchespublics@sbaa.fr,https://www.saintbrieuc-armor-agglo.fr,http://https:/www.marches.megalisbretagne.bzh,,,,,False,False,,False,False
22-8151,GHT Cévennes-Gard-Camargue,None, Direction des ressources matérielles,,,Place du Professeur Robert Debré,30029,NIMES,,,,,correspondre@aws-france.com,http://www.chu-nimes.fr/,https://www.agysoft.marches-publics.info,,,,,False,False,,False,False
22-8154,Commune de Kembs,None,M. Le Maire,,,5 rue de Saint-Louis,68680,Kembs,,,,,,,,,,,,False,False,,False,False
22-8155,Ville de Sainte-Adresse,None, COQUIN,,,1 rue Albert Dubosc,76310,SAINTE-ADRESSE,,02-35-54-07-81,,,romain.rudaux@sainte-adresse.fr,http://ville-saint-adresse.e-marchespublics.com,http://ville-saint-adresse.e-marchespublics.com,,,,,False,False,,False,False
22-8157,CommunAupole de Lens-Liévin,None,M. le Président de la Communauté d'Agglomération Lens-Liévin,,,21 rue Marcel Sembat,62302,Lens Cedex,,,,,mcp@agglo-lenslievin.fr,http://www.agglo-lenslievin.fr,http://www.achatpublic.com,,,,,False,False,,False,False
22-8159,Régie des Eaux de Montpellier 3M,None,Regie des Eaux Montpellier 3 M,,,391 rue de la Font FroideCS 9038134197 MONTPELLIER Cedex 5,34197,Montpellier,,,,,marches@regiedeseaux.montpellier3m.fr,,http://marches.montpellier3m.fr,,,,,False,False,,False,False
22-8163,Mairie de Béthune,None," GACQUERRE Olivier, Maire",,,6 Place du 4 septembre 1944 BP 10711,62407,BETHUNE,,,,,correspondre@aws-france.com,https://www.ville-bethune.fr,http://agysoft.marches-publics.info/,,,,,False,False,,False,False
22-8164,Centre Communal d'Action Sociale,None,Mme la Présidente,,,"Hôtel de Ville, Place de la République",92300,Levallois-Perret,,,,,marches@ville-levallois.fr,http://www.ville-levallois.fr,http://www.ville-levallois.fr,,,,,False,False,,False,False
22-8166,COMMUNE DE BRINDAS,None," JEAN FREDERIC, MAIRE",,,18 PLACE DE VERDUN,69126,BRINDAS,,04-78-16-02-00,,,correspondre@aws-france.com,http://www.brindas.fr/,http://agysoft.marches-publics.info/,,,,,False,False,,False,False
22-8167,COMMUNE DE YERRES,None," CLODONG Olivier, Maire",,,60 rue Charles de Gaulle,91330,YERRES,,01-69-49-77-42,,,correspondre@aws-france.com,http://www.yerres.fr,http://agysoft.marches-publics.info/,,,,,False,False,,False,False
22-817,Commune d'Hautmont,None," WILMOTTE Stéphane, Maire",,,Place Charles de Gaulle BP 20099,59330,Hautmont,,03-27-63-64-70,,03-27-63-64-80,correspondre@aws-france.com,https://www.mairie-hautmont.fr/,http://agysoft.marches-publics.info/,,,,,False,False,,False,False
22-8172,Conseil départemental du Pas-de-Calais,None,Conseil départemental,,,Hôtel du Département Rue Ferdinand Buisson,62018,Arras,,03-21-21-67-30,,,dcp.secretariat@pasdecalais.fr,http://marchespublics596280.fr,http://marchespublics596280.fr,,,,,False,False,,False,False
22-8185,CAISSE PRIMAIRE D ASSUR MALADIE ISERE,None,Acheteur Public,,,2 rue des Alliés,38045,Grenoble,,04-56-85-53-14,,,consultation-achats.cpam-isere@assurance-maladie.fr,https://www.ameli.fr,https://www.achatpublic.com,,,,,False,False,,False,False
22-820,COMMUNE DE BOULOGNE BILLANCOURT,None,Mme Etienne Gaelle,,,26 avenue André Morizet,92104,Boulogne billancourt,,,,,marches.publics@mairie-boulogne-billancourt.fr,http://www.boulognebillancourt.com,https://marches.maximilien.fr,,,,,False,False,,False,False
22-8204,COMMUNE DE MARQUILLIES,None,"M. DHENNIN Dominique, Maire",,,126 Place Léon Bocquet,59274,Marquillies,,03-20-29-00-09,,03-20-49-96-63,mairiemarquillies@marquillies.com,,,,,,,False,False,,False,False
22-8211,CNAMTS,None,Mme Sybil CLAIRE,,,50 av Prof André Lemierre,75986,Paris cedex 20,,01-72-60-21-17,,,sybil.claire@assurance-maladie.fr,http://Achatpublic.com,https://www.achatpublic.com/sdm/ent/gen/index.jsp,,,,,False,False,,False,False
22-8219,Réseau Canopé,None,"M. JOSSAUD Alain, Réseau Canopé",,,1 avenue du Futuroscope,86961,Futuroscope,,05-49-49-78-78,,,,,,,,,,False,False,,False,False
22-8228,Ville de Besançon,None,Mme Anne VIGNOT,,,2 rue Mégevand,25034,Besançon Cedex,,03-81-87-50-50,,03-81-61-50-99,besancon@besancon.fr,http://www.besancon.fr,http://www.marches-securises.fr,,,,,False,False,,False,False
22-8232,SCE DEPARTEMENTAL INCENDIE ET SECOURS,None, Mr Le Président du Conseil d'Administration du SDIS du Gard,,,281 avenue PavlovBP 48069,30932,Nîmes cedex 09,,(+33) 4-66-63-36-00,,,marches-publics@sdis30.fr,http://www.sdis30.fr,https://www.marches-securises.fr,,,,,False,False,,False,False
22-8235,SYNDICAT MIXTE SOMME NUMERIQUE,None,"M. Baziz Sabri, Syndicat Mixte Somme Numérique",,,"43 avenue d'Italie,",80090,Amiens,,03-22-22-27-21,,03-22-22-03-57,,https://www.sommenumerique.fr,,,,,,False,False,,False,False
22-824,E.P.S. Barthélémy Durand,None,M. Directeur Le,,,Avenue du 8 mai 1945,91150,Etampes,,01-69-92-52-52,6806.0,,marches-dalh@eps-etampes.fr,https://www.eps-etampes.fr,https://www.marches-securises.fr,,,,,False,False,,False,False
22-8242,GCSMS PASAPAH,None,Kevin Le Rolland,,,81 Av Adolphe Schneider,92140,Clamart,,,,,direction@ehpad-renaudin.fr,,https://marches.fhf.fr/appel.php?ID_Appel=15311&&tri=Date_Limite&page=3,,,,,False,False,,False,False
22-8247,MINARM/EMA/SCA/PFAF-CE/BAP,None,"M. BARROIS Damien, MINARM/EMA/SCA/PFC-SE/DAP",,,BP 90226,69362,Lyon cédex 07,,04-37-27-35-12,,,,,,,,,,False,False,,False,False
22-8249,METROPOLE EUROPEENNE DE LILLE,None,Mme Ernst Roxane,,,2 boulevard des cités unies,59800,Lille,,03-20-21-20-14,,,,,https://marchespublics596280.fr,,,,,False,False,,False,False
22-8256,ESCOTA,None,Service Marchés et Contrats,,,432 avenue de Cannes - BP 41,06210,Mandelieu cedex,,04-93-48-50-00,,,marches.escota@vinci-autoroutes.com,http://www.vinci-autoroutes.com,https://consultations-escota.omnikles.com,,,,,False,False,,False,False
22-8258,Ville de Villefranche-sur-saône,None, le Maire,,,183 rue de la Paix BP 70419,69653,Villefranche-sur-Saône,,,,,fjourdan@villefranche.net,http://www.villefranche.net,http://www.marches-publics.info,,,,,False,False,,False,False
22-8264,CENTRE HOSPITALIER GENERAL DE CHARTRES,None," BEST Pierre, Directeur du Centre Hospitalier",,,"34, rue du docteur Maunoury BP 30407",28018,Chartres,,02-37-30-30-20,,02-37-30-31-17,correspondre@aws-france.com,http://www.ch-chartres.fr/,https://agysoft.marches-publics.info/,,,,,False,False,,False,False
22-8266,COMMUNAUTE COMMUNES VALLEE DU GARON,None,"Mme GAUQUELIN Françoise, Présidente",,,"Parc d'activités de Sacuny, 262 rue Barthélémy Thimonnier",69530,BRIGNAIS,,04-72-31-38-99,,,correspondre@aws-france.com,http://www.ccvalleedugaron.com,http://www.marches-publics.info,,,,,False,False,,False,False
22-8275,TAM - Transports Agglo Montpellier,None," SILBERZAHN Nicolas, Directeur Général Délégué",,,"125 Rue Léon Trotski, CS60014",34075,MONTPELLIER,,,,,marches@tam-way.com,http://www.tam-voyages.com,http://www.tam-voyages.com,,,,,False,False,,False,False
22-8276,Syndicat Mixte Manche Numérique,None," DELAUNAY Antoine, Président",,,"235 rue Joseph Cugnot, Zone Delta",50000,Saint LO,,,,,commandepublique@manchenumerique.fr,http://manchenumerique.fr,http://marchespublicsmanche.fr,,,,,False,False,,False,False
22-8278,CONSTRUCTYS,None,"Mme LEYRE Sylvie, Administratrice provisoire",,,32 Rue René BOULANGER,75010,Paris,,01-82-83-95-00,,,achats@constructys.fr,http://www.constructys.fr,http://www.marches-publics.info/accueil.htm,,,,,False,False,,False,False
22-8288,Ecole National Sup. d'Arts et Métiers,None,Mme Joseph Lovely,,,151 boulevard de l'hôpital,75013,Paris,,,,,sacp@ensam.eu,,,,,,,False,False,,False,False
22-8292,Centre hospitalier de la côte basque,None,"Mme MOULIN Mélanie, Centre hospitalier de la côte basque",Cellule des marchés,,13 avenue de l'interne jacques loëb,64109,Bayonne cedex,,05-59-44-31-06,,,gestion.marches@ch-cotebasque.fr,,,,,,,False,False,,False,False
22-8297,C.G.O.S,None,"M. Ramon Benoit, Acheteur",,,101 rue de Tolbiac,75654,Paris cedex 13,,,,,,,https://www.achatpublic.com/sdm/ent/gen/index.jsp,,,,,False,False,,False,False
22-8299,CHD VENDEE,None,"M. SAINT-HUBERT Francis, Directeur Général",,,Les Oudairies,85925,La roche sur yon cedex 9,,02-51-08-59-61,,,marches@chd-vendee.fr,http://www.marches-publics.gouv.fr,,,,,,False,False,,False,False
22-8321,COMMUNE DE CHATENAY MALABRY,None, PUBLIQUE COMMANDE,,,26 rue du Docteur Le Savoureux,92290,Chatenay-malabry,,,,,commande-publique@chatenay-malabry.fr,http://www.chatenay-malabry.fr/,https://marches.maximilien.fr/?page=Entreprise.EntrepriseAdvancedSearch&AllCons&id=794828&orgAcronyme=d7p,,,,,False,False,,False,False
22-8327,COMMUNAUTE AGGLO PORTES DE FRANCE,None,"Mme POUGET Clémence, Maire",,,107 Grand Rue,57970,YUTZ,,03-82-82-26-82,,,marchespublics@mairie-yutz.fr,http://www.mairie-yutz.fr,http://www.marches-publics.info/acheteur/caportesdefrancethionville/,,,,,False,False,,False,False
22-833,SDIS 52,None, Monsieur Nicolas LACROIX,,,29 rue du Vieux Moulin,52000,CHAUMONT,,,,,,,https://www.xmarches.fr/entreprise/detailConsultation.php?key=20361,,,,,False,False,,False,False
22-8330,DEPARTEMENT DU DOUBS,None,"Mme BOUQUIN Christine, Présidente du Département",,,"Hôtel du Département, 7 avenue de la Gare d'Eau",25031,BESANCON Cedex,,03-81-25-81-25,,03-81-25-81-01,correspondre@aws-france.com,https://www.doubs.fr/,https://www.marches-publics.info,,,,,False,False,,False,False
22-8333,Communauté d'Agglomération d'Aurillac,None, Monsieur le Président,,,"3, Place des Carmes BP 501",15005,AURILLAC,,,,,correspondre@aws-france.com,https://www.caba.fr/,https://www.achatpublic.com/,,,,,False,False,,False,False
22-8337,COMMUNE DE MALAUNAY,None," COUTEY Guillaume, Maire",,,Place de la laïcité,76770,MALAUNAY,,,,,achats@malaunay.fr,http://www.malaunay.fr,https://www.mpe76.fr/,,,,,False,False,,False,False
22-8338,Ville de Montluçon,None," LAPORTE Frédéric, Maire",,,"Cité Administrative , Esplanade Georges Pompidou, 1, rue des Conches",03106,Montlucon,,04-70-02-55-00,,,correspondre@aws-france.com,http://www.montlucon.com,http://agysoft.marches-publics.info,,,,,False,False,,False,False
22-8340,Cté de Cnes des Vallées de Thônes,None," FOURNIER-BIDOZ Gérard, Président",,,"4, Rue du Pré de Foire",74230,THÔNES,,04-50-32-13-59,,,urba@ccvt.fr,http://www.ccvt.fr,,,,,,False,False,,False,False
22-8341,Département de l'Aude,None,Madame la Présidente du Conseil Départemental de l'Aude,,,Allée Raymond Courrière,11855,CARCASSONNE CEDEX 9,,,,,marches@aude.fr,http://www.marchespublics.aude.fr,,,,,,False,False,,False,False
22-8342,TAM - Transports Agglo Montpellier,None," SILBERZAHN Nicolas, Directeur Général Délégué",,,"125 Rue Léon Trotski, CS60014",34075,MONTPELLIER,,,,,marches@tam-way.com,http://www.tam-voyages.com,http://www.tam-voyages.com,,,,,False,False,,False,False
22-8344,CHAMBRE DE METIERS ET DE L'ARTISANAT,None," MARTINELLI JEAN CHARLES PASCAL, PRESIDENT",,,"CHEMIN DE LA SPOSATA, QUARTIER BACCIOCHI BP 40958",20700,AJACCIO,,,,,correspondre@aws-france.com,http://crma-corse.fr/,https://agysoft.marches-publics.info/,,,,,False,False,,False,False
22-8350,Ville d'Annecy,None, Monsieur le Maire,,,Esplanade de l'Hôtel-de-Ville BP 2305,74011,Annecy,,04-50-33-65-59,,,marchespublics@annecy.fr,http://www.annecy.fr,http://www.annecy.fr,,,,,False,False,,False,False
22-8351,Ville de Nîmes,None,M. Le Maire,,,Direction de la Commande Publique - Colisée 2 - 1er étage - 1 rue du Colisée 30947 Nîmes Cedex 9,30947,Nîmes Cedex 9,,(+33)4-34-03-57-00,,,,http://www.marches-securises.fr,http://www.marches-securises.fr,,,,,False,False,,False,False
22-8359,Université de Toulouse,None,"Mme COSNARD Cassandre, Chargée des achats et des marchés publics",,,41 Allées Jules Guesdes - BP 61321,31013,Toulouse cedex 6,,05-61-14-58-49,,,,,,,,,,False,False,,False,False
22-8371,Ville de Laon,None,service marchés publics,,,Place du Général Leclerc,02000,Laon,,03-23-22-85-61,,,marchespublics@ville-laon.fr,http://marches.ville-laon.fr,https://www.xmarches.fr,,,,,False,False,,False,False
22-8381,Groupement de Commandes EPSMR - CHGM,None, GROUPE. HOSPITALIER TERRITOIRE (GHT),,,"PA : M. LIONEL CALENGE, Directeur CHU Suivi - Exécution marché : EPSM",97400,SAINT DENIS,RE,(+33) 2-62-74-01-32,,(+33) 2-62-74-01-37,cellule.marches@gcs-gso.org,https://www.marches-securises.fr,,,,,,False,False,,False,False
22-84,SHEMA,None,SHEMA - Au nom et pour le compte de la société investisseur,,,Les Rives de l'Orne15 Avenue Pierre Mendès France,14018,Caen,,,,,,,,,,,,False,False,,False,False
22-8409,COM D AGGLO REG NAZAIRIENNE ESTUAIRE,None," SAMZUN DAVID, Monsieur le Président",,,4 av. du Commandant l'Herminier,44605,Saint-Nazaire,,,,02-40-00-40-38,marchespublics@agglo-carene.fr,http://www.agglo-carene.fr/,http://www.agglo-carene.fr/demarches-et-infos-pratiques/marches-publics-414.html,,,,,False,False,,False,False
22-8417,REGIE T2C,None, le Directeur Général,,,"17, Boulevard Robert Schuman, CS 10009",63063,CLERMONT-FERRAND,,,,,marches.publics@t2c.fr,http://www.t2c.fr,http://www.t2c.fr,,,,,False,False,,False,False
22-8423,CAGrand Paris Sud Seine Essonne Sénart,None,"M. Hartz Jean, Vice-président à la commande publique",,,500 Place des Champs-Elysées BP 62 Courcouronnes,91054,Evry courcouronnes cedex,,01-69-91-58-58,,,commande.publique@grandparissud.fr,http://www.grandparissud.fr,https://www.achatpublic.com/sdm/ent/gen/index.jsp,,,,,False,False,,False,False
22-8443,Ville de Nîmes,None,M. Le Maire,,,Direction de la Commande PubliqueLe Colisée II1 rue du Colisée1er étage,30947,Nîmes Cedex 9,,(+33)4-34-03-57-00,,,commande-publique@ville-nimes.fr,http://www.marches-securises.fr,http://www.marches-securises.fr,,,,,False,False,,False,False
22-8448,Commune de Sevran,None,M. Le Maire de sevran,,,28 avenue du Général Leclerc,93270,Sevran,,01-49-36-52-34,,,grp_marches_publics@ville-sevran.fr,http://www.ville-sevran.fr,http://marches.maximilien.fr,,,,,False,False,,False,False
22-8461,CC DU SISTERONAIS BUECH,None," SPAGNOU Daniel, Le Président",,,"1, place de la république",04200,SISTERON,,04-92-31-27-52,,,marches.publics@sisteronais-buech.fr,http://www.sisteronais-buech.fr/,,,,,,False,False,,False,False
22-8462,Nantes Métropole,None,Mme la Présidente,,,2 Cours du Champ de Mars,44929,Nantes cedex9,,,44094.0,,gaelle.duclau@nantesmetropole.fr,http://www.metropole.nantes.fr,https://marchespublics.nantesmetropole.fr,,,,,False,False,,False,False
22-8463,METROPOLE ROUEN NORMANDIE,None," MAYER-ROSSIGNOL Nicolas, Président",,,"Le 108, 108 allée François Mitterrand BP 1180",76176,ROUEN,,02-32-76-44-22,,02-32-76-44-29,demat.marches@metropole-rouen-normandie.fr,http://www.metropole-rouen-normandie.fr/,https://www.mpe76.fr,,,,,False,False,,False,False
22-8465,Ville de Bourg-en-Bresse,None,Laetitia ROLLET,,,Place de l'hôtel de Ville B.P. 90419,01012,Bourg-en-Bresse Cedex,,04-74-45-72-48,,,dematmp@bourgenbresse.fr,http://www.bourgenbresse.fr,http://marchespublics.ain.fr,,,,,False,False,,False,False
22-851,OPH - Var Habitat,None, le Directeur Général -c/o serv.marchés,,,BP29,83040,Toulon,,04-94-61-55-00,,,service-marches@varhabitat.com,http://www.varhabitat.com/,http://www.marches-publics.info,,,,,False,False,,False,False
22-8510,Société Aéroports de la Côte d'Azur,None,Département Achats,,,Rue Costes et BellonteBP 3331,06206,Nice Cedex 3,,,,,achats@cote-azur.aeroport.fr,https://achats.nice.aeroport.fr/,,,,,,False,False,,False,False
22-8512,SOLOREM,None,M. Rémi BEUVE,,,agissant au nom et pour le compte de la Région Grand-Est1 rue Jacques Villermaux - BP 33730,54098,Nancy cedex,,,,,,,,,,,,False,False,,False,False
22-8518,FEDERATION FRANCAISE RUGBY,None,Alexandre Anginot,,,3-5 rue Jean de Montaigu,91463,Marcoussis Cedex,,,,,alexandre.anginot@ffr.fr,,https://www.ffr.fr/ffr/publications-officielles/avis-dappel-a-la-concurrence,,,,,False,False,,False,False
22-8519,Campagne de Caux,None, GODEFROY Adeline,,,"ZA - Route de Bolbec, 52 Impasse du Lin",76110,Goderville,,02-35-29-29-12,,02-35-29-06-06,a.godefroy@campagne-de-caux.fr,http://www.campagne-de-caux.fr/,http://www.campagne-de-caux.fr/,,,,,False,False,,False,False
22-8522,COMMUNAUTE D AGL LA RIVIERA DU LEVANT,None, Stéphanie PELMARD,,,93 Boulevard du Général De GaulleBP 63,97190,LE GOSIER,,(+33) 5-90-48-47-47,,,spelmard@rivieradulevant.fr,https://www.rivieradulevant.fr/,,,,,,False,False,,False,False
22-8527,Commune de Saint-nom-la-Bretèche,None,"M. GILLES STUDNIA, MAIRE",,,32 rue de la Fontaine des Vaux,78330,Saint-nom-la-bretèche,,,,,,,,,,,,False,False,,False,False
22-8531,Nanterre Coop Habitat,None,Azhar FALA,,,"93 Av. Frederic et Irene Joliot Curie, 92000 Nanterre",92000,Nanterre,,,,,marches-publics@nanterre-coop-habitat.fr,https://www.nanterre-coop-habitat.fr/,https://marches.maximilien.fr/?page=Frame.ConsultationsOrganisme&org=a3v,,,,,False,False,,False,False
22-8536,MINARM/DGA/DO/S2A,FR 34 152 000 527 ,Service des achats d'armement - Division achat TER,Acheteur négociateur,,Ministère des armées - Direction générale de l'armement - Direction des opérations - Service des achats d'armement / division achats NBC-TER DGA/DO/S2A/PROD/DA-NBC-TER - 60 Boulevard du Général Martial Valin - CS 21 623,75509,Paris cedex 15,,,,,dga-do-s2a-da-nbc-ter.ach.fct@intradef.gouv.fr,http://www.ixarm.com,http://www.marches-publics.gouv.fr,http://www.ixarm.com,http://www.marches-publics.gouv.fr,,,False,False,,False,False
22-8542,GRAND PORT FLUVIO-MARITIME DE L'AXE S,None,M. Directeur Général Le,,,71 quai Colbert,76600,Le havre,,,,,haropaportmarches@haropaport.com,,,,,,,False,False,,False,False
22-8549,COMMUNE D ECULLY,None, MICHEL Sébastien,,,"1 place de la Libération, CS 80212",69134,ECULLY,,04-72-18-10-45,,,marches-publics@ville-ecully.fr,http://www.ecully.fr,https://www.marches-publics.info/fournisseurs.htm,,,,,False,False,,False,False
22-855,CHU DE BORDEAUX,None," DIRECTEUR LE, Directeur Général",,,12 rue Dubernat,33400,TALENCE,,,,,ugc@chu-bordeaux.fr,https://www.chu-bordeaux.fr,https://www.marches-publics.info,,,,,False,False,,False,False
22-8550,COM COM PAYS RHIN BRISACH,None,M. HUG GÉRARD,,,"16, Rue de Neuf-Brisach",68600,Volgelsheim,,03-89-72-56-49,,03-89-72-95-30,marches.ccprb@paysrhinbrisach.fr,http://www.paysrhinbrisach.fr,http://www.klekoon.com,,,,,False,False,,False,False
22-8558,SEPD,None," PUISSESSEAU Jean Marc, PDG",,,24 boulevard des Alliés,62100,Calais,,03-21-99-62-58,,,marie.sumera@portboulognecalais.fr,https://www.portboulognecalais.fr,https://agysoft.marches-publics.info,,,,,False,False,,False,False
22-8559,DEPARTEMENT DE LA SAVOIE,None, LE POUVOIR ADJUDICATEUR,,,"Château des Ducs de Savoie, CS 31802",73018,CHAMBERY,,04-79-96-73-73,,,correspondre@aws-france.com,http://www.savoie.fr,http://www.savoie.fr/marches-publics,,,,,False,False,,False,False
22-8573,Conseil général d'Eure et Loir,None, Le Président,,,DCPAJA - Service de l'achat public,28028,CHARTRES,,,,,dcpaja.sap@eurelien.fr,http://www.eurelien.fr,http://www.eurelien.fr/marches-publics,,,,,False,False,,False,False
22-8576,DEPARTEMENT DE LA MANCHE,None," Morin Jean, Président du conseil départemental",,,98 Route de Candol,50050,Saint-Lo,,02-33-05-55-50,,,correspondre@aws-france.com,http://marchespublicsmanche.fr,http://marchespublicsmanche.fr,,,,,False,False,,False,False
22-8586,DRSID Lyon,None,"Mme DE CROZALS Roselyne, MINDEF/SGA/DCSID/ESID Lyon",,,BP 97423,69347,Lyon cedex 07,,04-37-27-31-35,,04-37-27-35-15,,,,,,,,False,False,,False,False
22-8597,CdC Montesquieu,None,"M. FATH Bernard, Président",,,1 allée Jean Rostand,33650,Martillac,,,,,marches@cc-montesquieu.fr,https://www.cc-montesquieu.fr,,,,,,False,False,,False,False
22-8611,SPL EURALILLE,None,"Mme Duwez Fabienne, Directrice générale",,,Tour de Lille - 18ème étage Boulevard de Turin,59777,Euralille,,03-20-12-54-70,,,contact@spl-euralille.fr,,,,,,,False,False,,False,False
22-8613,Musée du Louvre,None,"Mme Froment Elodie, Juriste",,,"DFJM, Service de la commande publique Pavillon Mollien",75058,Paris cedex 01,,01-40-20-67-24,,01-40-20-57-28,elodie.froment@louvre.fr,http://www.louvre.fr/,https://www.marches-publics.gouv.fr/?page=entreprise.EntrepriseAdvancedSearch&AllCons&refConsultation=717622&orgAcronyme=f5j,,,,,False,False,,False,False
22-8615,DEPARTEMENT DU CALVADOS,None, Clotilde GOURNAY,,,9 rue Saint-Laurent,14000,Caen,,(+33) 2-31-57-14-14,,,clotilde.gournay@calvados.fr,https://www.marches-securises.fr,https://www.calvados.fr,,,,,False,False,,False,False
22-862,DEPARTEMENT DE LA GIRONDE,None," GLEYZE Jean-Luc, Président du Conseil départemental",,,"Esplanade Charles de Gaulle, CS 71223",33074,Bordeaux,,05-56-99-33-33,,,dgar-dasj-scp@gironde.fr,http://www.gironde.fr,http://www.marches-publics.gironde.fr/,,,,,False,False,,False,False
22-8621,COM DE COMMUNES DE MILLAU GDS CAUSSES,None,Mme Présidente La,,,1 place du beffroi CS80432,12104,Millau cedex,,05-65-61-40-20,,,commande-publique@cc-millaugrandscausses.fr,http://www.e-occitanie.fr,,,,,,False,False,,False,False
22-8622,DRSID Lyon,None,"Mme DE CROZALS Roselyne, MINDEF/SGA/DCSID/ESID Lyon",,,BP 97423,69347,Lyon cedex 07,,04-37-27-31-35,,04-37-27-35-15,roselyne.de-crozals@intradef.gouv.fr,https://marches-publics.gouv.fr,,,,,,False,False,,False,False
22-8625,Ecole Nationale Supérieure des Mines,None,M. GIRARD Alain,,,60 bld Saint-Michel,75272,Paris cedex 06,,01-40-51-94-35,,,bureaumarches@mines-paristech.fr,https://www.minesparis.psl.eu/,https://www.achatpublic.com/sdm/ent/gen/index.jsp,,,,,False,False,,False,False
22-8626,Rennes Métropole,None, Secrétariat Direction de l'Assainissement,,,CS 93111 - Chemin de la Prévalaye,35031,RENNES CEDEX,,02-23-62-24-10,,02-23-62-24-19,assainissement@rennesmetropole.fr,http://metropole.rennes.fr/,https://marches.megalis.bretagne.bzh,,,,,False,False,,False,False
22-8628,Rennes Métropole,None, Secrétariat Direction de l'Assainissement,,,CS 93111 - Chemin de la Prévalaye,35031,RENNES CEDEX,,02-23-62-24-10,,02-23-62-24-19,assainissement@rennesmetropole.fr,http://metropole.rennes.fr/,https://marches.megalis.bretagne.bzh,,,,,False,False,,False,False
22-8647,SYND DU BSN RIVIERES ANGOUMOIS SYBRA,None, le Président,,,Le Paradis,16430,Balzac,,05-45-38-16-71,,,contact@sybra.fr,http://www.rivieres-angoumois.fr,,,,,,False,False,,False,False
22-8649,Grand Belfort Communauté d'Agglomérati,None," MESLOT DAMIEN, Président",,,Place d'Armes,90020,BELFORT,,,,,correspondre@aws-france.com,http://www.grandbelfort.fr/,https://marches-grandbelfort.safetender.com,,,,,False,False,,False,False
22-8655,Ville d'Albertville,None, le Maire,,,"Service de la Commande Publique, 12 cours de l'Hôtel de Ville, CS 60104",73207,ALBERTVILLE,,04-79-10-43-00,,,commande.publique@albertville.fr,http://www.albertville.fr,http://www.marches-publics.info,,,,,False,False,,False,False
22-8659,Département de la Haute Saône,None," Publique Commande, SAAJCP",,,23 rue de la Préfecture CS 20349,70006,Vesoul cedex,,03-84-95-74-19,,,commandepublique@haute-saone.fr,http://www.haute-saone.fr,https://www.achatpublic.com/sdm/ent/gen/index.jsp,,,,,False,False,,False,False
22-8664,Caisse de Crédit Municipal de Nîmes,None, Patricia UHLMANN,,,"8 bis, rue Guizot",30013,Nîmes cedex,,04-66-36-62-86,,,secretariat-general@credit-municipal-nimes.fr,http://www.credit-municipal-nimes.fr,http://www.credit-municipal-nimes.e-marchespublics.com,,,,,False,False,,False,False
22-8668,Ville de Draguignan (83),None, Monsieur le Maire,,,28 Rue Georges Cisson,83300,Draguignan,,(+33) 4-94-60-20-94,,(+33) 4-94-67-33-87,mp@ville-draguignan.fr,http://www.ville-draguignan.fr,https://www.marches-securises.fr,,,,,False,False,,False,False
22-8684,CIG Petite Couronne,None,"M. KERGOAT Geoffrey, Chargé de commande publique",,,1 rue Lucienne Gérain,93698,Pantin cedex,,01-56-96-80-80,,,,,,,,,,False,False,,False,False
22-8685,MINDEF/SGA/DCSID/ESID.TOULON,None,,HUNAUT Sylvie,,BCRM TOULON - ESID TLN - Boîte postale no 71,83800,Toulon cedex 9,,(+33) 4-22-42-24-68,,(+33) 4-22-43-44-09,esid-toulon-sai.secretariat.fct@intradef.gouv.fr,,https://www.marches-publics.gouv.fr,,,,,False,False,,False,False
22-8686,COM UNIVERSITES ETS UNIV BOURGOGNE FRA,None,"Mme BERAL Clarisse, COMUE UBFC",,,32 AVENUE DE L'OBSERVATOIRE,25000,Besancon,,03-63-08-26-42,,,,,,,,,,False,False,,False,False
22-869,Commune de Tournefeuille,None,M. Deveaux Jean-Noel,,,Place de l'Hotel de Ville,31170,Tournefeuille,,,,,,,https://www.achatpublic.com/sdm/ent/gen/index.jsp,,,,,False,False,,False,False
22-8705,CENTRE EVENEMENTIEL ET CULTUREL,None, Le Représentant du Pouvoir Adjudicateur,,,"2 rue de l'hôtel de ville, Mairie de Courbevoie",92400,COURBEVOIE,,,,,m.gavrilova@cec92.com,http://www.sortiracourbevoie.com/,,,,,,False,False,,False,False
22-8706,COMMUNE DE PONT DU CHATEAU,None," PERRIN Patrick, Mairie",,,"Place de l'hôtel de ville, CS90002",63430,Pont-du-Château,,04-73-83-73-55,,,commandepublique@pontduchateau.net,http://pontduchateau.fr/,https://agysoft.marches-publics.info/,,,,,False,False,,False,False
22-8710,Ville de Rennes,None,"Mme APPERE Nathalie, Maire",,,Place de la Mairie,35000,RENNES,,,,,correspondre@aws-france.com,https://metropole.rennes.fr/,https://www.megalis.bretagne.bzh,,,,,False,False,,False,False
22-8712,DEPARTEMENT DE LA SAVOIE,None, LE POUVOIR ADJUDICATEUR,,,"Château des Ducs de Savoie, CS 31802",73018,CHAMBERY,,04-79-96-73-73,,,correspondre@aws-france.com,http://www.savoie.fr,http://www.savoie.fr/marches-publics,,,,,False,False,,False,False
22-8714,Conseil départemental de l'Hérault,None," MESQUIDA Kléber, Président du Conseil départemental",,,"Hôtel du département, Mas d'Alco, 1977 avenue des moulins",34087,MONTPELLIER,,04-67-67-67-67,,,correspondre@aws-france.com,http://www.herault.fr,https://commande-publique.herault.fr/,,,,,False,False,,False,False
