22-16513,,,CF_NIV_SUIV,CF_NIV_SUIV,False,False,False,CF_NIV_SUIV,False,False,,,,,création d'une identité visuelle avec ses déclinaisons graphiques et mise en cohérence de la documentation touristique des supports de communication de l'Office de Tourisme et des congrès d'Amiens Métropole,CF_NIV_SUIV,,,CF_NIV_SUIV,Amiens,,,,CF_NIV_SUIV,,CF_NIV_SUIV,,,,,,,,,,,,,False,False,CF_NIV_SUIV,False,,CF_NIV_SUIV,False,False,,CF_NIV_SUIV,,,,,,,,CF_NIV_SUIV,,,CF_NIV_SUIV,,,CF_NIV_SUIV,,,,,,False,False,CF_NIV_SUIV,,,CF_NIV_SUIV,,,CF_NIV_SUIV,,,CF_NIV_SUIV,,,CF_NIV_SUIV,,,,--None--,CF_NIV_SUIV,False,,,,False,CF_NIV_SUIV,,,,,,,,,False,CF_NIV_SUIV,,,,,,,CF_NIV_SUIV,False,False,False,False,False,,,,,CF_NIV_SUIV,,,,,,,,,,,,,,,,,,,,,,,,,,,,,,,,,,,,,,,,,,,,,,,,,,,,,,,,,,,,,
22-16523,,,CF_NIV_SUIV,CF_NIV_SUIV,False,False,False,CF_NIV_SUIV,False,False,,,,,Réseau fibré de l'UTI CPCA - Réalisation et qualification des soudures,CF_NIV_SUIV,,,CF_NIV_SUIV,,,,,CF_NIV_SUIV,,CF_NIV_SUIV,,,,,,,,,,,,,False,False,CF_NIV_SUIV,False,,CF_NIV_SUIV,False,False,,CF_NIV_SUIV,,,,,,,,CF_NIV_SUIV,,,CF_NIV_SUIV,,,CF_NIV_SUIV,,,,,,False,False,CF_NIV_SUIV,,,CF_NIV_SUIV,,,CF_NIV_SUIV,,,CF_NIV_SUIV,,,CF_NIV_SUIV,,,,--None--,CF_NIV_SUIV,False,,,,False,CF_NIV_SUIV,,,,,,,,,False,CF_NIV_SUIV,,,,,,,CF_NIV_SUIV,False,False,False,False,False,,,,,CF_NIV_SUIV,,,,,,,,,,,,,,,,,,,,,,,,,,,,,,,,,,,,,,,,,,,,,,,,,,,,,,,,,,,,,
22-16528,,,CF_NIV_SUIV,CF_NIV_SUIV,False,False,False,CF_NIV_SUIV,False,False,,,,,Conception et réalisation d'une structure métallo-textile et des ouvrages nécessaires,CF_NIV_SUIV,,,CF_NIV_SUIV,,,,,CF_NIV_SUIV,,CF_NIV_SUIV,,,,,,,,,,,,,False,False,CF_NIV_SUIV,False,,CF_NIV_SUIV,False,False,,CF_NIV_SUIV,,,,,,,,CF_NIV_SUIV,,,CF_NIV_SUIV,,,CF_NIV_SUIV,,,,,,False,True,CF_NIV_SUIV,Théâtre de verdure,Conception et réalisation d'une structure métallo-textile et des ouvrages nécessaires,CF_NIV_SUIV,,,CF_NIV_SUIV,,,CF_NIV_SUIV,,,CF_NIV_SUIV,,,,--None--,CF_NIV_SUIV,False,,,,False,CF_NIV_SUIV,,,,,,,,,False,CF_NIV_SUIV,,,,,,,CF_NIV_SUIV,False,False,False,False,True,,,,,CF_NIV_SUIV,,,,,,,,,,,,,,,,,,,,,,,,,,,,,,,,,,,,,,,,,,,,,,,,,,,,,,,,,,,,,
22-16535,,,CF_NIV_SUIV,CF_NIV_SUIV,True,False,False,CF_NIV_SUIV,False,False,,,,,Travaux d'amélioration des installations techniques chauffage-climatisation-ventilationTravaux d'amélioration des installations techniques chauffage-climatisation-ventilation réalisés dans le cadre du Plan National de Relance 2021 (PNR)-.,CF_NIV_SUIV,42160000.0,,CF_NIV_SUIV,,,,FRF21,CF_NIV_SUIV,,CF_NIV_SUIV,,,,,,,,,,,,,True,False,CF_NIV_SUIV,False,,CF_NIV_SUIV,False,False,,CF_NIV_SUIV,,,,,,,,CF_NIV_SUIV,,,CF_NIV_SUIV,,,CF_NIV_SUIV,,,,,,False,False,CF_NIV_SUIV,,,CF_NIV_SUIV,,,CF_NIV_SUIV,,,CF_NIV_SUIV,,,CF_NIV_SUIV,,,,--None--,CF_NIV_SUIV,False,,,,False,CF_NIV_SUIV,,,,,,,,,False,CF_NIV_SUIV,,,,,,,CF_NIV_SUIV,False,False,False,False,False,,,,,CF_NIV_SUIV,,,,,,,,,,,,,,,,,,,,,,,,,,,,,,,,,,,,,,,,,,,,,,,,,,,,,,,,,,,,,
22-16539,,,CF_NIV_SUIV,CF_NIV_SUIV,False,False,False,CF_NIV_SUIV,False,False,,,,,Assistance à maîtrise d'ouvrage pour la réalisation d'études et essais complémentaires autour du bassin de ParisAnnonce BOAMP : 22-14646,CF_NIV_SUIV,,,CF_NIV_SUIV,Port de Dieppe,76200.0,<ville>Dieppe</ville>,,CF_NIV_SUIV,,CF_NIV_SUIV,,,,,,,,,,,,,False,False,CF_NIV_SUIV,False,,CF_NIV_SUIV,False,False,,CF_NIV_SUIV,,,,,,,,CF_NIV_SUIV,,,CF_NIV_SUIV,,,CF_NIV_SUIV,,,,,,False,True,CF_NIV_SUIV,"Le contrat comporte des tranches optionnelles définies au cahier des charges.Le détail du phasage de l'opération figure au cahier des charges.Ports de Normandie souhaite déterminer les conditions d'exploitation des engins portuaires, sur les quais autour du bassin de Paris.Une campagne d'essais, de modélisation des quais, puis un recalcul a été menée entre 2013 et 2015 par la société ANTEA. Aujourd'hui, il est demandé de mettre à jour ces études, en les complétant par d'autres essais, sondages, dans le but de déterminer avec une plus grande précision les conditions d'exploitation des engins portuaires.Les quais concernés sont les quais autour du bassin de Paris, qui est le bassin de commerce du Port de Dieppe et plus précisément :- Le quai des Indes,- Le quai du Maroc,- Le quai de Québec.La prestation demandée a pour but d'établir les conditions d'exploitation des quais et de rédiger les consignes d'exploitation des 3 grues portuaires. Les principales charges d'exploitation liées au stockage sont des pièces d'éoliennes",Assistance à maîtrise d'ouvrage pour la réalisation d'études et essais complémentaires autour du bassin de ParisAnnonce BOAMP : 22-14646,CF_NIV_SUIV,,,CF_NIV_SUIV,,,CF_NIV_SUIV,,,CF_NIV_SUIV,,,,--None--,CF_NIV_SUIV,False,,,,False,CF_NIV_SUIV,,,,,,,,,False,CF_NIV_SUIV,,,,,,,CF_NIV_SUIV,False,False,False,False,True,,,,,CF_NIV_SUIV,,,,,,,,,,,,,,,,,,,,,,,,,,,,,,,,,,,,,,,,,,,,,,,,,,,,,,,,,,,,,
22-16553,,,CF_NIV_SUIV,CF_NIV_SUIV,False,False,False,CF_NIV_SUIV,False,False,,,,,"Accompagnement de l'Agglomération dans l'animation de son Conseil de Développement (animation de réunions, encadrement de groupes de travail)",CF_NIV_SUIV,,,CF_NIV_SUIV,Espace Saint Germain - Bâtiment ANtarès,38200.0,<ville>VIENNE</ville>,,CF_NIV_SUIV,,CF_NIV_SUIV,,,,,,,,,,,,,False,False,CF_NIV_SUIV,False,,CF_NIV_SUIV,False,False,,CF_NIV_SUIV,,,,,,,,CF_NIV_SUIV,,,CF_NIV_SUIV,,,CF_NIV_SUIV,,,,,,False,False,CF_NIV_SUIV,"Procédure adaptée ouverte soumise aux dispositions des articles L. 2123-1 et R. 2123-1 1° du Code de la commande publique. Accord-cadre mono-attributaire à bons de commandes, sans minimum et avec maximum est passé en application des articles L2125-1 1°, R. 2162-1 à R. 2162-6, R. 2162-13 et R. 2162-14 du Code de la commande publique. Il donnera lieu à l'émission de bons de commande. Montant maximum pour chaque année : 10 000,00 euros HT, étant précisé qu'un montant de 5 000 euros HT est fléché pour chaque année. L'accord-cadre est conclu pour une période initiale de 2 ans à compter de sa notification. Il est reconductible tacitement 3 fois 1 an","Accompagnement de l'Agglomération dans l'animation de son Conseil de Développement (animation de réunions, encadrement de groupes de travail)",CF_NIV_SUIV,,,CF_NIV_SUIV,,,CF_NIV_SUIV,,,CF_NIV_SUIV,,,,--None--,CF_NIV_SUIV,False,,,,False,CF_NIV_SUIV,,,,,,,,,False,CF_NIV_SUIV,48.0,,,,,,CF_NIV_SUIV,False,False,False,False,True,,,,,CF_NIV_SUIV,,,,,,,,,,,,,,,,,,,,,,,,,,,,,,,,,,,,,,,,,,,,,,,,,,,,,,,,,,,,,
22-16561,,,CF_NIV_SUIV,CF_NIV_SUIV,False,False,False,CF_NIV_SUIV,False,False,,,,,TRAVAUX AMENAGEMENT DES ESPACES PUBLICS RUE MONTPELAZ RUE DES ECOLES ET PLACE STE AGATHE,CF_NIV_SUIV,45200000.0,,CF_NIV_SUIV,,,,,CF_NIV_SUIV,,CF_NIV_SUIV,,,,,,,,,,,,,False,False,CF_NIV_SUIV,False,,CF_NIV_SUIV,False,False,,CF_NIV_SUIV,,,,,,,,CF_NIV_SUIV,,,CF_NIV_SUIV,,,CF_NIV_SUIV,,,,,,False,False,CF_NIV_SUIV,,,CF_NIV_SUIV,,,CF_NIV_SUIV,,,CF_NIV_SUIV,,,CF_NIV_SUIV,,,,--None--,CF_NIV_SUIV,False,,,,False,CF_NIV_SUIV,,,,,,,,,False,CF_NIV_SUIV,,,,,,,CF_NIV_SUIV,False,False,False,False,False,,,,,CF_NIV_SUIV,,,,,,,,,,,,,,,,,,,,,,,,,,,,,,,,,,,,,,,,,,,,,,,,,,,,,,,,,,,,,
22-16567,,,CF_NIV_SUIV,CF_NIV_SUIV,False,False,False,CF_NIV_SUIV,False,False,,,,,Réalisation d'une étude relative à l'élaboration d'une stratégie d'attractivité économique du territoire dans le cadre du programme Territoires d'Industrie,CF_NIV_SUIV,,,CF_NIV_SUIV,,,,,CF_NIV_SUIV,,CF_NIV_SUIV,,,,,,,,,,,,,False,False,CF_NIV_SUIV,False,,CF_NIV_SUIV,False,False,,CF_NIV_SUIV,,,,,,,,CF_NIV_SUIV,,,CF_NIV_SUIV,,,CF_NIV_SUIV,,,,,,False,False,CF_NIV_SUIV,,,CF_NIV_SUIV,,,CF_NIV_SUIV,,,CF_NIV_SUIV,,,CF_NIV_SUIV,,,,--None--,CF_NIV_SUIV,False,,,,False,CF_NIV_SUIV,,,,,,,,,False,CF_NIV_SUIV,,,,,,,CF_NIV_SUIV,False,False,False,False,False,,,,,CF_NIV_SUIV,,,,,,,,,,,,,,,,,,,,,,,,,,,,,,,,,,,,,,,,,,,,,,,,,,,,,,,,,,,,,
22-16571,,,CF_NIV_SUIV,CF_NIV_SUIV,False,False,False,CF_NIV_SUIV,False,False,,,,12.0,Prestations de vérifications périodiques des installations Électriques de la Délégation Alsace du CNRS,CF_NIV_SUIV,71315400.0,,CF_NIV_SUIV,23 rue du Loess,67037.0,Strasbourg,FRF11,CF_NIV_SUIV,,CF_NIV_SUIV,,,,,,,,,,,,,True,False,CF_NIV_SUIV,False,,CF_NIV_SUIV,False,False,,CF_NIV_SUIV,,,,,,,,CF_NIV_SUIV,,,CF_NIV_SUIV,,,CF_NIV_SUIV,,,,,,False,False,CF_NIV_SUIV,,,CF_NIV_SUIV,,,CF_NIV_SUIV,,,CF_NIV_SUIV,,,CF_NIV_SUIV,,,,--None--,CF_NIV_SUIV,False,,,,False,CF_NIV_SUIV,,,,,,,,,False,CF_NIV_SUIV,,,,,,,CF_NIV_SUIV,False,False,False,False,False,,,,,CF_NIV_SUIV,,,,,,,,,,,,,,,,,,,,,,,,,,,,,,,,,,,,,,,,,,,,,,,,,,,,,,,,,,,,,
22-16574,,,CF_NIV_SUIV,CF_NIV_SUIV,False,False,False,CF_NIV_SUIV,False,False,,,,,RECONSTRUCTION D'UN RESTAURANT SCOLAIRE A LE COTEAU,CF_NIV_SUIV,45212000.0,,CF_NIV_SUIV,,,,,CF_NIV_SUIV,,CF_NIV_SUIV,,,,,,,,,,,,,False,False,CF_NIV_SUIV,False,,CF_NIV_SUIV,False,False,,CF_NIV_SUIV,,,,,,,,CF_NIV_SUIV,,,CF_NIV_SUIV,,,CF_NIV_SUIV,,,,,,False,False,CF_NIV_SUIV,,,CF_NIV_SUIV,,,CF_NIV_SUIV,,,CF_NIV_SUIV,,,CF_NIV_SUIV,,,,--None--,CF_NIV_SUIV,False,,,,False,CF_NIV_SUIV,,,,,,,,,False,CF_NIV_SUIV,,,,,,,CF_NIV_SUIV,False,False,False,False,False,,,,,CF_NIV_SUIV,,,,,,,,,,,,,,,,,,,,,,,,,,,,,,,,,,,,,,,,,,,,,,,,,,,,,,,,,,,,,
22-16587,,,CF_NIV_SUIV,CF_NIV_SUIV,False,False,False,CF_NIV_SUIV,False,False,,,,7.0,"La présente consultation a pour objet la création, l'hébergement et la maintenance du site internet pour le Groupe Hospitalier Nord Essonne.",CF_NIV_SUIV,72000000.0,,CF_NIV_SUIV,,,,FR104,CF_NIV_SUIV,,CF_NIV_SUIV,,,,,,,,,,,,,False,False,CF_NIV_SUIV,False,,CF_NIV_SUIV,False,False,,CF_NIV_SUIV,,,,,,,,CF_NIV_SUIV,,,CF_NIV_SUIV,,,CF_NIV_SUIV,,,,,,False,False,CF_NIV_SUIV,,,CF_NIV_SUIV,,,CF_NIV_SUIV,,,CF_NIV_SUIV,,,CF_NIV_SUIV,,,,--None--,CF_NIV_SUIV,False,,,,False,CF_NIV_SUIV,,,,,,,,,False,CF_NIV_SUIV,,,,,,,CF_NIV_SUIV,False,False,False,False,False,,,,,CF_NIV_SUIV,,,,,,,,,,,,,,,,,,,,,,,,,,,,,,,,,,,,,,,,,,,,,,,,,,,,,,,,,,,,,
22-16602,,,CF_NIV_SUIV,CF_NIV_SUIV,False,False,False,CF_NIV_SUIV,False,False,,,,,"Rectificatif de l'annonce : La présente consultation porte des prestations d'emballage, de déballage et de transport des oeuvres de l'exposition temporaire 'Fela Kuti'",CF_NIV_SUIV,,,CF_NIV_SUIV,,,,,CF_NIV_SUIV,,CF_NIV_SUIV,,,,,,,,,,,,,False,False,CF_NIV_SUIV,False,,CF_NIV_SUIV,False,False,,CF_NIV_SUIV,,,,,,,,CF_NIV_SUIV,,,CF_NIV_SUIV,,,CF_NIV_SUIV,,,,,,False,False,CF_NIV_SUIV,,,CF_NIV_SUIV,,,CF_NIV_SUIV,,,CF_NIV_SUIV,,,CF_NIV_SUIV,,,,--None--,CF_NIV_SUIV,False,,,,False,CF_NIV_SUIV,,,,,,,,,False,CF_NIV_SUIV,,,,,,,CF_NIV_SUIV,False,False,False,False,False,,,,,CF_NIV_SUIV,,,,,,,,,,,,,,,,,,,,,,,,,,,,,,,,,,,,,,,,,,,,,,,,,,,,,,,,,,,,,
22-16604,,,CF_NIV_SUIV,CF_NIV_SUIV,False,False,False,CF_NIV_SUIV,False,False,,,,,ACQUISITION D'UN VEHICULE de TOURISME,CF_NIV_SUIV,,,CF_NIV_SUIV,"5, Avenue Loulou Boislaville - Tour Lumina",97200.0,Fort de France,,CF_NIV_SUIV,,CF_NIV_SUIV,,,,,,,,,,,,,False,False,CF_NIV_SUIV,False,,CF_NIV_SUIV,False,False,,CF_NIV_SUIV,,,,,,,,CF_NIV_SUIV,,,CF_NIV_SUIV,,,CF_NIV_SUIV,,,,,,False,True,CF_NIV_SUIV,"Le présent marché a pour objet la fourniture en achat ou en crédit bail (sur 36, 48 ou 60 mois) d'un véhicule neuf de type SUV, de 5 places et boite automatique.","Evaluation du Besoin : 40.000,00 à 50.000,00 euros HT",CF_NIV_SUIV,,,CF_NIV_SUIV,,,CF_NIV_SUIV,,,CF_NIV_SUIV,,,,--None--,CF_NIV_SUIV,False,,,,False,CF_NIV_SUIV,,,,,,,,,False,CF_NIV_SUIV,,,,,2022-03-27 22:00:00,,CF_NIV_SUIV,False,False,False,False,True,,,,,CF_NIV_SUIV,,,,,,,,,,,,,,,,,,,,,,,,,,,,,,,,,,,,,,,,,,,,,,,,,,,,,,,,,,,,,
22-16620,,,CF_NIV_SUIV,CF_NIV_SUIV,False,False,False,CF_NIV_SUIV,False,False,,,,,Assistance à maitrise d'ouvrage et étude pour la mise en oeuvre d'un outil de production des repas scolaires,CF_NIV_SUIV,,,CF_NIV_SUIV,,,,,CF_NIV_SUIV,,CF_NIV_SUIV,,,,,,,,,,,,,False,False,CF_NIV_SUIV,False,,CF_NIV_SUIV,False,False,,CF_NIV_SUIV,,,,,,,,CF_NIV_SUIV,,,CF_NIV_SUIV,,,CF_NIV_SUIV,,,,,,False,True,CF_NIV_SUIV,"La présente consultation a pour objet l'exécution d'une mission d'assistance générale à la maîtrise d'ouvrage, dans le cadre de l'étude et de la réalisation de l'opération de mise en oeuvre d'un outil de production des repas scolaires.Le projet a pour objectif de transformer l'organisation de la restauration, de l'approvisionnement jusqu'au service dans l'assiette afin de produire les repas sur place.Cette démarche répond à de nombreux objectifs nutritionnels et sanitaires, environnementaux, économiques et sociaux, qui sont définis tant par l'évolution du cadre législatif (Loi EGalim, GEMRCN (Groupement d'Étude des Marchés de la restauration collective et Nutrition, ?) que par les orientations de la ville spécifiques à la restauration collective.Les prestations font l'objet de 2 tranches ainsi décrites :- Diagnostic et étude des 2 scénarii (tranche ferme, 4 mois)- Assistance à Maitrise d'ouvrage pour la préparation à la mise en oeuvre et structuration de la démarche et accompagnement la première année (tranche optionnelle, 24 mois)","La tranche ferme est réalisée selon les phases suivantes :Phase no1 : État des lieux et diagnosticPhase no2 : Étude des deux scénarii qui comprendra au préalable une étude comparative sur l'organisation de la restauration scolaire auprès d'autres villes de taille comparable en France, identifiant les bonnes pratiques transposables et les facteurs de réussite ;Les deux scénarii à étudier sont les suivants :- scénario 1. La production totale à la cuisine du restaurant scolaire : dans les locaux existants, avec possibilité d'extension du bâtiment actuel sur la parcelle cadastrée section BA no366, propriété de la commune, sous réserve du respect des règles d'urbanisme.- scénario 2. La mutualisation totale ou partielle des ressources du restaurant scolaire et de la cuisine de l'EHPAD "" Les Charmilles "" située 6, rue de l'Albarède à Lescure-d'Albigeois et du restaurant scolaire existant",CF_NIV_SUIV,,,CF_NIV_SUIV,,,CF_NIV_SUIV,,,CF_NIV_SUIV,,,,--None--,CF_NIV_SUIV,False,,,,False,CF_NIV_SUIV,,,,,,,,,False,CF_NIV_SUIV,4.0,,,,,,CF_NIV_SUIV,False,False,False,False,True,,,,,CF_NIV_SUIV,,,,,,,,,,,,,,,,,,,,,,,,,,,,,,,,,,,,,,,,,,,,,,,,,,,,,,,,,,,,,
22-16622,,,CF_NIV_SUIV,CF_NIV_SUIV,False,False,False,CF_NIV_SUIV,False,False,,,,,"MAITRISE D'OEUVRE POUR LA CONCERTATION, LES ETUDES ET LE SUIVI DE LA REALISATION POUR LA TRANSFORMATION DE LA COUR DE L'ECOLE CURIE PASTEUR EN COUR OASIS",CF_NIV_SUIV,,,CF_NIV_SUIV,Ecole Curie Pasteur,66700.0,<ville>ARGELES-SUR-MER</ville>,,CF_NIV_SUIV,,CF_NIV_SUIV,,,,,,,,,,,,,False,False,CF_NIV_SUIV,False,,CF_NIV_SUIV,False,False,,CF_NIV_SUIV,,,,,,,,CF_NIV_SUIV,,,CF_NIV_SUIV,,,CF_NIV_SUIV,,,,,,True,False,CF_NIV_SUIV,Le détail des missions confiées au titulaire figure au cahier des charges,"MAITRISE D'OEUVRE POUR LA CONCERTATION, LES ETUDES ET LE SUIVI DE LA REALISATION POUR LA TRANSFORMATION DE LA COUR DE L'ECOLE CURIE PASTEUR EN COUR OASIS",CF_NIV_SUIV,,,CF_NIV_SUIV,,,CF_NIV_SUIV,,,CF_NIV_SUIV,,,,--None--,CF_NIV_SUIV,False,,,,False,CF_NIV_SUIV,,,,,,,,,False,CF_NIV_SUIV,18.0,,,,,,CF_NIV_SUIV,False,False,False,False,True,,,,,CF_NIV_SUIV,,,,,,,,,,,,,,,,,,,,,,,,,,,,,,,,,,,,,,,,,,,,,,,,,,,,,,,,,,,,,
22-16626,,,CF_NIV_SUIV,CF_NIV_SUIV,False,False,False,CF_NIV_SUIV,False,False,,,,,Diagnostic structurel des travaux de rénovation de l'église de Semoy,CF_NIV_SUIV,,,CF_NIV_SUIV,24 rue du Bourg,45400.0,<ville>Semoy</ville>,,CF_NIV_SUIV,,CF_NIV_SUIV,,,,,,,,,,,,,False,False,CF_NIV_SUIV,False,,CF_NIV_SUIV,False,False,,CF_NIV_SUIV,,,,,,,,CF_NIV_SUIV,,,CF_NIV_SUIV,,,CF_NIV_SUIV,,,,,,False,False,CF_NIV_SUIV,"L'objet du présent marché concerne la réalisation d'un diagnostic structurel de l'église Notre-Dame, située 24 rue du Bourg à Semoy, non classée au titre des Monuments Historiques. La municipalité souhaite s'entourer d'une expertise visant à évaluer l'état de l'édifice et déterminer des priorités concernant les travaux à mener en vue de sa rénovation",Diagnostic structurel des travaux de rénovation de l'église de Semoy,CF_NIV_SUIV,,,CF_NIV_SUIV,,,CF_NIV_SUIV,,,CF_NIV_SUIV,,,,--None--,CF_NIV_SUIV,False,,,,False,CF_NIV_SUIV,,,,,,,,,False,CF_NIV_SUIV,2.0,,,,,,CF_NIV_SUIV,False,False,False,False,True,,,,,CF_NIV_SUIV,,,,,,,,,,,,,,,,,,,,,,,,,,,,,,,,,,,,,,,,,,,,,,,,,,,,,,,,,,,,,
22-16629,,,CF_NIV_SUIV,CF_NIV_SUIV,False,False,False,CF_NIV_SUIV,False,False,,,,,21TA22_Marché de travaux pour la construction du groupe scolaire Bossut à Pontoise (lots 6 et 8),CF_NIV_SUIV,45214210.0,,CF_NIV_SUIV,,,,,CF_NIV_SUIV,,CF_NIV_SUIV,,,,,,,,,,,,,False,False,CF_NIV_SUIV,False,,CF_NIV_SUIV,False,False,,CF_NIV_SUIV,,,,,,,,CF_NIV_SUIV,,,CF_NIV_SUIV,,,CF_NIV_SUIV,,,,,,False,False,CF_NIV_SUIV,,,CF_NIV_SUIV,,,CF_NIV_SUIV,,,CF_NIV_SUIV,,,CF_NIV_SUIV,,,,--None--,CF_NIV_SUIV,False,,,,False,CF_NIV_SUIV,,,,,,,,,False,CF_NIV_SUIV,,,,,,,CF_NIV_SUIV,False,False,False,False,False,,,,,CF_NIV_SUIV,,,,,,,,,,,,,,,,,,,,,,,,,,,,,,,,,,,,,,,,,,,,,,,,,,,,,,,,,,,,,
22-16633,,,CF_NIV_SUIV,CF_NIV_SUIV,False,False,False,CF_NIV_SUIV,False,False,,,,,Marché d'Infogérance et de support des matériels et infrastructure des différents sites de la Mairie de Saint-Arnoult-en-Yvelines.,CF_NIV_SUIV,,,CF_NIV_SUIV,,,,,CF_NIV_SUIV,,CF_NIV_SUIV,,,,,,,,,,,,,False,False,CF_NIV_SUIV,False,,CF_NIV_SUIV,False,False,,CF_NIV_SUIV,,,,,,,,CF_NIV_SUIV,,,CF_NIV_SUIV,,,CF_NIV_SUIV,,,,,,False,True,CF_NIV_SUIV,Marché d?Infogérance et de support des matériels et infrastructure des différents sites de la Mairie de Saint-Arnoult-en-Yvelines,Marché d'Infogérance et de support des matériels et infrastructure des différents sites de la Mairie de Saint-Arnoult-en-Yvelines.,CF_NIV_SUIV,,,CF_NIV_SUIV,,,CF_NIV_SUIV,,,CF_NIV_SUIV,,,,--None--,CF_NIV_SUIV,False,,,,False,CF_NIV_SUIV,,,,,,,,,False,CF_NIV_SUIV,12.0,,,,,,CF_NIV_SUIV,False,False,False,False,False,,,,,CF_NIV_SUIV,,,,,,,,,,,,,,,,,,,,,,,,,,,,,,,,,,,,,,,,,,,,,,,,,,,,,,,,,,,,,
22-16634,,,CF_NIV_SUIV,CF_NIV_SUIV,False,False,False,CF_NIV_SUIV,False,False,,,,,Travaux de voirie sur la voirie communale de Vindry-sur-Turdine,CF_NIV_SUIV,45112500.0,,CF_NIV_SUIV,,,,,CF_NIV_SUIV,,CF_NIV_SUIV,,,,,,,,,,,,,False,False,CF_NIV_SUIV,False,,CF_NIV_SUIV,False,False,,CF_NIV_SUIV,,,,,,,,CF_NIV_SUIV,,,CF_NIV_SUIV,,,CF_NIV_SUIV,,,,,,False,False,CF_NIV_SUIV,,,CF_NIV_SUIV,,,CF_NIV_SUIV,,,CF_NIV_SUIV,,,CF_NIV_SUIV,,,,--None--,CF_NIV_SUIV,False,,,,False,CF_NIV_SUIV,,,,,,,,,False,CF_NIV_SUIV,,,,,,,CF_NIV_SUIV,False,False,False,False,False,,,,,CF_NIV_SUIV,,,,,,,,,,,,,,,,,,,,,,,,,,,,,,,,,,,,,,,,,,,,,,,,,,,,,,,,,,,,,
22-16634,,,CF_NIV_SUIV,CF_NIV_SUIV,False,False,False,CF_NIV_SUIV,False,False,,,,,Travaux de voirie sur la voirie communale de Vindry-sur-Turdine,CF_NIV_SUIV,45233200.0,,CF_NIV_SUIV,,,,,CF_NIV_SUIV,,CF_NIV_SUIV,,,,,,,,,,,,,False,False,CF_NIV_SUIV,False,,CF_NIV_SUIV,False,False,,CF_NIV_SUIV,,,,,,,,CF_NIV_SUIV,,,CF_NIV_SUIV,,,CF_NIV_SUIV,,,,,,False,False,CF_NIV_SUIV,,,CF_NIV_SUIV,,,CF_NIV_SUIV,,,CF_NIV_SUIV,,,CF_NIV_SUIV,,,,--None--,CF_NIV_SUIV,False,,,,False,CF_NIV_SUIV,,,,,,,,,False,CF_NIV_SUIV,,,,,,,CF_NIV_SUIV,False,False,False,False,False,,,,,CF_NIV_SUIV,,,,,,,,,,,,,,,,,,,,,,,,,,,,,,,,,,,,,,,,,,,,,,,,,,,,,,,,,,,,,
22-16634,,,CF_NIV_SUIV,CF_NIV_SUIV,False,False,False,CF_NIV_SUIV,False,False,,,,,Travaux de voirie sur la voirie communale de Vindry-sur-Turdine,CF_NIV_SUIV,45232410.0,,CF_NIV_SUIV,,,,,CF_NIV_SUIV,,CF_NIV_SUIV,,,,,,,,,,,,,False,False,CF_NIV_SUIV,False,,CF_NIV_SUIV,False,False,,CF_NIV_SUIV,,,,,,,,CF_NIV_SUIV,,,CF_NIV_SUIV,,,CF_NIV_SUIV,,,,,,False,False,CF_NIV_SUIV,,,CF_NIV_SUIV,,,CF_NIV_SUIV,,,CF_NIV_SUIV,,,CF_NIV_SUIV,,,,--None--,CF_NIV_SUIV,False,,,,False,CF_NIV_SUIV,,,,,,,,,False,CF_NIV_SUIV,,,,,,,CF_NIV_SUIV,False,False,False,False,False,,,,,CF_NIV_SUIV,,,,,,,,,,,,,,,,,,,,,,,,,,,,,,,,,,,,,,,,,,,,,,,,,,,,,,,,,,,,,
22-16636,,,CF_NIV_SUIV,CF_NIV_SUIV,False,False,False,CF_NIV_SUIV,False,False,,,,,MAINTENANCE / ACQUISITION D'EXTINCTEURS ET RIA - CONTROLE DES INSTALLATIONS DE DESENFUMAGE,CF_NIV_SUIV,50413200.0,,CF_NIV_SUIV,,,,,CF_NIV_SUIV,,CF_NIV_SUIV,,,,,,,,,,,,,False,False,CF_NIV_SUIV,False,,CF_NIV_SUIV,False,False,,CF_NIV_SUIV,,,,,,,,CF_NIV_SUIV,,,CF_NIV_SUIV,,,CF_NIV_SUIV,,,,,,False,False,CF_NIV_SUIV,,,CF_NIV_SUIV,,,CF_NIV_SUIV,,,CF_NIV_SUIV,,,CF_NIV_SUIV,,,,--None--,CF_NIV_SUIV,False,,,,False,CF_NIV_SUIV,,,,,,,,,False,CF_NIV_SUIV,,,,,,,CF_NIV_SUIV,False,False,False,False,False,,,,,CF_NIV_SUIV,,,,,,,,,,,,,,,,,,,,,,,,,,,,,,,,,,,,,,,,,,,,,,,,,,,,,,,,,,,,,
22-16636,,,CF_NIV_SUIV,CF_NIV_SUIV,False,False,False,CF_NIV_SUIV,False,False,,,,,MAINTENANCE / ACQUISITION D'EXTINCTEURS ET RIA - CONTROLE DES INSTALLATIONS DE DESENFUMAGE,CF_NIV_SUIV,42521000.0,,CF_NIV_SUIV,,,,,CF_NIV_SUIV,,CF_NIV_SUIV,,,,,,,,,,,,,False,False,CF_NIV_SUIV,False,,CF_NIV_SUIV,False,False,,CF_NIV_SUIV,,,,,,,,CF_NIV_SUIV,,,CF_NIV_SUIV,,,CF_NIV_SUIV,,,,,,False,False,CF_NIV_SUIV,,,CF_NIV_SUIV,,,CF_NIV_SUIV,,,CF_NIV_SUIV,,,CF_NIV_SUIV,,,,--None--,CF_NIV_SUIV,False,,,,False,CF_NIV_SUIV,,,,,,,,,False,CF_NIV_SUIV,,,,,,,CF_NIV_SUIV,False,False,False,False,False,,,,,CF_NIV_SUIV,,,,,,,,,,,,,,,,,,,,,,,,,,,,,,,,,,,,,,,,,,,,,,,,,,,,,,,,,,,,,
22-16636,,,CF_NIV_SUIV,CF_NIV_SUIV,False,False,False,CF_NIV_SUIV,False,False,,,,,MAINTENANCE / ACQUISITION D'EXTINCTEURS ET RIA - CONTROLE DES INSTALLATIONS DE DESENFUMAGE,CF_NIV_SUIV,35111000.0,,CF_NIV_SUIV,,,,,CF_NIV_SUIV,,CF_NIV_SUIV,,,,,,,,,,,,,False,False,CF_NIV_SUIV,False,,CF_NIV_SUIV,False,False,,CF_NIV_SUIV,,,,,,,,CF_NIV_SUIV,,,CF_NIV_SUIV,,,CF_NIV_SUIV,,,,,,False,False,CF_NIV_SUIV,,,CF_NIV_SUIV,,,CF_NIV_SUIV,,,CF_NIV_SUIV,,,CF_NIV_SUIV,,,,--None--,CF_NIV_SUIV,False,,,,False,CF_NIV_SUIV,,,,,,,,,False,CF_NIV_SUIV,,,,,,,CF_NIV_SUIV,False,False,False,False,False,,,,,CF_NIV_SUIV,,,,,,,,,,,,,,,,,,,,,,,,,,,,,,,,,,,,,,,,,,,,,,,,,,,,,,,,,,,,,
22-16636,,,CF_NIV_SUIV,CF_NIV_SUIV,False,False,False,CF_NIV_SUIV,False,False,,,,,MAINTENANCE / ACQUISITION D'EXTINCTEURS ET RIA - CONTROLE DES INSTALLATIONS DE DESENFUMAGE,CF_NIV_SUIV,35111300.0,,CF_NIV_SUIV,,,,,CF_NIV_SUIV,,CF_NIV_SUIV,,,,,,,,,,,,,False,False,CF_NIV_SUIV,False,,CF_NIV_SUIV,False,False,,CF_NIV_SUIV,,,,,,,,CF_NIV_SUIV,,,CF_NIV_SUIV,,,CF_NIV_SUIV,,,,,,False,False,CF_NIV_SUIV,,,CF_NIV_SUIV,,,CF_NIV_SUIV,,,CF_NIV_SUIV,,,CF_NIV_SUIV,,,,--None--,CF_NIV_SUIV,False,,,,False,CF_NIV_SUIV,,,,,,,,,False,CF_NIV_SUIV,,,,,,,CF_NIV_SUIV,False,False,False,False,False,,,,,CF_NIV_SUIV,,,,,,,,,,,,,,,,,,,,,,,,,,,,,,,,,,,,,,,,,,,,,,,,,,,,,,,,,,,,,
22-16638,,,CF_NIV_SUIV,CF_NIV_SUIV,False,False,False,CF_NIV_SUIV,True,False,,,,,Renouvellement des maintenances Centreon,CF_NIV_SUIV,,,CF_NIV_SUIV,,,,,CF_NIV_SUIV,,CF_NIV_SUIV,,,,,,,,,,,,,False,False,CF_NIV_SUIV,False,,CF_NIV_SUIV,False,False,,CF_NIV_SUIV,,,,,,,,CF_NIV_SUIV,,,CF_NIV_SUIV,,,CF_NIV_SUIV,,,,,,False,False,CF_NIV_SUIV,,,CF_NIV_SUIV,,,CF_NIV_SUIV,,,CF_NIV_SUIV,,,CF_NIV_SUIV,,,,--None--,CF_NIV_SUIV,False,,,,False,CF_NIV_SUIV,,,,,,,,,False,CF_NIV_SUIV,,,,,,,CF_NIV_SUIV,False,False,False,False,False,,,,,CF_NIV_SUIV,,,,,,,,,,,,,,,,,,,,,,,,,,,,,,,,,,,,,,,,,,,,,,,,,,,,,,,,,,,,,
22-16643,,,CF_NIV_SUIV,CF_NIV_SUIV,False,False,False,CF_NIV_SUIV,False,False,,,,,FOURNITURE DE MANUELS SCOLAIRES ET AUTRES LIVRES A USAGES PEDAGOGIQUES ET SUPPORTS PEDAGOGIQUES AUX ECOLES PUBLIQUES DE LA VILLE DE SAINT-CHAMOND,CF_NIV_SUIV,22112000.0,,CF_NIV_SUIV,,,,,CF_NIV_SUIV,,CF_NIV_SUIV,,,,,,,,,,,,,False,False,CF_NIV_SUIV,False,,CF_NIV_SUIV,False,False,,CF_NIV_SUIV,,,,,,,,CF_NIV_SUIV,,,CF_NIV_SUIV,,,CF_NIV_SUIV,,,,,,False,False,CF_NIV_SUIV,,,CF_NIV_SUIV,,,CF_NIV_SUIV,,,CF_NIV_SUIV,,,CF_NIV_SUIV,,,,--None--,CF_NIV_SUIV,False,,,,False,CF_NIV_SUIV,,,,,,,,,False,CF_NIV_SUIV,,,,,,,CF_NIV_SUIV,False,False,False,False,False,,,,,CF_NIV_SUIV,,,,,,,,,,,,,,,,,,,,,,,,,,,,,,,,,,,,,,,,,,,,,,,,,,,,,,,,,,,,,
22-16643,,,CF_NIV_SUIV,CF_NIV_SUIV,False,False,False,CF_NIV_SUIV,False,False,,,,,FOURNITURE DE MANUELS SCOLAIRES ET AUTRES LIVRES A USAGES PEDAGOGIQUES ET SUPPORTS PEDAGOGIQUES AUX ECOLES PUBLIQUES DE LA VILLE DE SAINT-CHAMOND,CF_NIV_SUIV,22110000.0,,CF_NIV_SUIV,,,,,CF_NIV_SUIV,,CF_NIV_SUIV,,,,,,,,,,,,,False,False,CF_NIV_SUIV,False,,CF_NIV_SUIV,False,False,,CF_NIV_SUIV,,,,,,,,CF_NIV_SUIV,,,CF_NIV_SUIV,,,CF_NIV_SUIV,,,,,,False,False,CF_NIV_SUIV,,,CF_NIV_SUIV,,,CF_NIV_SUIV,,,CF_NIV_SUIV,,,CF_NIV_SUIV,,,,--None--,CF_NIV_SUIV,False,,,,False,CF_NIV_SUIV,,,,,,,,,False,CF_NIV_SUIV,,,,,,,CF_NIV_SUIV,False,False,False,False,False,,,,,CF_NIV_SUIV,,,,,,,,,,,,,,,,,,,,,,,,,,,,,,,,,,,,,,,,,,,,,,,,,,,,,,,,,,,,,
22-16643,,,CF_NIV_SUIV,CF_NIV_SUIV,False,False,False,CF_NIV_SUIV,False,False,,,,,FOURNITURE DE MANUELS SCOLAIRES ET AUTRES LIVRES A USAGES PEDAGOGIQUES ET SUPPORTS PEDAGOGIQUES AUX ECOLES PUBLIQUES DE LA VILLE DE SAINT-CHAMOND,CF_NIV_SUIV,22111000.0,,CF_NIV_SUIV,,,,,CF_NIV_SUIV,,CF_NIV_SUIV,,,,,,,,,,,,,False,False,CF_NIV_SUIV,False,,CF_NIV_SUIV,False,False,,CF_NIV_SUIV,,,,,,,,CF_NIV_SUIV,,,CF_NIV_SUIV,,,CF_NIV_SUIV,,,,,,False,False,CF_NIV_SUIV,,,CF_NIV_SUIV,,,CF_NIV_SUIV,,,CF_NIV_SUIV,,,CF_NIV_SUIV,,,,--None--,CF_NIV_SUIV,False,,,,False,CF_NIV_SUIV,,,,,,,,,False,CF_NIV_SUIV,,,,,,,CF_NIV_SUIV,False,False,False,False,False,,,,,CF_NIV_SUIV,,,,,,,,,,,,,,,,,,,,,,,,,,,,,,,,,,,,,,,,,,,,,,,,,,,,,,,,,,,,,
22-16644,,,CF_NIV_SUIV,CF_NIV_SUIV,False,False,False,CF_NIV_SUIV,False,False,,,,,Travaux d'entretien de voiries - pontage - patcher,CF_NIV_SUIV,,,CF_NIV_SUIV,,,,,CF_NIV_SUIV,,CF_NIV_SUIV,,,,,,,,,,,,,False,False,CF_NIV_SUIV,False,,CF_NIV_SUIV,False,False,,CF_NIV_SUIV,,,,,,,,CF_NIV_SUIV,,,CF_NIV_SUIV,,,CF_NIV_SUIV,,,,,,False,False,CF_NIV_SUIV,,,CF_NIV_SUIV,,,CF_NIV_SUIV,,,CF_NIV_SUIV,,,CF_NIV_SUIV,,,,--None--,CF_NIV_SUIV,False,,,,False,CF_NIV_SUIV,,,,,,,,,False,CF_NIV_SUIV,,,,,,,CF_NIV_SUIV,False,False,False,False,False,,,,,CF_NIV_SUIV,,,,,,,,,,,,,,,,,,,,,,,,,,,,,,,,,,,,,,,,,,,,,,,,,,,,,,,,,,,,,
