22-17322,,,CF_NIV_SUIV,CF_NIV_SUIV,False,False,False,CF_NIV_SUIV,False,False,,,,,"Marché de travaux pour la rénovation des sanitaires au CFP du 14ème arrondissement , 75014",CF_NIV_SUIV,45232460.0,,CF_NIV_SUIV,29 rue du Moulin vert,75014.0,Paris,,CF_NIV_SUIV,,CF_NIV_SUIV,,,,,,,,,,,,,False,False,CF_NIV_SUIV,False,,CF_NIV_SUIV,False,False,,CF_NIV_SUIV,,,,,,,,CF_NIV_SUIV,,,CF_NIV_SUIV,,,CF_NIV_SUIV,,,,,,False,False,CF_NIV_SUIV,Rénovation des sanitaires du R+1 au R+5 composé de 5 lots,,CF_NIV_SUIV,,,CF_NIV_SUIV,,,CF_NIV_SUIV,,,CF_NIV_SUIV,,,,--None--,CF_NIV_SUIV,False,,,,False,CF_NIV_SUIV,,,,,,,,,False,CF_NIV_SUIV,,,,,,,CF_NIV_SUIV,True,False,True,False,False,,,,,CF_NIV_SUIV,CF_NIV_SUIV,1,,Démolition,CF_NIV_SUIV,,,,,CF_NIV_SUIV,False,CF_NIV_SUIV,CF_NIV_SUIV,,,CF_NIV_SUIV,CF_NIV_SUIV,,,CF_NIV_SUIV,,,CF_NIV_SUIV,,,CF_NIV_SUIV,,,CF_NIV_SUIV,,,,,,,,,,,,,False,,,CF_NIV_SUIV,,,,,,False,False,False,,,,,False,,"lot 2 cloisonnement , menuiserie, faïence, carrelage, peinture lot 3 plomberie, chauffage lot 4 électricitélot 5 désamiantage",
22-17322,,,CF_NIV_SUIV,CF_NIV_SUIV,False,False,False,CF_NIV_SUIV,False,False,,,,,"Marché de travaux pour la rénovation des sanitaires au CFP du 14ème arrondissement , 75014",CF_NIV_SUIV,45442100.0,,CF_NIV_SUIV,29 rue du Moulin vert,75014.0,Paris,,CF_NIV_SUIV,,CF_NIV_SUIV,,,,,,,,,,,,,False,False,CF_NIV_SUIV,False,,CF_NIV_SUIV,False,False,,CF_NIV_SUIV,,,,,,,,CF_NIV_SUIV,,,CF_NIV_SUIV,,,CF_NIV_SUIV,,,,,,False,False,CF_NIV_SUIV,Rénovation des sanitaires du R+1 au R+5 composé de 5 lots,,CF_NIV_SUIV,,,CF_NIV_SUIV,,,CF_NIV_SUIV,,,CF_NIV_SUIV,,,,--None--,CF_NIV_SUIV,False,,,,False,CF_NIV_SUIV,,,,,,,,,False,CF_NIV_SUIV,,,,,,,CF_NIV_SUIV,True,False,True,False,False,,,,,CF_NIV_SUIV,CF_NIV_SUIV,1,,Démolition,CF_NIV_SUIV,,,,,CF_NIV_SUIV,False,CF_NIV_SUIV,CF_NIV_SUIV,,,CF_NIV_SUIV,CF_NIV_SUIV,,,CF_NIV_SUIV,,,CF_NIV_SUIV,,,CF_NIV_SUIV,,,CF_NIV_SUIV,,,,,,,,,,,,,False,,,CF_NIV_SUIV,,,,,,False,False,False,,,,,False,,"lot 2 cloisonnement , menuiserie, faïence, carrelage, peinture lot 3 plomberie, chauffage lot 4 électricitélot 5 désamiantage",
22-17322,,,CF_NIV_SUIV,CF_NIV_SUIV,False,False,False,CF_NIV_SUIV,False,False,,,,,"Marché de travaux pour la rénovation des sanitaires au CFP du 14ème arrondissement , 75014",CF_NIV_SUIV,45421000.0,,CF_NIV_SUIV,29 rue du Moulin vert,75014.0,Paris,,CF_NIV_SUIV,,CF_NIV_SUIV,,,,,,,,,,,,,False,False,CF_NIV_SUIV,False,,CF_NIV_SUIV,False,False,,CF_NIV_SUIV,,,,,,,,CF_NIV_SUIV,,,CF_NIV_SUIV,,,CF_NIV_SUIV,,,,,,False,False,CF_NIV_SUIV,Rénovation des sanitaires du R+1 au R+5 composé de 5 lots,,CF_NIV_SUIV,,,CF_NIV_SUIV,,,CF_NIV_SUIV,,,CF_NIV_SUIV,,,,--None--,CF_NIV_SUIV,False,,,,False,CF_NIV_SUIV,,,,,,,,,False,CF_NIV_SUIV,,,,,,,CF_NIV_SUIV,True,False,True,False,False,,,,,CF_NIV_SUIV,CF_NIV_SUIV,1,,Démolition,CF_NIV_SUIV,,,,,CF_NIV_SUIV,False,CF_NIV_SUIV,CF_NIV_SUIV,,,CF_NIV_SUIV,CF_NIV_SUIV,,,CF_NIV_SUIV,,,CF_NIV_SUIV,,,CF_NIV_SUIV,,,CF_NIV_SUIV,,,,,,,,,,,,,False,,,CF_NIV_SUIV,,,,,,False,False,False,,,,,False,,"lot 2 cloisonnement , menuiserie, faïence, carrelage, peinture lot 3 plomberie, chauffage lot 4 électricitélot 5 désamiantage",
22-17322,,,CF_NIV_SUIV,CF_NIV_SUIV,False,False,False,CF_NIV_SUIV,False,False,,,,,"Marché de travaux pour la rénovation des sanitaires au CFP du 14ème arrondissement , 75014",CF_NIV_SUIV,45331210.0,,CF_NIV_SUIV,29 rue du Moulin vert,75014.0,Paris,,CF_NIV_SUIV,,CF_NIV_SUIV,,,,,,,,,,,,,False,False,CF_NIV_SUIV,False,,CF_NIV_SUIV,False,False,,CF_NIV_SUIV,,,,,,,,CF_NIV_SUIV,,,CF_NIV_SUIV,,,CF_NIV_SUIV,,,,,,False,False,CF_NIV_SUIV,Rénovation des sanitaires du R+1 au R+5 composé de 5 lots,,CF_NIV_SUIV,,,CF_NIV_SUIV,,,CF_NIV_SUIV,,,CF_NIV_SUIV,,,,--None--,CF_NIV_SUIV,False,,,,False,CF_NIV_SUIV,,,,,,,,,False,CF_NIV_SUIV,,,,,,,CF_NIV_SUIV,True,False,True,False,False,,,,,CF_NIV_SUIV,CF_NIV_SUIV,1,,Démolition,CF_NIV_SUIV,,,,,CF_NIV_SUIV,False,CF_NIV_SUIV,CF_NIV_SUIV,,,CF_NIV_SUIV,CF_NIV_SUIV,,,CF_NIV_SUIV,,,CF_NIV_SUIV,,,CF_NIV_SUIV,,,CF_NIV_SUIV,,,,,,,,,,,,,False,,,CF_NIV_SUIV,,,,,,False,False,False,,,,,False,,"lot 2 cloisonnement , menuiserie, faïence, carrelage, peinture lot 3 plomberie, chauffage lot 4 électricitélot 5 désamiantage",
22-17325,,,CF_NIV_SUIV,CF_NIV_SUIV,False,False,False,CF_NIV_SUIV,False,False,,,,,"Les prestations, objet du présent marché, concernent la fourniture de parkas Haute Visibilité et non HauteVisibilité, ainsi que de vêtements de protection thermique et de pluie pour l'ensemble des agents de la Métropole de Lyon",CF_NIV_SUIV,18100000.0,,CF_NIV_SUIV,,,,,CF_NIV_SUIV,,CF_NIV_SUIV,,,,,,,,,,,,,False,False,CF_NIV_SUIV,False,,CF_NIV_SUIV,False,False,,CF_NIV_SUIV,,,,,,,,CF_NIV_SUIV,,,CF_NIV_SUIV,,,CF_NIV_SUIV,,,,,,False,False,CF_NIV_SUIV,,,CF_NIV_SUIV,,,CF_NIV_SUIV,,,CF_NIV_SUIV,,,CF_NIV_SUIV,,,,--None--,CF_NIV_SUIV,False,,,,False,CF_NIV_SUIV,,,,,,,,,False,CF_NIV_SUIV,,,,,,,CF_NIV_SUIV,False,False,False,False,False,,,,,CF_NIV_SUIV,,,,,,,,,,,,,,,,,,,,,,,,,,,,,,,,,,,,,,,,,,,,,,,,,,,,,,,,,,,,,
22-17335,,,CF_NIV_SUIV,CF_NIV_SUIV,False,False,False,CF_NIV_SUIV,False,False,,,,,"Acquisition, paramétrage, formation et maintenance d'un logiciel de gestion et d'analyse financière",CF_NIV_SUIV,,,CF_NIV_SUIV,,,,,CF_NIV_SUIV,,CF_NIV_SUIV,,,,,,,,,,,,,False,False,CF_NIV_SUIV,False,,CF_NIV_SUIV,False,False,,CF_NIV_SUIV,,,,,,,,CF_NIV_SUIV,,,CF_NIV_SUIV,,,CF_NIV_SUIV,,,,,,False,True,CF_NIV_SUIV,,"Acquisition, paramétrage, formation et maintenance d'un logiciel de gestion et d'analyse financière",CF_NIV_SUIV,,,CF_NIV_SUIV,,,CF_NIV_SUIV,,,CF_NIV_SUIV,,,,--None--,CF_NIV_SUIV,False,,,,False,CF_NIV_SUIV,,,,,,,,,False,CF_NIV_SUIV,,,,,,,CF_NIV_SUIV,False,False,False,False,True,,,,,CF_NIV_SUIV,,,,,,,,,,,,,,,,,,,,,,,,,,,,,,,,,,,,,,,,,,,,,,,,,,,,,,,,,,,,,
22-17344,,,CF_NIV_SUIV,CF_NIV_SUIV,False,False,False,CF_NIV_SUIV,False,False,,,,,Assistance aux relations presse pour les années 2022 et 2023 de l'Office de Tourisme du Val d'Arly-Mont Blanc.,CF_NIV_SUIV,,,CF_NIV_SUIV,,,,,CF_NIV_SUIV,,CF_NIV_SUIV,,,,,,,,,,,,,False,False,CF_NIV_SUIV,False,,CF_NIV_SUIV,False,False,,CF_NIV_SUIV,,,,,,,,CF_NIV_SUIV,,,CF_NIV_SUIV,,,CF_NIV_SUIV,,,,,,False,False,CF_NIV_SUIV,,,CF_NIV_SUIV,,,CF_NIV_SUIV,,,CF_NIV_SUIV,,,CF_NIV_SUIV,,,,--None--,CF_NIV_SUIV,False,,,,False,CF_NIV_SUIV,,,,,,,,,False,CF_NIV_SUIV,,,2022-06-30 22:00:00,2023-08-30 22:00:00,,,CF_NIV_SUIV,False,False,False,False,False,,,,,CF_NIV_SUIV,,,,,,,,,,,,,,,,,,,,,,,,,,,,,,,,,,,,,,,,,,,,,,,,,,,,,,,,,,,,,
22-17345,,,CF_NIV_SUIV,CF_NIV_SUIV,False,False,False,CF_NIV_SUIV,False,False,,,,27.0,Contrôle des pass sanitaires aux Hôpitaux Civils de Colmar,CF_NIV_SUIV,79714000.0,,CF_NIV_SUIV,Hôpitaux Civils de Colmar,68024.0,COLMAR,FRF12,CF_NIV_SUIV,,CF_NIV_SUIV,,,,,,,,,,,,,True,False,CF_NIV_SUIV,False,,CF_NIV_SUIV,False,False,,CF_NIV_SUIV,,,,,,,,CF_NIV_SUIV,,,CF_NIV_SUIV,,,CF_NIV_SUIV,,,,,,False,False,CF_NIV_SUIV,,,CF_NIV_SUIV,,,CF_NIV_SUIV,,,CF_NIV_SUIV,,,CF_NIV_SUIV,,,,--None--,CF_NIV_SUIV,False,,,,False,CF_NIV_SUIV,,,,,,,,,False,CF_NIV_SUIV,,,,,,,CF_NIV_SUIV,False,False,False,False,False,,,,,CF_NIV_SUIV,,,,,,,,,,,,,,,,,,,,,,,,,,,,,,,,,,,,,,,,,,,,,,,,,,,,,,,,,,,,,
22-17352,,,CF_NIV_SUIV,CF_NIV_SUIV,False,False,False,CF_NIV_SUIV,True,False,,,,,Fourniture et livraison de chèques d'accompagnement personnalisé et de chèques cadeau pour le Centre Communal d'Action Sociale de Châtenay-Malabry,CF_NIV_SUIV,22400000.0,,CF_NIV_SUIV,,,,,CF_NIV_SUIV,,CF_NIV_SUIV,,,,,,,,,,,,,False,False,CF_NIV_SUIV,False,,CF_NIV_SUIV,False,False,,CF_NIV_SUIV,,,,,,,,CF_NIV_SUIV,,,CF_NIV_SUIV,,,CF_NIV_SUIV,,,,,,False,False,CF_NIV_SUIV,,,CF_NIV_SUIV,,,CF_NIV_SUIV,,,CF_NIV_SUIV,,,CF_NIV_SUIV,,,,--None--,CF_NIV_SUIV,False,,,,False,CF_NIV_SUIV,,,,,,,,,False,CF_NIV_SUIV,,,,,,,CF_NIV_SUIV,False,False,False,False,False,,,,,CF_NIV_SUIV,,,,,,,,,,,,,,,,,,,,,,,,,,,,,,,,,,,,,,,,,,,,,,,,,,,,,,,,,,,,,
22-17352,,,CF_NIV_SUIV,CF_NIV_SUIV,False,False,False,CF_NIV_SUIV,True,False,,,,,Fourniture et livraison de chèques d'accompagnement personnalisé et de chèques cadeau pour le Centre Communal d'Action Sociale de Châtenay-Malabry,CF_NIV_SUIV,85310000.0,,CF_NIV_SUIV,,,,,CF_NIV_SUIV,,CF_NIV_SUIV,,,,,,,,,,,,,False,False,CF_NIV_SUIV,False,,CF_NIV_SUIV,False,False,,CF_NIV_SUIV,,,,,,,,CF_NIV_SUIV,,,CF_NIV_SUIV,,,CF_NIV_SUIV,,,,,,False,False,CF_NIV_SUIV,,,CF_NIV_SUIV,,,CF_NIV_SUIV,,,CF_NIV_SUIV,,,CF_NIV_SUIV,,,,--None--,CF_NIV_SUIV,False,,,,False,CF_NIV_SUIV,,,,,,,,,False,CF_NIV_SUIV,,,,,,,CF_NIV_SUIV,False,False,False,False,False,,,,,CF_NIV_SUIV,,,,,,,,,,,,,,,,,,,,,,,,,,,,,,,,,,,,,,,,,,,,,,,,,,,,,,,,,,,,,
22-17355,,,CF_NIV_SUIV,CF_NIV_SUIV,False,False,False,CF_NIV_SUIV,False,False,,,,,Mission de maîtrise d'oeuvre pour la consolidation de la charpente et la réfection de la couverture du restaurant universitaire Le Flicoteaux à Chartres (28),CF_NIV_SUIV,,,CF_NIV_SUIV,1 rue Saint Martin au Val,28000.0,Chartres,,CF_NIV_SUIV,,CF_NIV_SUIV,,,,,,,,,,,,,False,False,CF_NIV_SUIV,False,,CF_NIV_SUIV,False,False,,CF_NIV_SUIV,,,,,,,,CF_NIV_SUIV,,,CF_NIV_SUIV,,,CF_NIV_SUIV,,,,,,False,False,CF_NIV_SUIV,,Mission de maîtrise d'oeuvre pour la consolidation de la charpente et la réfection de la couverture du restaurant universitaire Le Flicoteaux à Chartres (28),CF_NIV_SUIV,,,CF_NIV_SUIV,,,CF_NIV_SUIV,,,CF_NIV_SUIV,,,,--None--,CF_NIV_SUIV,False,,,,False,CF_NIV_SUIV,,,,,,,,,False,CF_NIV_SUIV,,,,,,,CF_NIV_SUIV,False,False,False,False,False,,,,,CF_NIV_SUIV,,,,,,,,,,,,,,,,,,,,,,,,,,,,,,,,,,,,,,,,,,,,,,,,,,,,,,,,,,,,,
22-17356,,,CF_NIV_SUIV,CF_NIV_SUIV,False,False,False,CF_NIV_SUIV,False,False,,,,,Travaux d'extension du funérarium de PLENEUF VAL ANDRE,CF_NIV_SUIV,45000000.0,,CF_NIV_SUIV,,,,,CF_NIV_SUIV,,CF_NIV_SUIV,,,,,,,,,,,,,False,False,CF_NIV_SUIV,False,,CF_NIV_SUIV,False,False,,CF_NIV_SUIV,,,,,,,,CF_NIV_SUIV,,,CF_NIV_SUIV,,,CF_NIV_SUIV,,,,,,False,False,CF_NIV_SUIV,,,CF_NIV_SUIV,,,CF_NIV_SUIV,,,CF_NIV_SUIV,,,CF_NIV_SUIV,,,,--None--,CF_NIV_SUIV,False,,,,False,CF_NIV_SUIV,,,,,,,,,False,CF_NIV_SUIV,,,,,,,CF_NIV_SUIV,False,False,False,False,False,,,,,CF_NIV_SUIV,,,,,,,,,,,,,,,,,,,,,,,,,,,,,,,,,,,,,,,,,,,,,,,,,,,,,,,,,,,,,
22-17360,,,CF_NIV_SUIV,CF_NIV_SUIV,False,False,False,CF_NIV_SUIV,False,False,,,,,Remplacement de deux ascenseurs au collège Gaston Bonheur à Trèbes,CF_NIV_SUIV,,,CF_NIV_SUIV,,,,,CF_NIV_SUIV,,CF_NIV_SUIV,,,,,,,,,,,,,False,False,CF_NIV_SUIV,False,,CF_NIV_SUIV,False,False,,CF_NIV_SUIV,,,,,,,,CF_NIV_SUIV,,,CF_NIV_SUIV,,,CF_NIV_SUIV,,,,,,False,True,CF_NIV_SUIV,Remplacement de deux ascenseurs au collège Gaston Bonheur à Trèbes,Lot unique,CF_NIV_SUIV,,,CF_NIV_SUIV,,,CF_NIV_SUIV,,,CF_NIV_SUIV,,,,--None--,CF_NIV_SUIV,False,,,,False,CF_NIV_SUIV,,,,,,,,,False,CF_NIV_SUIV,3.0,,,,,,CF_NIV_SUIV,False,False,False,False,True,,,,,CF_NIV_SUIV,,,,,,,,,,,,,,,,,,,,,,,,,,,,,,,,,,,,,,,,,,,,,,,,,,,,,,,,,,,,,
22-17363,,,CF_NIV_SUIV,CF_NIV_SUIV,False,False,False,CF_NIV_SUIV,False,False,,,,,"FOURNITURE DE MATÉRIAUX À BASE DE BOIS, MENUISERIES, CONTREPLAQUÉS, PANNEAUX, PORTES ET CHARPENTES",CF_NIV_SUIV,,,CF_NIV_SUIV,LOON-PLAGE,59279.0,LOON-PLAGE,,CF_NIV_SUIV,,CF_NIV_SUIV,,,,,,,,,,,,,False,False,CF_NIV_SUIV,False,,CF_NIV_SUIV,False,False,,CF_NIV_SUIV,,,,,,,,CF_NIV_SUIV,,,CF_NIV_SUIV,,,CF_NIV_SUIV,,,,,,False,True,CF_NIV_SUIV,,"FOURNITURE DE MATÉRIAUX À BASE DE BOIS, MENUISERIES, CONTREPLAQUÉS, PANNEAUX, PORTES ET CHARPENTES",CF_NIV_SUIV,,,CF_NIV_SUIV,,,CF_NIV_SUIV,,,CF_NIV_SUIV,,,,--None--,CF_NIV_SUIV,False,,,,False,CF_NIV_SUIV,,,,,,,,,False,CF_NIV_SUIV,12.0,,,,,,CF_NIV_SUIV,False,False,False,False,True,,,,,CF_NIV_SUIV,,,,,,,,,,,,,,,,,,,,,,,,,,,,,,,,,,,,,,,,,,,,,,,,,,,,,,,,,,,,,
22-17376,,,CF_NIV_SUIV,CF_NIV_SUIV,False,False,False,CF_NIV_SUIV,False,False,,,,,Délégation de Service Public du Train du Montenvers - Assistance et accompagnement juridiques et financiers pour préparer la fin du contrat de concession actuel et la future exploitation,CF_NIV_SUIV,,,CF_NIV_SUIV,,,,,CF_NIV_SUIV,,CF_NIV_SUIV,,,,,,,,,,,,,False,False,CF_NIV_SUIV,False,,CF_NIV_SUIV,False,False,,CF_NIV_SUIV,,,,,,,,CF_NIV_SUIV,,,CF_NIV_SUIV,,,CF_NIV_SUIV,,,,,,False,False,CF_NIV_SUIV,"Afin de préparer la fin du contrat départemental, ainsi que les conditions et caractéristiques de la future exploitation, il est proposé de s'adjoindre les services de prestataires experts juridiques et financiers, afin que le Département soit accompagné dans la définition et la mise en oeuvre de la stratégie qu'il souhaite mener pour le service public du Train du Montenvers",Délégation de Service Public du Train du Montenvers - Assistance et accompagnement juridiques et financiers pour préparer la fin du contrat de concession actuel et la future exploitation,CF_NIV_SUIV,,,CF_NIV_SUIV,,,CF_NIV_SUIV,,,CF_NIV_SUIV,,,,--None--,CF_NIV_SUIV,False,,,,False,CF_NIV_SUIV,,,,,,,,,False,CF_NIV_SUIV,9.0,,,,,,CF_NIV_SUIV,True,False,False,False,False,,,,,CF_NIV_SUIV,CF_NIV_SUIV,1,,Accompagnement juridique,CF_NIV_SUIV,,,,,CF_NIV_SUIV,False,CF_NIV_SUIV,CF_NIV_SUIV,,,CF_NIV_SUIV,CF_NIV_SUIV,,,CF_NIV_SUIV,,,CF_NIV_SUIV,,,CF_NIV_SUIV,,,CF_NIV_SUIV,,,,,,,,,,,,,False,,,CF_NIV_SUIV,,,,,,False,False,False,,,,,False,,,
22-17376,,,CF_NIV_SUIV,CF_NIV_SUIV,False,False,False,CF_NIV_SUIV,False,False,,,,,Délégation de Service Public du Train du Montenvers - Assistance et accompagnement juridiques et financiers pour préparer la fin du contrat de concession actuel et la future exploitation,CF_NIV_SUIV,,,CF_NIV_SUIV,,,,,CF_NIV_SUIV,,CF_NIV_SUIV,,,,,,,,,,,,,False,False,CF_NIV_SUIV,False,,CF_NIV_SUIV,False,False,,CF_NIV_SUIV,,,,,,,,CF_NIV_SUIV,,,CF_NIV_SUIV,,,CF_NIV_SUIV,,,,,,False,False,CF_NIV_SUIV,"Afin de préparer la fin du contrat départemental, ainsi que les conditions et caractéristiques de la future exploitation, il est proposé de s'adjoindre les services de prestataires experts juridiques et financiers, afin que le Département soit accompagné dans la définition et la mise en oeuvre de la stratégie qu'il souhaite mener pour le service public du Train du Montenvers",Délégation de Service Public du Train du Montenvers - Assistance et accompagnement juridiques et financiers pour préparer la fin du contrat de concession actuel et la future exploitation,CF_NIV_SUIV,,,CF_NIV_SUIV,,,CF_NIV_SUIV,,,CF_NIV_SUIV,,,,--None--,CF_NIV_SUIV,False,,,,False,CF_NIV_SUIV,,,,,,,,,False,CF_NIV_SUIV,9.0,,,,,,CF_NIV_SUIV,True,False,False,False,False,,,,,CF_NIV_SUIV,CF_NIV_SUIV,2,,Accompagnement financier,CF_NIV_SUIV,,,,,CF_NIV_SUIV,False,CF_NIV_SUIV,CF_NIV_SUIV,,,CF_NIV_SUIV,CF_NIV_SUIV,,,CF_NIV_SUIV,,,CF_NIV_SUIV,,,CF_NIV_SUIV,,,CF_NIV_SUIV,,,,,,,,,,,,,False,,,CF_NIV_SUIV,,,,,,False,False,False,,,,,False,,,
22-17378,,,CF_NIV_SUIV,CF_NIV_SUIV,False,False,False,CF_NIV_SUIV,False,False,,,,,TRAVAUX DE MISE EN ACCESSIBILITÉ DES ÉQUIPEMENTS PUBLICS - COMMUNE DE CLERIEUX,CF_NIV_SUIV,,,CF_NIV_SUIV,,,,,CF_NIV_SUIV,,CF_NIV_SUIV,,,,,,,,,,,,,False,False,CF_NIV_SUIV,False,,CF_NIV_SUIV,False,False,,CF_NIV_SUIV,,,,,,,,CF_NIV_SUIV,,,CF_NIV_SUIV,,,CF_NIV_SUIV,,,,,,False,True,CF_NIV_SUIV,"Marché de travaux pour la mise en accessibilité des équipements publics de la commune de Clérieux.Les prestations sont réparties selon l'allotissement suivant :Lot 1 : Gros oeuvre - VRD - Revêtement de solsLot 2 : Menuiserie bois intérieure et extérieuresLot 3 : Plâtrerie - Peintures - CarrelageLot 4 : Électricité - Courants forts et faiblesLot 5 : Plomberie - SanitaireLot 6 : SerrureriePossibilité de présenter une offre pour un ou plusieurs lots.Tranche ferme : Groupe scolaire - Salle des Fêtes - Maison des associations (lots concernés : 1, 2, 3, 4, 5 et 6)Tranche conditionnelle : Pôle sportif (lots concernés : 1, 4 et 5)Tranche optionnelle : Maison des associations : Aménagement des extérieurs (1)Visite sur site obligatoires sur rendez-vous le mercredi 16 février ou 23 février de 13h30 à 16h (conditions article 8 du règlement de consultation)","Lieux d'exécution : répartis sur 4 sites à CLERIEUX (26620)Site 1 : Le groupe scolaire - Place Georges BrassensSite 2 : La salle des fêtes - 3, chemin de la SourceSite 3 : La Maison des associations - 83A, rue de la ValléeSite 4 : Le Pôle sportif - Quartier les MasLa description des ouvrages et leurs spécifications techniques sont indiquées dans le Cahier des Charges.Le planning prévisionnel démarre en juin 2021 pour la période de préparation, suivi de 2 mois de travaux pour la tranche ferme.La tranche conditionnelle sera déclenchée par avenant.Le délai d'exécution des travaux de l'ensemble des lots est de :- 3 mois pour la tranche ferme (et optionnelle si retenue) y compris 1 mois de préparation.- 3 mois pour la tranche conditionnelle y compris 1 mois de préparation",CF_NIV_SUIV,,,CF_NIV_SUIV,,,CF_NIV_SUIV,,,CF_NIV_SUIV,,,,--None--,CF_NIV_SUIV,False,,,,False,CF_NIV_SUIV,,,,,,,,,False,CF_NIV_SUIV,,,,,,,CF_NIV_SUIV,True,False,True,False,False,,,,,CF_NIV_SUIV,CF_NIV_SUIV,1,,Gros oeuvre - VRD - Revêtement des sols,CF_NIV_SUIV,,,,,CF_NIV_SUIV,False,CF_NIV_SUIV,CF_NIV_SUIV,,,CF_NIV_SUIV,CF_NIV_SUIV,,,CF_NIV_SUIV,,,CF_NIV_SUIV,,,CF_NIV_SUIV,,,CF_NIV_SUIV,,,,,,,,,,,,,False,,,CF_NIV_SUIV,,,,,,False,False,False,,,,,False,,,
22-17378,,,CF_NIV_SUIV,CF_NIV_SUIV,False,False,False,CF_NIV_SUIV,False,False,,,,,TRAVAUX DE MISE EN ACCESSIBILITÉ DES ÉQUIPEMENTS PUBLICS - COMMUNE DE CLERIEUX,CF_NIV_SUIV,,,CF_NIV_SUIV,,,,,CF_NIV_SUIV,,CF_NIV_SUIV,,,,,,,,,,,,,False,False,CF_NIV_SUIV,False,,CF_NIV_SUIV,False,False,,CF_NIV_SUIV,,,,,,,,CF_NIV_SUIV,,,CF_NIV_SUIV,,,CF_NIV_SUIV,,,,,,False,True,CF_NIV_SUIV,"Marché de travaux pour la mise en accessibilité des équipements publics de la commune de Clérieux.Les prestations sont réparties selon l'allotissement suivant :Lot 1 : Gros oeuvre - VRD - Revêtement de solsLot 2 : Menuiserie bois intérieure et extérieuresLot 3 : Plâtrerie - Peintures - CarrelageLot 4 : Électricité - Courants forts et faiblesLot 5 : Plomberie - SanitaireLot 6 : SerrureriePossibilité de présenter une offre pour un ou plusieurs lots.Tranche ferme : Groupe scolaire - Salle des Fêtes - Maison des associations (lots concernés : 1, 2, 3, 4, 5 et 6)Tranche conditionnelle : Pôle sportif (lots concernés : 1, 4 et 5)Tranche optionnelle : Maison des associations : Aménagement des extérieurs (1)Visite sur site obligatoires sur rendez-vous le mercredi 16 février ou 23 février de 13h30 à 16h (conditions article 8 du règlement de consultation)","Lieux d'exécution : répartis sur 4 sites à CLERIEUX (26620)Site 1 : Le groupe scolaire - Place Georges BrassensSite 2 : La salle des fêtes - 3, chemin de la SourceSite 3 : La Maison des associations - 83A, rue de la ValléeSite 4 : Le Pôle sportif - Quartier les MasLa description des ouvrages et leurs spécifications techniques sont indiquées dans le Cahier des Charges.Le planning prévisionnel démarre en juin 2021 pour la période de préparation, suivi de 2 mois de travaux pour la tranche ferme.La tranche conditionnelle sera déclenchée par avenant.Le délai d'exécution des travaux de l'ensemble des lots est de :- 3 mois pour la tranche ferme (et optionnelle si retenue) y compris 1 mois de préparation.- 3 mois pour la tranche conditionnelle y compris 1 mois de préparation",CF_NIV_SUIV,,,CF_NIV_SUIV,,,CF_NIV_SUIV,,,CF_NIV_SUIV,,,,--None--,CF_NIV_SUIV,False,,,,False,CF_NIV_SUIV,,,,,,,,,False,CF_NIV_SUIV,,,,,,,CF_NIV_SUIV,True,False,True,False,False,,,,,CF_NIV_SUIV,CF_NIV_SUIV,2,,Menuiseries bois intérieure et extérieure,CF_NIV_SUIV,,,,,CF_NIV_SUIV,False,CF_NIV_SUIV,CF_NIV_SUIV,,,CF_NIV_SUIV,CF_NIV_SUIV,,,CF_NIV_SUIV,,,CF_NIV_SUIV,,,CF_NIV_SUIV,,,CF_NIV_SUIV,,,,,,,,,,,,,False,,,CF_NIV_SUIV,,,,,,False,False,False,,,,,False,,,
22-17378,,,CF_NIV_SUIV,CF_NIV_SUIV,False,False,False,CF_NIV_SUIV,False,False,,,,,TRAVAUX DE MISE EN ACCESSIBILITÉ DES ÉQUIPEMENTS PUBLICS - COMMUNE DE CLERIEUX,CF_NIV_SUIV,,,CF_NIV_SUIV,,,,,CF_NIV_SUIV,,CF_NIV_SUIV,,,,,,,,,,,,,False,False,CF_NIV_SUIV,False,,CF_NIV_SUIV,False,False,,CF_NIV_SUIV,,,,,,,,CF_NIV_SUIV,,,CF_NIV_SUIV,,,CF_NIV_SUIV,,,,,,False,True,CF_NIV_SUIV,"Marché de travaux pour la mise en accessibilité des équipements publics de la commune de Clérieux.Les prestations sont réparties selon l'allotissement suivant :Lot 1 : Gros oeuvre - VRD - Revêtement de solsLot 2 : Menuiserie bois intérieure et extérieuresLot 3 : Plâtrerie - Peintures - CarrelageLot 4 : Électricité - Courants forts et faiblesLot 5 : Plomberie - SanitaireLot 6 : SerrureriePossibilité de présenter une offre pour un ou plusieurs lots.Tranche ferme : Groupe scolaire - Salle des Fêtes - Maison des associations (lots concernés : 1, 2, 3, 4, 5 et 6)Tranche conditionnelle : Pôle sportif (lots concernés : 1, 4 et 5)Tranche optionnelle : Maison des associations : Aménagement des extérieurs (1)Visite sur site obligatoires sur rendez-vous le mercredi 16 février ou 23 février de 13h30 à 16h (conditions article 8 du règlement de consultation)","Lieux d'exécution : répartis sur 4 sites à CLERIEUX (26620)Site 1 : Le groupe scolaire - Place Georges BrassensSite 2 : La salle des fêtes - 3, chemin de la SourceSite 3 : La Maison des associations - 83A, rue de la ValléeSite 4 : Le Pôle sportif - Quartier les MasLa description des ouvrages et leurs spécifications techniques sont indiquées dans le Cahier des Charges.Le planning prévisionnel démarre en juin 2021 pour la période de préparation, suivi de 2 mois de travaux pour la tranche ferme.La tranche conditionnelle sera déclenchée par avenant.Le délai d'exécution des travaux de l'ensemble des lots est de :- 3 mois pour la tranche ferme (et optionnelle si retenue) y compris 1 mois de préparation.- 3 mois pour la tranche conditionnelle y compris 1 mois de préparation",CF_NIV_SUIV,,,CF_NIV_SUIV,,,CF_NIV_SUIV,,,CF_NIV_SUIV,,,,--None--,CF_NIV_SUIV,False,,,,False,CF_NIV_SUIV,,,,,,,,,False,CF_NIV_SUIV,,,,,,,CF_NIV_SUIV,True,False,True,False,False,,,,,CF_NIV_SUIV,CF_NIV_SUIV,3,,Plâtrerie - Peintures - Carrelage,CF_NIV_SUIV,,,,,CF_NIV_SUIV,False,CF_NIV_SUIV,CF_NIV_SUIV,,,CF_NIV_SUIV,CF_NIV_SUIV,,,CF_NIV_SUIV,,,CF_NIV_SUIV,,,CF_NIV_SUIV,,,CF_NIV_SUIV,,,,,,,,,,,,,False,,,CF_NIV_SUIV,,,,,,False,False,False,,,,,False,,,
22-17378,,,CF_NIV_SUIV,CF_NIV_SUIV,False,False,False,CF_NIV_SUIV,False,False,,,,,TRAVAUX DE MISE EN ACCESSIBILITÉ DES ÉQUIPEMENTS PUBLICS - COMMUNE DE CLERIEUX,CF_NIV_SUIV,,,CF_NIV_SUIV,,,,,CF_NIV_SUIV,,CF_NIV_SUIV,,,,,,,,,,,,,False,False,CF_NIV_SUIV,False,,CF_NIV_SUIV,False,False,,CF_NIV_SUIV,,,,,,,,CF_NIV_SUIV,,,CF_NIV_SUIV,,,CF_NIV_SUIV,,,,,,False,True,CF_NIV_SUIV,"Marché de travaux pour la mise en accessibilité des équipements publics de la commune de Clérieux.Les prestations sont réparties selon l'allotissement suivant :Lot 1 : Gros oeuvre - VRD - Revêtement de solsLot 2 : Menuiserie bois intérieure et extérieuresLot 3 : Plâtrerie - Peintures - CarrelageLot 4 : Électricité - Courants forts et faiblesLot 5 : Plomberie - SanitaireLot 6 : SerrureriePossibilité de présenter une offre pour un ou plusieurs lots.Tranche ferme : Groupe scolaire - Salle des Fêtes - Maison des associations (lots concernés : 1, 2, 3, 4, 5 et 6)Tranche conditionnelle : Pôle sportif (lots concernés : 1, 4 et 5)Tranche optionnelle : Maison des associations : Aménagement des extérieurs (1)Visite sur site obligatoires sur rendez-vous le mercredi 16 février ou 23 février de 13h30 à 16h (conditions article 8 du règlement de consultation)","Lieux d'exécution : répartis sur 4 sites à CLERIEUX (26620)Site 1 : Le groupe scolaire - Place Georges BrassensSite 2 : La salle des fêtes - 3, chemin de la SourceSite 3 : La Maison des associations - 83A, rue de la ValléeSite 4 : Le Pôle sportif - Quartier les MasLa description des ouvrages et leurs spécifications techniques sont indiquées dans le Cahier des Charges.Le planning prévisionnel démarre en juin 2021 pour la période de préparation, suivi de 2 mois de travaux pour la tranche ferme.La tranche conditionnelle sera déclenchée par avenant.Le délai d'exécution des travaux de l'ensemble des lots est de :- 3 mois pour la tranche ferme (et optionnelle si retenue) y compris 1 mois de préparation.- 3 mois pour la tranche conditionnelle y compris 1 mois de préparation",CF_NIV_SUIV,,,CF_NIV_SUIV,,,CF_NIV_SUIV,,,CF_NIV_SUIV,,,,--None--,CF_NIV_SUIV,False,,,,False,CF_NIV_SUIV,,,,,,,,,False,CF_NIV_SUIV,,,,,,,CF_NIV_SUIV,True,False,True,False,False,,,,,CF_NIV_SUIV,CF_NIV_SUIV,4,,Electricité - Courants forts et faibles,CF_NIV_SUIV,,,,,CF_NIV_SUIV,False,CF_NIV_SUIV,CF_NIV_SUIV,,,CF_NIV_SUIV,CF_NIV_SUIV,,,CF_NIV_SUIV,,,CF_NIV_SUIV,,,CF_NIV_SUIV,,,CF_NIV_SUIV,,,,,,,,,,,,,False,,,CF_NIV_SUIV,,,,,,False,False,False,,,,,False,,,
