BOAMP_AVIS_NUM,D_05_01_Objet_Titremarche,D_05_02_Objet_Refmarche,D_05_03_Objet_Typemarche,D_05_03_01_Objet_Typemarche_Travaux,D_05_03_01_01_Objet_Typemarche_Travaux_Execution,D_05_03_01_02_Objet_Typemarche_Travaux_Conceptrealisation,D_05_03_01_03_Objet_Typemarche_Travaux_Executionouvrage,D_05_03_02_Objet_Typemarche_Fournitures,D_05_03_02_01_Objet_Typemarche_Fournitures_Achat,D_05_03_02_02_Objet_Typemarche_Fournitures_Loc,D_05_03_02_03_Objet_Typemarche_Fournitures_Creditbail,D_05_03_02_04_Objet_Typemarche_Fournitures_Locvente,D_05_03_02_05_Objet_Typemarche_Fournitures_Plusieursformes,D_05_03_03_Objet_Typemarche_Service,D_05_04_Objet_Objetcomplet,D_05_05_Objet_Cpv,D_05_05_01_Objet_Cpv_Principal,D_05_05_02_Objet_Cpv_Supplementaire,D_05_06_Objet_Lieuexeclivr,D_05_06_01_Objet_Lieuexeclivr_Adresse,D_05_06_02_Objet_Lieuexeclivr_Cp,D_05_06_03_Objet_Lieuexeclivr_Ville,D_05_06_04_Objet_Lieuexeclivr_Codenuts,D_05_07_Objet_Delegation,D_05_07_01_Objet_Delegation_Texteapplication,D_05_07_02_Objet_Delegation_Domaine,D_05_07_02_01_Objet_Delegation_Domaine_Eaupotable,D_05_07_02_02_Objet_Delegation_Domaine_Assainissement,D_05_07_02_03_Objet_Delegation_Domaine_Orduresmendechets,D_05_07_02_04_Objet_Delegation_Domaine_Transports,D_05_07_02_05_Objet_Delegation_Domaine_Energie,D_05_07_02_06_Objet_Delegation_Domaine_Telecommunication,D_05_07_02_07_Objet_Delegation_Domaine_Autre,D_05_07_03_Objet_Delegation_Natureconvention,D_05_07_04_Objet_Delegation_Dureean,D_05_07_05_Objet_Delegation_Dureemois,D_05_07_06_Objet_Delegation_Datedebut,D_05_07_07_Objet_Delegation_Autresprecisions,D_05_08_Objet_Ampoui,D_05_09_Objet_Ampnon,D_05_10_Objet_Aviscorrespond,D_05_10_01_Objet_Aviscorrespond_Avisperiodiqueindicatif,D_05_10_02_Objet_Aviscorrespond_Systemequalification,D_05_11_Objet_Avisimplique,D_05_11_01_Objet_Avisimplique_Marchepublic,D_05_11_02_Objet_Avisimplique_Accordcadre,D_05_11_03_Objet_Avisimplique_Sad,D_05_12_Objet_Accordcadre,D_05_12_01_Objet_Accordcadre_Plusieursoperateurs,D_05_12_02_Objet_Accordcadre_Unseuloperateur,D_05_12_03_Objet_Accordcadre_Nbparticipants,D_05_12_04_Objet_Accordcadre_Nbmaxparticipants,D_05_12_05_Objet_Accordcadre_Dureean,D_05_12_06_Objet_Accordcadre_Dureemois,D_05_12_07_Objet_Accordcadre_Supquatreansjustification,D_05_12_08_Objet_Accordcadre_Valeur,D_05_12_08_01_Objet_Accordcadre_Valeur_Value,D_05_12_08_02_Objet_Accordcadre_Valeur_Devise,D_05_12_09_Objet_Accordcadre_Valeurmin,D_05_12_09_01_Objet_Accordcadre_Valeurmin_Value,D_05_12_09_02_Objet_Accordcadre_Valeurmin_Devise,D_05_12_10_Objet_Accordcadre_Valeurmax,D_05_12_10_01_Objet_Accordcadre_Valeurmax_Value,D_05_12_10_02_Objet_Accordcadre_Valeurmax_Devise,D_05_12_11_Objet_Accordcadre_Frequenceetvaleurdesmarches,D_05_12_12_Objet_Accordcadre_Oui,D_05_12_13_Objet_Accordcadre_Non,D_05_13_Objet_Variantesoui,D_05_14_Objet_Variantesnon,D_05_15_Objet_Caracteristiques,D_05_15_01_Objet_Caracteristiques_Principales,D_05_15_02_Objet_Caracteristiques_Quantite,D_05_15_03_Objet_Caracteristiques_Valeurtotale,D_05_15_03_01_Objet_Caracteristiques_Valeurtotale_Value,D_05_15_03_02_Objet_Caracteristiques_Valeurtotale_Devise,D_05_15_04_Objet_Caracteristiques_Valeur,D_05_15_04_01_Objet_Caracteristiques_Valeur_Value,D_05_15_04_02_Objet_Caracteristiques_Valeur_Devise,D_05_15_05_Objet_Caracteristiques_Valeurmin,D_05_15_05_01_Objet_Caracteristiques_Valeurmin_Value,D_05_15_05_02_Objet_Caracteristiques_Valeurmin_Devise,D_05_15_06_Objet_Caracteristiques_Valeurmax,D_05_15_06_01_Objet_Caracteristiques_Valeurmax_Value,D_05_15_06_02_Objet_Caracteristiques_Valeurmax_Devise,D_05_15_07_Objet_Caracteristiques_Titre,D_05_15_08_Objet_Caracteristiques_Table,D_05_15_09_Objet_Caracteristiques_Options,D_05_15_09_01_Objet_Caracteristiques_Options_Oui,D_05_15_09_02_Objet_Caracteristiques_Options_Description,D_05_15_09_03_Objet_Caracteristiques_Options_Dureemois,D_05_15_09_04_Objet_Caracteristiques_Options_Dureejours,D_05_15_09_05_Objet_Caracteristiques_Options_Non,D_05_15_10_Objet_Caracteristiques_Reconductions,D_05_15_10_01_Objet_Caracteristiques_Reconductions_Oui,D_05_15_10_02_Objet_Caracteristiques_Reconductions_Nbreconductions,D_05_15_10_03_Objet_Caracteristiques_Reconductions_Nbreconductionsmin,D_05_15_10_04_Objet_Caracteristiques_Reconductions_Nbreconductionsmax,D_05_15_10_05_Objet_Caracteristiques_Reconductions_Calendrier,D_05_15_10_06_Objet_Caracteristiques_Reconductions_Dureemois,D_05_15_10_07_Objet_Caracteristiques_Reconductions_Dureejours,D_05_15_10_08_Objet_Caracteristiques_Reconductions_Description,D_05_15_10_09_Objet_Caracteristiques_Reconductions_Non,D_05_16_Objet_Dureedelai,D_05_16_01_Objet_Dureedelai_Dureemois,D_05_16_02_Objet_Dureedelai_Dureejours,D_05_16_03_Objet_Dureedelai_Datedebut,D_05_16_04_Objet_Dureedelai_Datefin,D_05_16_05_Objet_Dureedelai_Dateexecution,D_05_16_06_Objet_Dureedelai_Datelivraison,D_05_17_Objet_Divenlots,D_05_17_01_Objet_Divenlots_Oui,D_05_17_02_Objet_Divenlots_Offreun,D_05_17_03_Objet_Divenlots_Offreplusieurs,D_05_17_04_Objet_Divenlots_Offretous,D_05_17_05_Objet_Divenlots_Non,D_05_18_Objet_Nblotoffremax,D_05_19_Objet_Nblotattribmax,D_05_20_Objet_Lotsreservepouvoiradjudicateur,D_05_21_Objet_Datelancement,D_05_22_Objet_Lots,D_05_22_01_Objet_Lots_Lot,D_05_22_01_01_Objet_Lots_Lot_Num,D_05_22_01_02_Objet_Lots_Lot_Intitule,D_05_22_01_03_Objet_Lots_Lot_Description,D_05_22_01_04_Objet_Lots_Lot_Cpv,D_05_22_01_04_01_Objet_Lots_Lot_Cpv_Principal,D_05_22_01_04_02_Objet_Lots_Lot_Cpv_Supplementaire,D_05_22_01_05_Objet_Lots_Lot_Codenuts,D_05_22_01_06_Objet_Lots_Lot_Lieuprincipal,D_05_22_01_07_Objet_Lots_Lot_Criteresattribution,D_05_22_01_07_01_Objet_Lots_Lot_Criteresattribution_Criterescctp,D_05_22_01_07_02_Objet_Lots_Lot_Criteresattribution_Criteresqualite,D_05_22_01_07_02_01_Objet_Lots_Lot_Criteresattribution_Criteresqualite_Critere,D_05_22_01_07_02_01_01_Objet_Lots_Lot_Criteresattribution_Criteresqualite_Critere_Value,D_05_22_01_07_02_01_02_Objet_Lots_Lot_Criteresattribution_Criteresqualite_Critere_Poids,D_05_22_01_07_03_Objet_Lots_Lot_Criteresattribution_Criterescout,D_05_22_01_07_03_01_Objet_Lots_Lot_Criteresattribution_Criterescout_Critere,D_05_22_01_07_03_01_01_Objet_Lots_Lot_Criteresattribution_Criterescout_Critere_Value,D_05_22_01_07_03_01_02_Objet_Lots_Lot_Criteresattribution_Criterescout_Critere_Poids,D_05_22_01_07_04_Objet_Lots_Lot_Criteresattribution_Criteresprix,D_05_22_01_07_04_01_Objet_Lots_Lot_Criteresattribution_Criteresprix_Poids,D_05_22_01_08_Objet_Lots_Lot_Quantite,D_05_22_01_09_Objet_Lots_Lot_Valeur,D_05_22_01_09_01_Objet_Lots_Lot_Valeur_Value,D_05_22_01_09_02_Objet_Lots_Lot_Valeur_Devise,D_05_22_01_10_Objet_Lots_Lot_Valeurmin,D_05_22_01_10_01_Objet_Lots_Lot_Valeurmin_Value,D_05_22_01_10_02_Objet_Lots_Lot_Valeurmin_Devise,D_05_22_01_11_Objet_Lots_Lot_Valeurmax,D_05_22_01_11_01_Objet_Lots_Lot_Valeurmax_Value,D_05_22_01_11_02_Objet_Lots_Lot_Valeurmax_Devise,D_05_22_01_12_Objet_Lots_Lot_Dureemois,D_05_22_01_13_Objet_Lots_Lot_Dureejours,D_05_22_01_14_Objet_Lots_Lot_Datedebut,D_05_22_01_15_Objet_Lots_Lot_Datefin,D_05_22_01_16_Objet_Lots_Lot_Dureesystemequalification,D_05_22_01_17_Objet_Lots_Lot_Supquatreansjustification,D_05_22_01_18_Objet_Lots_Lot_Suphuitansjustification,D_05_22_01_19_Objet_Lots_Lot_Dateexecution,D_05_22_01_20_Objet_Lots_Lot_Datelivraison,D_05_22_01_21_Objet_Lots_Lot_Datelancement,D_05_22_01_22_Objet_Lots_Lot_Renouvellementoui,D_05_22_01_23_Objet_Lots_Lot_Renouvellementnon,D_05_22_01_24_Objet_Lots_Lot_Renouvellementdescription,D_05_22_01_25_Objet_Lots_Lot_Nbcandidats,D_05_22_01_25_01_Objet_Lots_Lot_Nbcandidats_Nbmaxoffre,D_05_22_01_25_02_Objet_Lots_Lot_Nbcandidats_Nbminoffre,D_05_22_01_25_03_Objet_Lots_Lot_Nbcandidats_Nboffre,D_05_22_01_25_04_Objet_Lots_Lot_Nbcandidats_Limitationcandidats,D_05_22_01_26_Objet_Lots_Lot_Variantesoui,D_05_22_01_27_Objet_Lots_Lot_Variantesnon,D_05_22_01_28_Objet_Lots_Lot_Optionsoui,D_05_22_01_29_Objet_Lots_Lot_Optionsnon,D_05_22_01_30_Objet_Lots_Lot_Optionsdescription,D_05_22_01_31_Objet_Lots_Lot_Catalogueelectroniqueoui,D_05_22_01_32_Objet_Lots_Lot_Catalogueelectroniquenon,D_05_22_01_33_Objet_Lots_Lot_Fondscommunautairesoui,D_05_22_01_34_Objet_Lots_Lot_Fondscommunautairesnon,D_05_22_01_35_Objet_Lots_Lot_Fondscommunautairesdescription,D_05_22_01_36_Objet_Lots_Lot_Infocompl,D_05_23_Objet_Infocompl
22-16699,,,CF_NIV_SUIV,CF_NIV_SUIV,False,False,False,CF_NIV_SUIV,False,False,,,,,L'objet du présent marché est la gestion des paies ainsi que les prestations associées et annexes de l'ensemble des personnels de la Fondation PSL.,CF_NIV_SUIV,,,CF_NIV_SUIV,60 rue Mazarine,75006.0,Paris,,CF_NIV_SUIV,,CF_NIV_SUIV,,,,,,,,,,,,,False,False,CF_NIV_SUIV,False,,CF_NIV_SUIV,False,False,,CF_NIV_SUIV,,,,,,,,CF_NIV_SUIV,,,CF_NIV_SUIV,,,CF_NIV_SUIV,,,,,,False,False,CF_NIV_SUIV,,L'objet du présent marché est la gestion des paies ainsi que les prestations associées et annexes de l'ensemble des personnels de la Fondation PSL.,CF_NIV_SUIV,,,CF_NIV_SUIV,,,CF_NIV_SUIV,,,CF_NIV_SUIV,,,,--None--,CF_NIV_SUIV,False,,,,False,CF_NIV_SUIV,,,,,,,,,False,CF_NIV_SUIV,,,,,,,CF_NIV_SUIV,False,False,False,False,False,,,,,CF_NIV_SUIV,,,,,,,,,,,,,,,,,,,,,,,,,,,,,,,,,,,,,,,,,,,,,,,,,,,,,,,,,,,,,
22-16701,,,CF_NIV_SUIV,CF_NIV_SUIV,True,False,False,CF_NIV_SUIV,False,False,,,,,VARCES (38) - Quartier de Reyniès- 7ème BCA /93ème RAM - Réhabilitation du bâtiment 0022 - Création de chambres rustiques,CF_NIV_SUIV,45200000.0,,CF_NIV_SUIV,Quartier de Reyniès,38760.0,Varces,FRK24,CF_NIV_SUIV,,CF_NIV_SUIV,,,,,,,,,,,,,False,False,CF_NIV_SUIV,False,,CF_NIV_SUIV,False,False,,CF_NIV_SUIV,,,,,,,,CF_NIV_SUIV,,,CF_NIV_SUIV,,,CF_NIV_SUIV,,,,,,False,False,CF_NIV_SUIV,,,CF_NIV_SUIV,,,CF_NIV_SUIV,,,CF_NIV_SUIV,,,CF_NIV_SUIV,,,,--None--,CF_NIV_SUIV,False,,,,False,CF_NIV_SUIV,,,,,,,,,False,CF_NIV_SUIV,,,,,,,CF_NIV_SUIV,False,False,False,False,False,,,,,CF_NIV_SUIV,,,,,,,,,,,,,,,,,,,,,,,,,,,,,,,,,,,,,,,,,,,,,,,,,,,,,,,,,,,,,
22-16706,,,CF_NIV_SUIV,CF_NIV_SUIV,False,False,False,CF_NIV_SUIV,False,False,,,,,   Prestations relatives au pompage et nettoyage de séparateurs des centres de transfert de ValorAisne,CF_NIV_SUIV,,,CF_NIV_SUIV,,,,,CF_NIV_SUIV,,CF_NIV_SUIV,,,,,,,,,,,,,False,False,CF_NIV_SUIV,False,,CF_NIV_SUIV,False,False,,CF_NIV_SUIV,,,,,,,,CF_NIV_SUIV,,,CF_NIV_SUIV,,,CF_NIV_SUIV,,,,,,False,False,CF_NIV_SUIV,,,CF_NIV_SUIV,,,CF_NIV_SUIV,,,CF_NIV_SUIV,,,CF_NIV_SUIV,,,,--None--,CF_NIV_SUIV,False,,,,False,CF_NIV_SUIV,,,,,,,,,False,CF_NIV_SUIV,,,,,,,CF_NIV_SUIV,False,False,False,False,False,,,,,CF_NIV_SUIV,,,,,,,,,,,,,,,,,,,,,,,,,,,,,,,,,,,,,,,,,,,,,,,,,,,,,,,,,,,,,
22-16707,,,CF_NIV_SUIV,CF_NIV_SUIV,False,False,False,CF_NIV_SUIV,False,False,,,,,   Traitement des déchets ménagers issus de la collecte sélective de l?ensemble des territoires des collectivités adhérentes à Valor?Aisne,CF_NIV_SUIV,,,CF_NIV_SUIV,,,,,CF_NIV_SUIV,,CF_NIV_SUIV,,,,,,,,,,,,,False,False,CF_NIV_SUIV,False,,CF_NIV_SUIV,False,False,,CF_NIV_SUIV,,,,,,,,CF_NIV_SUIV,,,CF_NIV_SUIV,,,CF_NIV_SUIV,,,,,,False,False,CF_NIV_SUIV,,,CF_NIV_SUIV,,,CF_NIV_SUIV,,,CF_NIV_SUIV,,,CF_NIV_SUIV,,,,--None--,CF_NIV_SUIV,False,,,,False,CF_NIV_SUIV,,,,,,,,,False,CF_NIV_SUIV,,,,,,,CF_NIV_SUIV,False,False,False,False,False,,,,,CF_NIV_SUIV,,,,,,,,,,,,,,,,,,,,,,,,,,,,,,,,,,,,,,,,,,,,,,,,,,,,,,,,,,,,,
22-16732,,,CF_NIV_SUIV,CF_NIV_SUIV,False,False,False,CF_NIV_SUIV,False,False,,,,,Accompagnement médico-social pour les besoins du Département de la Sarthe,CF_NIV_SUIV,79998000.0,,CF_NIV_SUIV,,,,,CF_NIV_SUIV,,CF_NIV_SUIV,,,,,,,,,,,,,False,False,CF_NIV_SUIV,False,,CF_NIV_SUIV,False,False,,CF_NIV_SUIV,,,,,,,,CF_NIV_SUIV,,,CF_NIV_SUIV,,,CF_NIV_SUIV,,,,,,False,False,CF_NIV_SUIV,,,CF_NIV_SUIV,,,CF_NIV_SUIV,,,CF_NIV_SUIV,,,CF_NIV_SUIV,,,,--None--,CF_NIV_SUIV,False,,,,False,CF_NIV_SUIV,,,,,,,,,False,CF_NIV_SUIV,,,,,,,CF_NIV_SUIV,False,False,False,False,False,,,,,CF_NIV_SUIV,,,,,,,,,,,,,,,,,,,,,,,,,,,,,,,,,,,,,,,,,,,,,,,,,,,,,,,,,,,,,
22-16733,DAF_2021_001832,,CF_NIV_SUIV,CF_NIV_SUIV,False,False,False,CF_NIV_SUIV,False,False,,,,,"Réalisation de prestations de fabrication et/ou de conditionnement de spécialités pharmaceutiques produites par la Pharmacie Centrale des Armées.Cet accord-cadre est multi-attributaire.Le mode de fonctionnement du contrat est identique à tous les lots, l'attribution et la notification des bons de commande est réalisée en cascade. Ils sont transmis en priorité au titulaire de rang un (classé premier à l'issue de l'analyse des offres) dans le lot considéré.Le titulaire de rang deux du même lot (classé deuxième à l'issue de l'analyse des offres) sera destinataire du bon de commande, si le titulaire principal est dans l'impossibilité de réaliser les prestations du bon de commande. Le titulaire de rang trois du même lot (troisième à l'issue de l'analyse des offres) sera destinataire du bon de commande, si le titulaire de rang deux (classé deuxième à l'issue de l'analyse des offres) est dans l'impossibilité de réaliser les prestations du bon de commande. Si, un titulaire est dans l'impossibilité de réaliser les prestations d'un bon de commande, il doit avertir le pouvoir adjudicateur et la Pharmacie Centrale des Armées, dans les 48 heures ouvrées à compter de la réception du bon de commande, par courriel ou fax. Le pouvoir adjudicateur pourra alors mettre en oeuvre l'attribution des bons de commandes en cascade.En cas d'impossibilité de l'ensemble des titulaires de réaliser les prestations d'un bon de commande dans les délais exprimés dans leurs offres, le bon de commande pourra être confié au titulaire présentant le délai de réalisation des prestations le plus court.",CF_NIV_SUIV,79920000.0,,CF_NIV_SUIV,,,,,CF_NIV_SUIV,,CF_NIV_SUIV,,,,,,,,,,,,,False,False,CF_NIV_SUIV,False,,CF_NIV_SUIV,False,False,,CF_NIV_SUIV,,,,,,,,CF_NIV_SUIV,,,CF_NIV_SUIV,,,CF_NIV_SUIV,,,,,,False,False,CF_NIV_SUIV,,,CF_NIV_SUIV,,,CF_NIV_SUIV,,,CF_NIV_SUIV,,,CF_NIV_SUIV,,,,--None--,CF_NIV_SUIV,False,,,,False,CF_NIV_SUIV,,,,,,,,,False,CF_NIV_SUIV,,,,,,,CF_NIV_SUIV,False,False,False,False,False,,,,,CF_NIV_SUIV,,,,,,,,,,,,,,,,,,,,,,,,,,,,,,,,,,,,,,,,,,,,,,,,,,,,,,,,,,,,,
22-16737,,,CF_NIV_SUIV,CF_NIV_SUIV,False,False,False,CF_NIV_SUIV,False,False,,,,,Travaux pour la rénovation de la bande de roulement de la piste cyclable du canal de Huningue - Section Rosenau - Kembs,CF_NIV_SUIV,45233140.0,,CF_NIV_SUIV,,,,,CF_NIV_SUIV,,CF_NIV_SUIV,,,,,,,,,,,,,False,False,CF_NIV_SUIV,False,,CF_NIV_SUIV,False,False,,CF_NIV_SUIV,,,,,,,,CF_NIV_SUIV,,,CF_NIV_SUIV,,,CF_NIV_SUIV,,,,,,False,False,CF_NIV_SUIV,,,CF_NIV_SUIV,,,CF_NIV_SUIV,,,CF_NIV_SUIV,,,CF_NIV_SUIV,,,,--None--,CF_NIV_SUIV,False,,,,False,CF_NIV_SUIV,,,,,,,,,False,CF_NIV_SUIV,,,,,,,CF_NIV_SUIV,False,False,False,False,False,,,,,CF_NIV_SUIV,,,,,,,,,,,,,,,,,,,,,,,,,,,,,,,,,,,,,,,,,,,,,,,,,,,,,,,,,,,,,
22-16737,,,CF_NIV_SUIV,CF_NIV_SUIV,False,False,False,CF_NIV_SUIV,False,False,,,,,Travaux pour la rénovation de la bande de roulement de la piste cyclable du canal de Huningue - Section Rosenau - Kembs,CF_NIV_SUIV,45112500.0,,CF_NIV_SUIV,,,,,CF_NIV_SUIV,,CF_NIV_SUIV,,,,,,,,,,,,,False,False,CF_NIV_SUIV,False,,CF_NIV_SUIV,False,False,,CF_NIV_SUIV,,,,,,,,CF_NIV_SUIV,,,CF_NIV_SUIV,,,CF_NIV_SUIV,,,,,,False,False,CF_NIV_SUIV,,,CF_NIV_SUIV,,,CF_NIV_SUIV,,,CF_NIV_SUIV,,,CF_NIV_SUIV,,,,--None--,CF_NIV_SUIV,False,,,,False,CF_NIV_SUIV,,,,,,,,,False,CF_NIV_SUIV,,,,,,,CF_NIV_SUIV,False,False,False,False,False,,,,,CF_NIV_SUIV,,,,,,,,,,,,,,,,,,,,,,,,,,,,,,,,,,,,,,,,,,,,,,,,,,,,,,,,,,,,,
22-16737,,,CF_NIV_SUIV,CF_NIV_SUIV,False,False,False,CF_NIV_SUIV,False,False,,,,,Travaux pour la rénovation de la bande de roulement de la piste cyclable du canal de Huningue - Section Rosenau - Kembs,CF_NIV_SUIV,45112700.0,,CF_NIV_SUIV,,,,,CF_NIV_SUIV,,CF_NIV_SUIV,,,,,,,,,,,,,False,False,CF_NIV_SUIV,False,,CF_NIV_SUIV,False,False,,CF_NIV_SUIV,,,,,,,,CF_NIV_SUIV,,,CF_NIV_SUIV,,,CF_NIV_SUIV,,,,,,False,False,CF_NIV_SUIV,,,CF_NIV_SUIV,,,CF_NIV_SUIV,,,CF_NIV_SUIV,,,CF_NIV_SUIV,,,,--None--,CF_NIV_SUIV,False,,,,False,CF_NIV_SUIV,,,,,,,,,False,CF_NIV_SUIV,,,,,,,CF_NIV_SUIV,False,False,False,False,False,,,,,CF_NIV_SUIV,,,,,,,,,,,,,,,,,,,,,,,,,,,,,,,,,,,,,,,,,,,,,,,,,,,,,,,,,,,,,
22-16743,,,CF_NIV_SUIV,CF_NIV_SUIV,False,False,False,CF_NIV_SUIV,False,False,,,,,"Fourniture et livraison de pièces de rechange, accessoires et consommables pour la réparation et l'entretien des véhicules de marque Ford, au profit du Bataillon de Marins-Pompiers de Marseille.",CF_NIV_SUIV,34300000.0,,CF_NIV_SUIV,,,,,CF_NIV_SUIV,,CF_NIV_SUIV,,,,,,,,,,,,,False,False,CF_NIV_SUIV,False,,CF_NIV_SUIV,False,False,,CF_NIV_SUIV,,,,,,,,CF_NIV_SUIV,,,CF_NIV_SUIV,,,CF_NIV_SUIV,,,,,,False,False,CF_NIV_SUIV,,,CF_NIV_SUIV,,,CF_NIV_SUIV,,,CF_NIV_SUIV,,,CF_NIV_SUIV,,,,--None--,CF_NIV_SUIV,False,,,,False,CF_NIV_SUIV,,,,,,,,,False,CF_NIV_SUIV,,,,,,,CF_NIV_SUIV,False,False,False,False,False,,,,,CF_NIV_SUIV,,,,,,,,,,,,,,,,,,,,,,,,,,,,,,,,,,,,,,,,,,,,,,,,,,,,,,,,,,,,,
22-16753,,,CF_NIV_SUIV,CF_NIV_SUIV,False,False,False,CF_NIV_SUIV,False,False,,,,,ETUDE PRE-OPERATIONNELLE D'OPERATION PROGRAMMEE D'AMELIORATION DE L'HABITAT- RENOUVELLEMENT URBAIN (OPAH-RU),CF_NIV_SUIV,,,CF_NIV_SUIV,,,,,CF_NIV_SUIV,,CF_NIV_SUIV,,,,,,,,,,,,,False,False,CF_NIV_SUIV,False,,CF_NIV_SUIV,False,False,,CF_NIV_SUIV,,,,,,,,CF_NIV_SUIV,,,CF_NIV_SUIV,,,CF_NIV_SUIV,,,,,,False,True,CF_NIV_SUIV,,ETUDE PRE-OPERATIONNELLE D'OPERATION PROGRAMMEE D'AMELIORATION DE L'HABITAT- RENOUVELLEMENT URBAIN (OPAH-RU),CF_NIV_SUIV,,,CF_NIV_SUIV,,,CF_NIV_SUIV,,,CF_NIV_SUIV,,,,--None--,CF_NIV_SUIV,False,,,,False,CF_NIV_SUIV,,,,,,,,,False,CF_NIV_SUIV,60.0,,,,,,CF_NIV_SUIV,False,False,False,False,False,,,,,CF_NIV_SUIV,,,,,,,,,,,,,,,,,,,,,,,,,,,,,,,,,,,,,,,,,,,,,,,,,,,,,,,,,,,,,
22-16763,,,CF_NIV_SUIV,CF_NIV_SUIV,False,False,False,CF_NIV_SUIV,False,False,,,,,La présente consultation a pour objet l'accompagnement et le suivi du déploiement du contrôle interne au sein de la CFE,CF_NIV_SUIV,,,CF_NIV_SUIV,160 rue des Meuniers,77950.0,Rubelles,,CF_NIV_SUIV,,CF_NIV_SUIV,,,,,,,,,,,,,False,False,CF_NIV_SUIV,False,,CF_NIV_SUIV,False,False,,CF_NIV_SUIV,,,,,,,,CF_NIV_SUIV,,,CF_NIV_SUIV,,,CF_NIV_SUIV,,,,,,False,True,CF_NIV_SUIV,,La présente consultation a pour objet l'accompagnement et le suivi du déploiement du contrôle interne au sein de la CFE,CF_NIV_SUIV,,,CF_NIV_SUIV,,,CF_NIV_SUIV,,,CF_NIV_SUIV,,,,--None--,CF_NIV_SUIV,False,,,,False,CF_NIV_SUIV,,,,,,,,,False,CF_NIV_SUIV,12.0,,,,,,CF_NIV_SUIV,False,False,False,False,True,,,,,CF_NIV_SUIV,,,,,,,,,,,,,,,,,,,,,,,,,,,,,,,,,,,,,,,,,,,,,,,,,,,,,,,,,,,,,
22-16767,,,CF_NIV_SUIV,CF_NIV_SUIV,False,False,False,CF_NIV_SUIV,False,False,,,,,Etudes de mobilité pour la faisabilité relative à l'implantation d'une Halle de sports d'environ 5500 places sur le site du Palais des Sports René Bougnol à Montpellier.,CF_NIV_SUIV,,,CF_NIV_SUIV,Palais des Sports René Bougnol,34000.0,Montpellier,,CF_NIV_SUIV,,CF_NIV_SUIV,,,,,,,,,,,,,False,False,CF_NIV_SUIV,False,,CF_NIV_SUIV,False,False,,CF_NIV_SUIV,,,,,,,,CF_NIV_SUIV,,,CF_NIV_SUIV,,,CF_NIV_SUIV,,,,,,False,False,CF_NIV_SUIV,,Etudes de mobilité pour la faisabilité relative à l'implantation d'une Halle de sports d'environ 5500 places sur le site du Palais des Sports René Bougnol à Montpellier.,CF_NIV_SUIV,,,CF_NIV_SUIV,,,CF_NIV_SUIV,,,CF_NIV_SUIV,,,,--None--,CF_NIV_SUIV,False,,,,False,CF_NIV_SUIV,,,,,,,,,False,CF_NIV_SUIV,,,,,,,CF_NIV_SUIV,False,False,False,False,False,,,,,CF_NIV_SUIV,,,,,,,,,,,,,,,,,,,,,,,,,,,,,,,,,,,,,,,,,,,,,,,,,,,,,,,,,,,,,
22-16774,,,CF_NIV_SUIV,CF_NIV_SUIV,False,False,False,CF_NIV_SUIV,False,False,,,,,Contrôle technique pour l'amélioration de la vie quotidienne d'un collège à Marquette Lez Lille pour le Département du Nord,CF_NIV_SUIV,,,CF_NIV_SUIV,Département du Nord,59000.0,<ville>Département du Nord</ville>,,CF_NIV_SUIV,,CF_NIV_SUIV,,,,,,,,,,,,,False,False,CF_NIV_SUIV,False,,CF_NIV_SUIV,False,False,,CF_NIV_SUIV,,,,,,,,CF_NIV_SUIV,,,CF_NIV_SUIV,,,CF_NIV_SUIV,,,,,,False,True,CF_NIV_SUIV,Mission de Contrôle Technique relatif à l'amélioration de la vie quotidienne au collège Albert Debeyre de Marquette lez Lille pour le Département du Nord,Contrôle technique pour l'amélioration de la vie quotidienne d'un collège à Marquette Lez Lille pour le Département du Nord,CF_NIV_SUIV,,,CF_NIV_SUIV,,,CF_NIV_SUIV,,,CF_NIV_SUIV,,,,--None--,CF_NIV_SUIV,False,,,,False,CF_NIV_SUIV,,,,,,,,,False,CF_NIV_SUIV,36.0,,,,,,CF_NIV_SUIV,False,False,False,False,True,,,,,CF_NIV_SUIV,,,,,,,,,,,,,,,,,,,,,,,,,,,,,,,,,,,,,,,,,,,,,,,,,,,,,,,,,,,,,
22-16779,,,CF_NIV_SUIV,CF_NIV_SUIV,False,False,False,CF_NIV_SUIV,False,False,,,,,Accompagnement à la mise en place d'une nouvelle gouvernance,CF_NIV_SUIV,,,CF_NIV_SUIV,Hôtel du département,18023.0,<ville>BOURGES</ville>,,CF_NIV_SUIV,,CF_NIV_SUIV,,,,,,,,,,,,,False,False,CF_NIV_SUIV,False,,CF_NIV_SUIV,False,False,,CF_NIV_SUIV,,,,,,,,CF_NIV_SUIV,,,CF_NIV_SUIV,,,CF_NIV_SUIV,,,,,,False,True,CF_NIV_SUIV,"La procédure de passation utilisée est la procédure adaptée ouverte. Elle est soumise aux dispositions des articles L. 2123-1 et R. 2123-1 1° du Code de la commande publique.Après examen des offres, le pouvoir adjudicateur engagera des négociations avec tous les candidats sélectionnés. Toutefois, le pouvoir adjudicateur se réserve la possibilité d'attribuer le marché sur la base des offres initiales, sans négociation","Le pouvoir adjudicateur pourra confier au titulaire du marché, en application des articles L. 2122-1 et R. 2122-7 du Code de la commande publique, un ou plusieurs nouveaux marchés ayant pour objet la réalisation de prestations similaires à hauteur de 50% du montant du marché",CF_NIV_SUIV,,,CF_NIV_SUIV,,,CF_NIV_SUIV,,,CF_NIV_SUIV,,,,--None--,CF_NIV_SUIV,False,,,,False,CF_NIV_SUIV,,,,,,,,,False,CF_NIV_SUIV,6.0,,,,,,CF_NIV_SUIV,False,False,False,False,True,,,,,CF_NIV_SUIV,,,,,,,,,,,,,,,,,,,,,,,,,,,,,,,,,,,,,,,,,,,,,,,,,,,,,,,,,,,,,
22-16784,,,CF_NIV_SUIV,CF_NIV_SUIV,False,False,False,CF_NIV_SUIV,False,False,,,,,TRAVAUX POUR LA CREATION D'UN BARREAU PLUVIAL ENTRE LA ZEC RINGEVAL A LIBERCOURT ET LE COURANT DE LA MOTTE A OIGNIES,CF_NIV_SUIV,45232410.0,,CF_NIV_SUIV,,,,,CF_NIV_SUIV,,CF_NIV_SUIV,,,,,,,,,,,,,False,False,CF_NIV_SUIV,False,,CF_NIV_SUIV,False,False,,CF_NIV_SUIV,,,,,,,,CF_NIV_SUIV,,,CF_NIV_SUIV,,,CF_NIV_SUIV,,,,,,False,False,CF_NIV_SUIV,,,CF_NIV_SUIV,,,CF_NIV_SUIV,,,CF_NIV_SUIV,,,CF_NIV_SUIV,,,,--None--,CF_NIV_SUIV,False,,,,False,CF_NIV_SUIV,,,,,,,,,False,CF_NIV_SUIV,,,,,,,CF_NIV_SUIV,False,False,False,False,False,,,,,CF_NIV_SUIV,,,,,,,,,,,,,,,,,,,,,,,,,,,,,,,,,,,,,,,,,,,,,,,,,,,,,,,,,,,,,
22-16786,,,CF_NIV_SUIV,CF_NIV_SUIV,False,False,False,CF_NIV_SUIV,False,False,,,,,Etudes réglementaires des ouvrages de protection non domaniaux d'Amboise (37),CF_NIV_SUIV,,,CF_NIV_SUIV,,,,,CF_NIV_SUIV,,CF_NIV_SUIV,,,,,,,,,,,,,False,False,CF_NIV_SUIV,False,,CF_NIV_SUIV,False,False,,CF_NIV_SUIV,,,,,,,,CF_NIV_SUIV,,,CF_NIV_SUIV,,,CF_NIV_SUIV,,,,,,False,True,CF_NIV_SUIV,"L'objet du présent marché est de réaliser les études réglementaires nécessaires à la régularisation des ouvrages ' Digue de l'Amasse ' et ' Digue de l'Ile d'Or ' à Amboise (37) : études hydrologiques et hydrauliques, visites techniques approfondies, étude de dangers de l'ouvrage en tant qu'aménagement hydraulique, étude de stabilité, reprise des consignes et du document d'organisation des deux ouvrages.",Une tranche ferme et trois tranches optionnelles,CF_NIV_SUIV,,,CF_NIV_SUIV,,,CF_NIV_SUIV,,,CF_NIV_SUIV,,,,--None--,CF_NIV_SUIV,False,,,,False,CF_NIV_SUIV,,,,,,,,,False,CF_NIV_SUIV,12.0,,,,2022-04-10 22:00:00,,CF_NIV_SUIV,False,False,False,False,True,,,,,CF_NIV_SUIV,,,,,,,,,,,,,,,,,,,,,,,,,,,,,,,,,,,,,,,,,,,,,,,,,,,,,,,,,,,,,
22-16791,,,CF_NIV_SUIV,CF_NIV_SUIV,False,False,False,CF_NIV_SUIV,False,False,,,,,Restauration d'une berge de la Vesle sur la commune de SILLERY (51),CF_NIV_SUIV,,,CF_NIV_SUIV,,,,,CF_NIV_SUIV,,CF_NIV_SUIV,,,,,,,,,,,,,False,False,CF_NIV_SUIV,False,,CF_NIV_SUIV,False,False,,CF_NIV_SUIV,,,,,,,,CF_NIV_SUIV,,,CF_NIV_SUIV,,,CF_NIV_SUIV,,,,,,False,True,CF_NIV_SUIV,,Restauration d'une berge de la Vesle sur la commune de SILLERY (51),CF_NIV_SUIV,,,CF_NIV_SUIV,,,CF_NIV_SUIV,,,CF_NIV_SUIV,,,,--None--,CF_NIV_SUIV,False,,,,False,CF_NIV_SUIV,,,,,,,,,False,CF_NIV_SUIV,24.0,,,,,,CF_NIV_SUIV,False,False,False,False,True,,,,,CF_NIV_SUIV,,,,,,,,,,,,,,,,,,,,,,,,,,,,,,,,,,,,,,,,,,,,,,,,,,,,,,,,,,,,,
22-16797,,,CF_NIV_SUIV,CF_NIV_SUIV,False,False,False,CF_NIV_SUIV,False,False,,,,,TRAVAUX DE REMPLACEMENT DES TABLEAUX HTA DES VALS DE SEINE,CF_NIV_SUIV,45310000.0,,CF_NIV_SUIV,,,,,CF_NIV_SUIV,,CF_NIV_SUIV,,,,,,,,,,,,,False,False,CF_NIV_SUIV,False,,CF_NIV_SUIV,False,False,,CF_NIV_SUIV,,,,,,,,CF_NIV_SUIV,,,CF_NIV_SUIV,,,CF_NIV_SUIV,,,,,,False,False,CF_NIV_SUIV,,,CF_NIV_SUIV,,,CF_NIV_SUIV,,,CF_NIV_SUIV,,,CF_NIV_SUIV,,,,--None--,CF_NIV_SUIV,False,,,,False,CF_NIV_SUIV,,,,,,,,,False,CF_NIV_SUIV,,,,,,,CF_NIV_SUIV,False,False,False,False,False,,,,,CF_NIV_SUIV,,,,,,,,,,,,,,,,,,,,,,,,,,,,,,,,,,,,,,,,,,,,,,,,,,,,,,,,,,,,,
22-16798,,,CF_NIV_SUIV,CF_NIV_SUIV,False,False,False,CF_NIV_SUIV,False,False,,,,,Travaux d'Aménagement - UDM PAIMPOL,CF_NIV_SUIV,45210000.0,,CF_NIV_SUIV,,,,,CF_NIV_SUIV,,CF_NIV_SUIV,,,,,,,,,,,,,False,False,CF_NIV_SUIV,False,,CF_NIV_SUIV,False,False,,CF_NIV_SUIV,,,,,,,,CF_NIV_SUIV,,,CF_NIV_SUIV,,,CF_NIV_SUIV,,,,,,False,False,CF_NIV_SUIV,,,CF_NIV_SUIV,,,CF_NIV_SUIV,,,CF_NIV_SUIV,,,CF_NIV_SUIV,,,,--None--,CF_NIV_SUIV,False,,,,False,CF_NIV_SUIV,,,,,,,,,False,CF_NIV_SUIV,,,,,,,CF_NIV_SUIV,False,False,False,False,False,,,,,CF_NIV_SUIV,,,,,,,,,,,,,,,,,,,,,,,,,,,,,,,,,,,,,,,,,,,,,,,,,,,,,,,,,,,,,
