22-17150,,,CF_NIV_SUIV,CF_NIV_SUIV,False,False,False,CF_NIV_SUIV,False,False,,,,,Fourniture de kits patient et accessoires en non tissé pour l'ambulatoire,CF_NIV_SUIV,,,CF_NIV_SUIV,,,,,CF_NIV_SUIV,,CF_NIV_SUIV,,,,,,,,,,,,,False,False,CF_NIV_SUIV,False,,CF_NIV_SUIV,False,False,,CF_NIV_SUIV,,,,,,,,CF_NIV_SUIV,,,CF_NIV_SUIV,,,CF_NIV_SUIV,,,,,,False,False,CF_NIV_SUIV,,,CF_NIV_SUIV,,,CF_NIV_SUIV,,,CF_NIV_SUIV,,,CF_NIV_SUIV,,,,--None--,CF_NIV_SUIV,False,,,,False,CF_NIV_SUIV,,,,,,,,,False,CF_NIV_SUIV,,,,,,,CF_NIV_SUIV,False,False,False,False,False,,,,,CF_NIV_SUIV,,,,,,,,,,,,,,,,,,,,,,,,,,,,,,,,,,,,,,,,,,,,,,,,,,,,,,,,,,,,,
22-17153,,,CF_NIV_SUIV,CF_NIV_SUIV,True,False,False,CF_NIV_SUIV,True,False,,,,27.0,"Rénovation et mise en conformité du foyer, restructuration du bâtiment principal, réaménagement de la cuisine et extension du réfectoire de l'ESAT Nicolas Roussel à Gézaincourt",CF_NIV_SUIV,,,CF_NIV_SUIV,2 place de l'Eglise,80600.0,gezaincourt,FRE23,CF_NIV_SUIV,,CF_NIV_SUIV,,,,,,,,,,,,,False,False,CF_NIV_SUIV,False,,CF_NIV_SUIV,False,False,,CF_NIV_SUIV,,,,,,,,CF_NIV_SUIV,,,CF_NIV_SUIV,,,CF_NIV_SUIV,,,,,,False,False,CF_NIV_SUIV,,,CF_NIV_SUIV,,,CF_NIV_SUIV,,,CF_NIV_SUIV,,,CF_NIV_SUIV,,,,--None--,CF_NIV_SUIV,False,,,,False,CF_NIV_SUIV,,,,,,,,,False,CF_NIV_SUIV,,,,,,,CF_NIV_SUIV,False,False,False,False,False,,,,,CF_NIV_SUIV,,,,,,,,,,,,,,,,,,,,,,,,,,,,,,,,,,,,,,,,,,,,,,,,,,,,,,,,,,,,,
22-17158,,,CF_NIV_SUIV,CF_NIV_SUIV,False,False,False,CF_NIV_SUIV,False,False,,,,,Canal de la Sambre à l'Oise - Fourniture pour remplacement de matériel électrique pour les automates programmables,CF_NIV_SUIV,,,CF_NIV_SUIV,VNF -UTI CPCA - SMET 7-9 rue Antoine Parmentier,2100.0,Saint-Quentin,,CF_NIV_SUIV,,CF_NIV_SUIV,,,,,,,,,,,,,False,False,CF_NIV_SUIV,False,,CF_NIV_SUIV,False,False,,CF_NIV_SUIV,,,,,,,,CF_NIV_SUIV,,,CF_NIV_SUIV,,,CF_NIV_SUIV,,,,,,False,True,CF_NIV_SUIV,Relance suite à résiliation- Type de procédure : procédure adaptée,le marché porte sur la fourniture de : - 32 plaques de base ;- 32 alimentations standard ;- 32 modules d'UC ;- 32 modules de sortie 16 points à logique positive ;- forfait livraison par transporteur.,CF_NIV_SUIV,,,CF_NIV_SUIV,,,CF_NIV_SUIV,,,CF_NIV_SUIV,,,,--None--,CF_NIV_SUIV,False,,,,False,CF_NIV_SUIV,,,,,,,,,False,CF_NIV_SUIV,,56.0,,,2022-03-31 22:00:00,,CF_NIV_SUIV,False,False,False,False,False,,,,,CF_NIV_SUIV,,,,,,,,,,,,,,,,,,,,,,,,,,,,,,,,,,,,,,,,,,,,,,,,,,,,,,,,,,,,,
22-17163,,,CF_NIV_SUIV,CF_NIV_SUIV,False,False,False,CF_NIV_SUIV,False,False,,,,,"Prestations des éducateurs sportifs (suite infructuosité des lots 8, 9, 10 et 11 de la consultation 22FCS003)",CF_NIV_SUIV,,,CF_NIV_SUIV,Hénin Beaumont,,,,CF_NIV_SUIV,,CF_NIV_SUIV,,,,,,,,,,,,,False,False,CF_NIV_SUIV,False,,CF_NIV_SUIV,False,False,,CF_NIV_SUIV,,,,,,,,CF_NIV_SUIV,,,CF_NIV_SUIV,,,CF_NIV_SUIV,,,,,,False,True,CF_NIV_SUIV,Prestations d'éducateurs sportifs,le marché sera valable une année et reconductible une fois,CF_NIV_SUIV,,,CF_NIV_SUIV,,,CF_NIV_SUIV,,,CF_NIV_SUIV,,,,--None--,CF_NIV_SUIV,False,,,,False,CF_NIV_SUIV,,,,,,,,,False,CF_NIV_SUIV,,,,,,,CF_NIV_SUIV,True,False,True,False,False,,,,,CF_NIV_SUIV,CF_NIV_SUIV,1,,Enseignant en activité physique adaptée à l'Atrium (séance du jeudi de 13h15 à 14h15),CF_NIV_SUIV,,,,,CF_NIV_SUIV,False,CF_NIV_SUIV,CF_NIV_SUIV,,,CF_NIV_SUIV,CF_NIV_SUIV,,,CF_NIV_SUIV,,,CF_NIV_SUIV,,,CF_NIV_SUIV,,,CF_NIV_SUIV,,,,,,,,,,,,,False,,,CF_NIV_SUIV,,,,,,False,False,False,,,,,False,,,
22-17163,,,CF_NIV_SUIV,CF_NIV_SUIV,False,False,False,CF_NIV_SUIV,False,False,,,,,"Prestations des éducateurs sportifs (suite infructuosité des lots 8, 9, 10 et 11 de la consultation 22FCS003)",CF_NIV_SUIV,,,CF_NIV_SUIV,Hénin Beaumont,,,,CF_NIV_SUIV,,CF_NIV_SUIV,,,,,,,,,,,,,False,False,CF_NIV_SUIV,False,,CF_NIV_SUIV,False,False,,CF_NIV_SUIV,,,,,,,,CF_NIV_SUIV,,,CF_NIV_SUIV,,,CF_NIV_SUIV,,,,,,False,True,CF_NIV_SUIV,Prestations d'éducateurs sportifs,le marché sera valable une année et reconductible une fois,CF_NIV_SUIV,,,CF_NIV_SUIV,,,CF_NIV_SUIV,,,CF_NIV_SUIV,,,,--None--,CF_NIV_SUIV,False,,,,False,CF_NIV_SUIV,,,,,,,,,False,CF_NIV_SUIV,,,,,,,CF_NIV_SUIV,True,False,True,False,False,,,,,CF_NIV_SUIV,CF_NIV_SUIV,2,,Enseignant en activité physique adaptée à l'Atrium (séance du jeudi de 18h à 19h),CF_NIV_SUIV,,,,,CF_NIV_SUIV,False,CF_NIV_SUIV,CF_NIV_SUIV,,,CF_NIV_SUIV,CF_NIV_SUIV,,,CF_NIV_SUIV,,,CF_NIV_SUIV,,,CF_NIV_SUIV,,,CF_NIV_SUIV,,,,,,,,,,,,,False,,,CF_NIV_SUIV,,,,,,False,False,False,,,,,False,,,
22-17163,,,CF_NIV_SUIV,CF_NIV_SUIV,False,False,False,CF_NIV_SUIV,False,False,,,,,"Prestations des éducateurs sportifs (suite infructuosité des lots 8, 9, 10 et 11 de la consultation 22FCS003)",CF_NIV_SUIV,,,CF_NIV_SUIV,Hénin Beaumont,,,,CF_NIV_SUIV,,CF_NIV_SUIV,,,,,,,,,,,,,False,False,CF_NIV_SUIV,False,,CF_NIV_SUIV,False,False,,CF_NIV_SUIV,,,,,,,,CF_NIV_SUIV,,,CF_NIV_SUIV,,,CF_NIV_SUIV,,,,,,False,True,CF_NIV_SUIV,Prestations d'éducateurs sportifs,le marché sera valable une année et reconductible une fois,CF_NIV_SUIV,,,CF_NIV_SUIV,,,CF_NIV_SUIV,,,CF_NIV_SUIV,,,,--None--,CF_NIV_SUIV,False,,,,False,CF_NIV_SUIV,,,,,,,,,False,CF_NIV_SUIV,,,,,,,CF_NIV_SUIV,True,False,True,False,False,,,,,CF_NIV_SUIV,CF_NIV_SUIV,3,,Enseignant en activité physique adaptée à l'Atrium (séance du vendredi de 13h30 à 14h30),CF_NIV_SUIV,,,,,CF_NIV_SUIV,False,CF_NIV_SUIV,CF_NIV_SUIV,,,CF_NIV_SUIV,CF_NIV_SUIV,,,CF_NIV_SUIV,,,CF_NIV_SUIV,,,CF_NIV_SUIV,,,CF_NIV_SUIV,,,,,,,,,,,,,False,,,CF_NIV_SUIV,,,,,,False,False,False,,,,,False,,,
22-17163,,,CF_NIV_SUIV,CF_NIV_SUIV,False,False,False,CF_NIV_SUIV,False,False,,,,,"Prestations des éducateurs sportifs (suite infructuosité des lots 8, 9, 10 et 11 de la consultation 22FCS003)",CF_NIV_SUIV,,,CF_NIV_SUIV,Hénin Beaumont,,,,CF_NIV_SUIV,,CF_NIV_SUIV,,,,,,,,,,,,,False,False,CF_NIV_SUIV,False,,CF_NIV_SUIV,False,False,,CF_NIV_SUIV,,,,,,,,CF_NIV_SUIV,,,CF_NIV_SUIV,,,CF_NIV_SUIV,,,,,,False,True,CF_NIV_SUIV,Prestations d'éducateurs sportifs,le marché sera valable une année et reconductible une fois,CF_NIV_SUIV,,,CF_NIV_SUIV,,,CF_NIV_SUIV,,,CF_NIV_SUIV,,,,--None--,CF_NIV_SUIV,False,,,,False,CF_NIV_SUIV,,,,,,,,,False,CF_NIV_SUIV,,,,,,,CF_NIV_SUIV,True,False,True,False,False,,,,,CF_NIV_SUIV,CF_NIV_SUIV,4,,Enseignant en activité physique adaptée à l'Atrium (séance du vendredi de 17h à 18h),CF_NIV_SUIV,,,,,CF_NIV_SUIV,False,CF_NIV_SUIV,CF_NIV_SUIV,,,CF_NIV_SUIV,CF_NIV_SUIV,,,CF_NIV_SUIV,,,CF_NIV_SUIV,,,CF_NIV_SUIV,,,CF_NIV_SUIV,,,,,,,,,,,,,False,,,CF_NIV_SUIV,,,,,,False,False,False,,,,,False,,,
22-17178,,,CF_NIV_SUIV,CF_NIV_SUIV,False,False,False,CF_NIV_SUIV,False,False,,,,,Construction d'un restaurant mutualisé élémentaire et école - Extension de l'école Rapp à Souffelweyershim - Mission de contrôle technique,CF_NIV_SUIV,,,CF_NIV_SUIV,,,,,CF_NIV_SUIV,,CF_NIV_SUIV,,,,,,,,,,,,,False,False,CF_NIV_SUIV,False,,CF_NIV_SUIV,False,False,,CF_NIV_SUIV,,,,,,,,CF_NIV_SUIV,,,CF_NIV_SUIV,,,CF_NIV_SUIV,,,,,,False,True,CF_NIV_SUIV,"La présente consultation concerne un ensemble de prestations intellectuelles constituant la mission de contrôle technique à effectuer aux stades des études, de la réalisation, de la réception et du parfait achèvement en vue des travaux de construction d'un restaurant mutualisé élémentaire et école - Extension de l'école RAPP à SOUFFELWEYERSHEIM.Montant total de l'enveloppe 3.375.000 euro HT (valeur mai 2021).Les missions confiées au contrôleur technique sont :- LP : solidité des ouvrages et des éléments d'équipement indissociable et solidité des éléments d'équipement dissociables.- SEI : Sécurité incendie des personnes dans les établissements recevant du public- LE: Sécurité des personnes dans les existantsMissions complémentaires :- Attestation thermique finale (Att RT/RE) : Thermique des constructions- F : Fonctionnement des installations- PS : Sécurité des personnes dans les constructions en cas de séisme- PV : Récolement des procès-verbaux des essais des équipements de l'ouvrage- Hand yc attestation d'accessibilité : Accessibilité des personnes handicapées- VIEL : Vérification Initiale des Installations Électriques- CONSUEL : Vérification de la conformité des installations électriques préalablement à la mise sous tensionÉlément de mission complémentaire (en tranche optionnelle) :Th : Isolation thermique et économies d'énergie",,CF_NIV_SUIV,,,CF_NIV_SUIV,,,CF_NIV_SUIV,,,CF_NIV_SUIV,,,,--None--,CF_NIV_SUIV,False,,,,False,CF_NIV_SUIV,,,,,,,,,False,CF_NIV_SUIV,,,,,,,CF_NIV_SUIV,False,False,False,False,False,,,,,CF_NIV_SUIV,,,,,,,,,,,,,,,,,,,,,,,,,,,,,,,,,,,,,,,,,,,,,,,,,,,,,,,,,,,,,
22-17212,,,CF_NIV_SUIV,CF_NIV_SUIV,False,False,False,CF_NIV_SUIV,False,False,,,,,Lotissement: 'les Prés Timballots',CF_NIV_SUIV,,,CF_NIV_SUIV,rue de Vesoul,90300.0,Cravanche,,CF_NIV_SUIV,,CF_NIV_SUIV,,,,,,,,,,,,,False,False,CF_NIV_SUIV,False,,CF_NIV_SUIV,False,False,,CF_NIV_SUIV,,,,,,,,CF_NIV_SUIV,,,CF_NIV_SUIV,,,CF_NIV_SUIV,,,,,,False,False,CF_NIV_SUIV,,,CF_NIV_SUIV,,,CF_NIV_SUIV,,,CF_NIV_SUIV,,,CF_NIV_SUIV,,,,--None--,CF_NIV_SUIV,False,,,,False,CF_NIV_SUIV,,,,,,,,,False,CF_NIV_SUIV,,,,,,,CF_NIV_SUIV,True,False,True,False,False,,,,,CF_NIV_SUIV,CF_NIV_SUIV,1,,Voirie et réseaux humides,CF_NIV_SUIV,,,,,CF_NIV_SUIV,False,CF_NIV_SUIV,CF_NIV_SUIV,,,CF_NIV_SUIV,CF_NIV_SUIV,,,CF_NIV_SUIV,,,CF_NIV_SUIV,,,CF_NIV_SUIV,,,CF_NIV_SUIV,,,,,,,,,,,,,False,,,CF_NIV_SUIV,,,,,,False,False,False,,,,,False,,,
22-17212,,,CF_NIV_SUIV,CF_NIV_SUIV,False,False,False,CF_NIV_SUIV,False,False,,,,,Lotissement: 'les Prés Timballots',CF_NIV_SUIV,,,CF_NIV_SUIV,rue de Vesoul,90300.0,Cravanche,,CF_NIV_SUIV,,CF_NIV_SUIV,,,,,,,,,,,,,False,False,CF_NIV_SUIV,False,,CF_NIV_SUIV,False,False,,CF_NIV_SUIV,,,,,,,,CF_NIV_SUIV,,,CF_NIV_SUIV,,,CF_NIV_SUIV,,,,,,False,False,CF_NIV_SUIV,,,CF_NIV_SUIV,,,CF_NIV_SUIV,,,CF_NIV_SUIV,,,CF_NIV_SUIV,,,,--None--,CF_NIV_SUIV,False,,,,False,CF_NIV_SUIV,,,,,,,,,False,CF_NIV_SUIV,,,,,,,CF_NIV_SUIV,True,False,True,False,False,,,,,CF_NIV_SUIV,CF_NIV_SUIV,2,,Réseaux secs,CF_NIV_SUIV,,,,,CF_NIV_SUIV,False,CF_NIV_SUIV,CF_NIV_SUIV,,,CF_NIV_SUIV,CF_NIV_SUIV,,,CF_NIV_SUIV,,,CF_NIV_SUIV,,,CF_NIV_SUIV,,,CF_NIV_SUIV,,,,,,,,,,,,,False,,,CF_NIV_SUIV,,,,,,False,False,False,,,,,False,,,
22-17219,,,CF_NIV_SUIV,CF_NIV_SUIV,False,False,False,CF_NIV_SUIV,False,False,,,,,Travaux de réhabilitation et d'extension de la Maison Technique du Département des deux lacs à Yenne,CF_NIV_SUIV,45110000.0,,CF_NIV_SUIV,,,,,CF_NIV_SUIV,,CF_NIV_SUIV,,,,,,,,,,,,,False,False,CF_NIV_SUIV,False,,CF_NIV_SUIV,False,False,,CF_NIV_SUIV,,,,,,,,CF_NIV_SUIV,,,CF_NIV_SUIV,,,CF_NIV_SUIV,,,,,,False,False,CF_NIV_SUIV,,,CF_NIV_SUIV,,,CF_NIV_SUIV,,,CF_NIV_SUIV,,,CF_NIV_SUIV,,,,--None--,CF_NIV_SUIV,False,,,,False,CF_NIV_SUIV,,,,,,,,,False,CF_NIV_SUIV,,,,,,,CF_NIV_SUIV,False,False,False,False,False,,,,,CF_NIV_SUIV,,,,,,,,,,,,,,,,,,,,,,,,,,,,,,,,,,,,,,,,,,,,,,,,,,,,,,,,,,,,,
22-17220,,,CF_NIV_SUIV,CF_NIV_SUIV,False,False,False,CF_NIV_SUIV,False,False,,,,,Restaurant inter-administratif - Réfection des toitures terrasse - pose de panneaux photovoltaïques - isolation thermique par l'extérieur des façades - remplacement des menuiseries extérieures,CF_NIV_SUIV,45210000.0,,CF_NIV_SUIV,,,,,CF_NIV_SUIV,,CF_NIV_SUIV,,,,,,,,,,,,,False,False,CF_NIV_SUIV,False,,CF_NIV_SUIV,False,False,,CF_NIV_SUIV,,,,,,,,CF_NIV_SUIV,,,CF_NIV_SUIV,,,CF_NIV_SUIV,,,,,,False,False,CF_NIV_SUIV,,,CF_NIV_SUIV,,,CF_NIV_SUIV,,,CF_NIV_SUIV,,,CF_NIV_SUIV,,,,--None--,CF_NIV_SUIV,False,,,,False,CF_NIV_SUIV,,,,,,,,,False,CF_NIV_SUIV,,,,,,,CF_NIV_SUIV,False,False,False,False,False,,,,,CF_NIV_SUIV,,,,,,,,,,,,,,,,,,,,,,,,,,,,,,,,,,,,,,,,,,,,,,,,,,,,,,,,,,,,,
22-17232,,,CF_NIV_SUIV,CF_NIV_SUIV,False,False,False,CF_NIV_SUIV,False,False,,,,,Travaux de réfection de l'étanchéité de la toiture de l'école maternelle Jean Macé,CF_NIV_SUIV,,,CF_NIV_SUIV,,,,,CF_NIV_SUIV,,CF_NIV_SUIV,,,,,,,,,,,,,False,False,CF_NIV_SUIV,False,,CF_NIV_SUIV,False,False,,CF_NIV_SUIV,,,,,,,,CF_NIV_SUIV,,,CF_NIV_SUIV,,,CF_NIV_SUIV,,,,,,True,False,CF_NIV_SUIV,Les variantes sont acceptées sous réserve d'utiliser des matériaux ayant une durabilité de 30 ans au minimum.,Travaux de réfection de l'étanchéité de la toiture de l'école maternelle Jean Macé,CF_NIV_SUIV,,,CF_NIV_SUIV,,,CF_NIV_SUIV,,,CF_NIV_SUIV,,,,--None--,CF_NIV_SUIV,False,,,,False,CF_NIV_SUIV,,,,,,,,,False,CF_NIV_SUIV,,,,,,2022-07-10 22:00:00,CF_NIV_SUIV,False,False,False,False,True,,,,,CF_NIV_SUIV,,,,,,,,,,,,,,,,,,,,,,,,,,,,,,,,,,,,,,,,,,,,,,,,,,,,,,,,,,,,,
22-17233,,,CF_NIV_SUIV,CF_NIV_SUIV,True,False,False,CF_NIV_SUIV,False,False,,,,,RD 1017 - Renforcement de chaussée entre les communes de Péronne et de Bouchavesnes-Bergen du P.R.41+741 au P.R. 45+281.,CF_NIV_SUIV,45233220.0,,CF_NIV_SUIV,RD 1017 - Section entre Péronne et Bouchavesnes-Bergen - PR 41+741 au PR 45+281,,,FRE23,CF_NIV_SUIV,,CF_NIV_SUIV,,,,,,,,,,,,,True,False,CF_NIV_SUIV,False,,CF_NIV_SUIV,False,False,,CF_NIV_SUIV,,,,,,,,CF_NIV_SUIV,,,CF_NIV_SUIV,,,CF_NIV_SUIV,,,,,,False,False,CF_NIV_SUIV,,,CF_NIV_SUIV,,,CF_NIV_SUIV,,,CF_NIV_SUIV,,,CF_NIV_SUIV,,,,--None--,CF_NIV_SUIV,False,,,,False,CF_NIV_SUIV,,,,,,,,,False,CF_NIV_SUIV,,,,,,,CF_NIV_SUIV,False,False,False,False,False,,,,,CF_NIV_SUIV,,,,,,,,,,,,,,,,,,,,,,,,,,,,,,,,,,,,,,,,,,,,,,,,,,,,,,,,,,,,,
22-17233,,,CF_NIV_SUIV,CF_NIV_SUIV,True,False,False,CF_NIV_SUIV,False,False,,,,,RD 1017 - Renforcement de chaussée entre les communes de Péronne et de Bouchavesnes-Bergen du P.R.41+741 au P.R. 45+281.,CF_NIV_SUIV,45233142.0,,CF_NIV_SUIV,RD 1017 - Section entre Péronne et Bouchavesnes-Bergen - PR 41+741 au PR 45+281,,,FRE23,CF_NIV_SUIV,,CF_NIV_SUIV,,,,,,,,,,,,,True,False,CF_NIV_SUIV,False,,CF_NIV_SUIV,False,False,,CF_NIV_SUIV,,,,,,,,CF_NIV_SUIV,,,CF_NIV_SUIV,,,CF_NIV_SUIV,,,,,,False,False,CF_NIV_SUIV,,,CF_NIV_SUIV,,,CF_NIV_SUIV,,,CF_NIV_SUIV,,,CF_NIV_SUIV,,,,--None--,CF_NIV_SUIV,False,,,,False,CF_NIV_SUIV,,,,,,,,,False,CF_NIV_SUIV,,,,,,,CF_NIV_SUIV,False,False,False,False,False,,,,,CF_NIV_SUIV,,,,,,,,,,,,,,,,,,,,,,,,,,,,,,,,,,,,,,,,,,,,,,,,,,,,,,,,,,,,,
22-17237,,,CF_NIV_SUIV,CF_NIV_SUIV,False,False,False,CF_NIV_SUIV,False,False,,,,,MAITRISE D OEUVRE POUR RENOVATION ET EXTENSION DE LA CRECHE DE CHATILLON-EN-DIOIS,CF_NIV_SUIV,71221000.0,,CF_NIV_SUIV,,,,,CF_NIV_SUIV,,CF_NIV_SUIV,,,,,,,,,,,,,False,False,CF_NIV_SUIV,False,,CF_NIV_SUIV,False,False,,CF_NIV_SUIV,,,,,,,,CF_NIV_SUIV,,,CF_NIV_SUIV,,,CF_NIV_SUIV,,,,,,False,False,CF_NIV_SUIV,,,CF_NIV_SUIV,,,CF_NIV_SUIV,,,CF_NIV_SUIV,,,CF_NIV_SUIV,,,,--None--,CF_NIV_SUIV,False,,,,False,CF_NIV_SUIV,,,,,,,,,False,CF_NIV_SUIV,,,,,,,CF_NIV_SUIV,False,False,False,False,False,,,,,CF_NIV_SUIV,,,,,,,,,,,,,,,,,,,,,,,,,,,,,,,,,,,,,,,,,,,,,,,,,,,,,,,,,,,,,
22-17246,,,CF_NIV_SUIV,CF_NIV_SUIV,False,False,False,CF_NIV_SUIV,False,False,,,,,"ETUDE STRATEGIQUE POUR LE DEVELOPPEMENT ET LA VALORISATION DES COMMUNES DE LUZECH, DE PRAYSSAC ET DE PUY L'EVEQUE ET LEURS BOURGS CENTRES",CF_NIV_SUIV,,,CF_NIV_SUIV,,,,,CF_NIV_SUIV,,CF_NIV_SUIV,,,,,,,,,,,,,False,False,CF_NIV_SUIV,False,,CF_NIV_SUIV,False,False,,CF_NIV_SUIV,,,,,,,,CF_NIV_SUIV,,,CF_NIV_SUIV,,,CF_NIV_SUIV,,,,,,False,True,CF_NIV_SUIV,"ETUDE STRATEGIQUE POUR LE DEVELOPPEMENT ET LA VALORISATION DES COMMUNES DE LUZECH, DE PRAYSSAC ET DE PUY L'EVEQUE ET LEURS BOURGS CENTRES","ETUDE STRATEGIQUE POUR LE DEVELOPPEMENT ET LA VALORISATION DES COMMUNES DE LUZECH, DE PRAYSSAC ET DE PUY L'EVEQUE ET LEURS BOURGS CENTRES",CF_NIV_SUIV,,,CF_NIV_SUIV,,,CF_NIV_SUIV,,,CF_NIV_SUIV,,,,--None--,CF_NIV_SUIV,False,,,,False,CF_NIV_SUIV,,,,,,,,,False,CF_NIV_SUIV,7.0,,,,2022-03-20 23:00:00,,CF_NIV_SUIV,False,False,False,False,True,,,,,CF_NIV_SUIV,,,,,,,,,,,,,,,,,,,,,,,,,,,,,,,,,,,,,,,,,,,,,,,,,,,,,,,,,,,,,
22-17266,,,CF_NIV_SUIV,CF_NIV_SUIV,False,False,False,CF_NIV_SUIV,False,False,,,,,"La présente consultation a pour objet des services de gardiennage visant à assurer la protection des biens et des personnes, ainsi que la prévention et la détection des risques d'incendie, d'intrusion, d'inondation ou de malveillance, ciblées sur les antennes délocalisées de l'Université de Perpignan Via Domitia (UPVD) situées à Narbonne.",CF_NIV_SUIV,,,CF_NIV_SUIV,"Avenue Pierre de Coubertin - BP 818 - 11108 Narbonne Antenne UFR Sciences Juridiques et Economiques (Départements Droit de l'immobilier et Droit de l'environnement et de l'urbanisme) Parc d'activités de la Coupe - 62 Rue Nicolas Leblanc - 11100 Narbonne Antenne IUT (Génie Chimique - Génie des Procédés, option Bio Procédés)",11000.0,<ville>Narbonne</ville>,,CF_NIV_SUIV,,CF_NIV_SUIV,,,,,,,,,,,,,False,False,CF_NIV_SUIV,False,,CF_NIV_SUIV,False,False,,CF_NIV_SUIV,,,,,,,,CF_NIV_SUIV,,,CF_NIV_SUIV,,,CF_NIV_SUIV,,,,,,False,False,CF_NIV_SUIV,,"La présente consultation a pour objet des services de gardiennage visant à assurer la protection des biens et des personnes, ainsi que la prévention et la détection des risques d'incendie, d'intrusion, d'inondation ou de malveillance, ciblées sur les antennes délocalisées de l'Université de Perpignan Via Domitia (UPVD) situées à Narbonne.",CF_NIV_SUIV,,,CF_NIV_SUIV,,,CF_NIV_SUIV,,,CF_NIV_SUIV,,,,--None--,CF_NIV_SUIV,False,,,,False,CF_NIV_SUIV,,,,,,,,,False,CF_NIV_SUIV,,,,,,,CF_NIV_SUIV,False,False,False,False,False,,,,,CF_NIV_SUIV,,,,,,,,,,,,,,,,,,,,,,,,,,,,,,,,,,,,,,,,,,,,,,,,,,,,,,,,,,,,,
22-17276,,,CF_NIV_SUIV,CF_NIV_SUIV,False,False,False,CF_NIV_SUIV,False,False,,,,,MCH22_005_154DACO_Maîtrise foncière du système d'endiguement de Comps (30),CF_NIV_SUIV,,,CF_NIV_SUIV,,,,,CF_NIV_SUIV,,CF_NIV_SUIV,,,,,,,,,,,,,False,False,CF_NIV_SUIV,False,,CF_NIV_SUIV,False,False,,CF_NIV_SUIV,,,,,,,,CF_NIV_SUIV,,,CF_NIV_SUIV,,,CF_NIV_SUIV,,,,,,True,False,CF_NIV_SUIV,L'objet de la présente prestation est de mettre en oeuvre les procédures nécessaires à la maîtrise foncière que ce soit par achat de terrain ou la mise en place de servitudes.,Cf : BPU,CF_NIV_SUIV,,,CF_NIV_SUIV,,,CF_NIV_SUIV,,,CF_NIV_SUIV,,,,--None--,CF_NIV_SUIV,False,,,,False,CF_NIV_SUIV,,,,,,,,,False,CF_NIV_SUIV,,,,,2022-04-03 22:00:00,,CF_NIV_SUIV,False,False,False,False,True,,,,,CF_NIV_SUIV,,,,,,,,,,,,,,,,,,,,,,,,,,,,,,,,,,,,,,,,,,,,,,,,,,,,,,,,,,,,,
22-17283,,,CF_NIV_SUIV,CF_NIV_SUIV,False,False,False,CF_NIV_SUIV,False,False,,,,,transports scolaires par cars,CF_NIV_SUIV,,,CF_NIV_SUIV,,,,,CF_NIV_SUIV,,CF_NIV_SUIV,,,,,,,,,,,,,False,False,CF_NIV_SUIV,False,,CF_NIV_SUIV,False,False,,CF_NIV_SUIV,,,,,,,,CF_NIV_SUIV,,,CF_NIV_SUIV,,,CF_NIV_SUIV,,,,,,False,False,CF_NIV_SUIV,,,CF_NIV_SUIV,,,CF_NIV_SUIV,,,CF_NIV_SUIV,,,CF_NIV_SUIV,,,,--None--,CF_NIV_SUIV,False,,,,False,CF_NIV_SUIV,,,,,,,,,False,CF_NIV_SUIV,,,,,,,CF_NIV_SUIV,False,False,False,False,False,,,,,CF_NIV_SUIV,,,,,,,,,,,,,,,,,,,,,,,,,,,,,,,,,,,,,,,,,,,,,,,,,,,,,,,,,,,,,
22-17285,,,CF_NIV_SUIV,CF_NIV_SUIV,False,False,False,CF_NIV_SUIV,False,False,,,,,"Contrat de maîtrise d'oeuvre pour la réalisation des études de conception et du suivi de la réalisation de la déconstruction, du désamiantage de l'ancien Monsieur Bricolage situé à Flers ainsi que la dépollution des sols, le cas échéant.",CF_NIV_SUIV,,,CF_NIV_SUIV,Flers,61100.0,Flers,,CF_NIV_SUIV,,CF_NIV_SUIV,,,,,,,,,,,,,False,False,CF_NIV_SUIV,False,,CF_NIV_SUIV,False,False,,CF_NIV_SUIV,,,,,,,,CF_NIV_SUIV,,,CF_NIV_SUIV,,,CF_NIV_SUIV,,,,,,False,True,CF_NIV_SUIV,,,CF_NIV_SUIV,,,CF_NIV_SUIV,,,CF_NIV_SUIV,,,CF_NIV_SUIV,,,,--None--,CF_NIV_SUIV,False,,,,False,CF_NIV_SUIV,,,,,,,,,False,CF_NIV_SUIV,9.0,,,,,,CF_NIV_SUIV,False,False,False,False,False,,,,,CF_NIV_SUIV,,,,,,,,,,,,,,,,,,,,,,,,,,,,,,,,,,,,,,,,,,,,,,,,,,,,,,,,,,,,,
22-17296,,,CF_NIV_SUIV,CF_NIV_SUIV,False,False,False,CF_NIV_SUIV,False,False,,,,,"Préparation, organisation, mise à disposition de repas et animation des banquets des senior.e. s de la ville de Romainville",CF_NIV_SUIV,,,CF_NIV_SUIV,Les banquets des senior.e.s seront organisés au Gymnase Alice Milliat situé au 39 Allée Bellevue,93230.0,<ville>Romainville</ville>,,CF_NIV_SUIV,,CF_NIV_SUIV,,,,,,,,,,,,,False,False,CF_NIV_SUIV,False,,CF_NIV_SUIV,False,False,,CF_NIV_SUIV,,,,,,,,CF_NIV_SUIV,,,CF_NIV_SUIV,,,CF_NIV_SUIV,,,,,,False,True,CF_NIV_SUIV,,Les repas doivent être prévus pour 350 personnes par jour maximum. La ville s'occupera de l'invitation des retraité.e..s et s'engage à fournir 15 jours avant la prestation le nombre de personnes prévues pour les 4 journées ( du 17 au 20 mai 2022).,CF_NIV_SUIV,,,CF_NIV_SUIV,,,CF_NIV_SUIV,,,CF_NIV_SUIV,,,,--None--,CF_NIV_SUIV,False,,,,False,CF_NIV_SUIV,,,,,,,,,False,CF_NIV_SUIV,2.0,,,,,,CF_NIV_SUIV,True,False,False,True,False,,,,,CF_NIV_SUIV,CF_NIV_SUIV,1,,Prestations de traiteurs pour les banquets des senior.e. s de la ville de Romainville,CF_NIV_SUIV,,,,,CF_NIV_SUIV,False,CF_NIV_SUIV,CF_NIV_SUIV,,,CF_NIV_SUIV,CF_NIV_SUIV,,,CF_NIV_SUIV,,350,CF_NIV_SUIV,,,CF_NIV_SUIV,,,CF_NIV_SUIV,,,,,,,,,,,,,False,,,CF_NIV_SUIV,,,,,,False,False,False,,,,,False,,,
22-17296,,,CF_NIV_SUIV,CF_NIV_SUIV,False,False,False,CF_NIV_SUIV,False,False,,,,,"Préparation, organisation, mise à disposition de repas et animation des banquets des senior.e. s de la ville de Romainville",CF_NIV_SUIV,,,CF_NIV_SUIV,Les banquets des senior.e.s seront organisés au Gymnase Alice Milliat situé au 39 Allée Bellevue,93230.0,<ville>Romainville</ville>,,CF_NIV_SUIV,,CF_NIV_SUIV,,,,,,,,,,,,,False,False,CF_NIV_SUIV,False,,CF_NIV_SUIV,False,False,,CF_NIV_SUIV,,,,,,,,CF_NIV_SUIV,,,CF_NIV_SUIV,,,CF_NIV_SUIV,,,,,,False,True,CF_NIV_SUIV,,Les repas doivent être prévus pour 350 personnes par jour maximum. La ville s'occupera de l'invitation des retraité.e..s et s'engage à fournir 15 jours avant la prestation le nombre de personnes prévues pour les 4 journées ( du 17 au 20 mai 2022).,CF_NIV_SUIV,,,CF_NIV_SUIV,,,CF_NIV_SUIV,,,CF_NIV_SUIV,,,,--None--,CF_NIV_SUIV,False,,,,False,CF_NIV_SUIV,,,,,,,,,False,CF_NIV_SUIV,2.0,,,,,,CF_NIV_SUIV,True,False,False,True,False,,,,,CF_NIV_SUIV,CF_NIV_SUIV,2,,Prestations d'animation des banquets des senior.e. s de la ville de Romainville,CF_NIV_SUIV,,,,,CF_NIV_SUIV,False,CF_NIV_SUIV,CF_NIV_SUIV,,,CF_NIV_SUIV,CF_NIV_SUIV,,,CF_NIV_SUIV,,350,CF_NIV_SUIV,,,CF_NIV_SUIV,,,CF_NIV_SUIV,,,,,,,,,,,,,False,,,CF_NIV_SUIV,,,,,,False,False,False,,,,,False,,,
22-17296,,,CF_NIV_SUIV,CF_NIV_SUIV,False,False,False,CF_NIV_SUIV,False,False,,,,,"Préparation, organisation, mise à disposition de repas et animation des banquets des senior.e. s de la ville de Romainville",CF_NIV_SUIV,,,CF_NIV_SUIV,Les banquets des senior.e.s seront organisés au Gymnase Alice Milliat situé au 39 Allée Bellevue,93230.0,<ville>Romainville</ville>,,CF_NIV_SUIV,,CF_NIV_SUIV,,,,,,,,,,,,,False,False,CF_NIV_SUIV,False,,CF_NIV_SUIV,False,False,,CF_NIV_SUIV,,,,,,,,CF_NIV_SUIV,,,CF_NIV_SUIV,,,CF_NIV_SUIV,,,,,,False,True,CF_NIV_SUIV,,Les repas doivent être prévus pour 350 personnes par jour maximum. La ville s'occupera de l'invitation des retraité.e..s et s'engage à fournir 15 jours avant la prestation le nombre de personnes prévues pour les 4 journées ( du 17 au 20 mai 2022).,CF_NIV_SUIV,,,CF_NIV_SUIV,,,CF_NIV_SUIV,,,CF_NIV_SUIV,,,,--None--,CF_NIV_SUIV,False,,,,False,CF_NIV_SUIV,,,,,,,,,False,CF_NIV_SUIV,2.0,,,,,,CF_NIV_SUIV,True,False,False,True,False,,,,,CF_NIV_SUIV,CF_NIV_SUIV,3,,Prestations d'installations et logistiques des banquets des senior.e. s de la ville de Romainville,CF_NIV_SUIV,,,,,CF_NIV_SUIV,False,CF_NIV_SUIV,CF_NIV_SUIV,,,CF_NIV_SUIV,CF_NIV_SUIV,,,CF_NIV_SUIV,,350,CF_NIV_SUIV,,,CF_NIV_SUIV,,,CF_NIV_SUIV,,,,,,,,,,,,,False,,,CF_NIV_SUIV,,,,,,False,False,False,,,,,False,,,
22-17308,,,CF_NIV_SUIV,CF_NIV_SUIV,False,False,False,CF_NIV_SUIV,False,False,,,,,"Accompagnement administratif, technique et financier pour le projet de Maison de santé pluriprofessionnelle de Quincieux",CF_NIV_SUIV,,,CF_NIV_SUIV,,,,,CF_NIV_SUIV,,CF_NIV_SUIV,,,,,,,,,,,,,False,False,CF_NIV_SUIV,False,,CF_NIV_SUIV,False,False,,CF_NIV_SUIV,,,,,,,,CF_NIV_SUIV,,,CF_NIV_SUIV,,,CF_NIV_SUIV,,,,,,False,True,CF_NIV_SUIV,L'opération comporte une tranche ferme et une tranche optionnelle :-Tranche ferme : Définition des besoins du projet et coconstruction du projet de santé avec l'ARS- Tranche optionnelle : Mise en oeuvre du projetDélais de réalisation :Exécution : environ 24 mois.Prévision de réalisation : novembre 2024,"Accompagnement administratif, technique et financier pour le projet de Maison de santé pluriprofessionnelle de Quincieux",CF_NIV_SUIV,,,CF_NIV_SUIV,,,CF_NIV_SUIV,,,CF_NIV_SUIV,,,,--None--,CF_NIV_SUIV,False,,,,False,CF_NIV_SUIV,,,,,,,,,False,CF_NIV_SUIV,24.0,,,,,,CF_NIV_SUIV,False,False,False,False,True,,,,,CF_NIV_SUIV,,,,,,,,,,,,,,,,,,,,,,,,,,,,,,,,,,,,,,,,,,,,,,,,,,,,,,,,,,,,,
22-17315,,,CF_NIV_SUIV,CF_NIV_SUIV,False,False,False,CF_NIV_SUIV,False,False,,,,,Prestations de Service de transport des enfants des accueils de loisirs municipaux maternels vers destination en ville ou hors de la ville,CF_NIV_SUIV,,,CF_NIV_SUIV,"A accueil de loisirs maternels:Baléone,Candia,Loretto,Berthault",,,,CF_NIV_SUIV,,CF_NIV_SUIV,,,,,,,,,,,,,False,False,CF_NIV_SUIV,False,,CF_NIV_SUIV,False,False,,CF_NIV_SUIV,,,,,,,,CF_NIV_SUIV,,,CF_NIV_SUIV,,,CF_NIV_SUIV,,,,,,False,True,CF_NIV_SUIV,L'accord-cadre sera exécuté par l'émission de bons de commande.Locations de cars avec chauffeurs pour le transport intra muros et hors la ville des enfants des accueil de loisirs maternelles municipaux,Prestations de Service de transport des enfants des accueils de loisirs municipaux maternels vers destination en ville ou hors de la ville,CF_NIV_SUIV,,,CF_NIV_SUIV,,,CF_NIV_SUIV,,,CF_NIV_SUIV,,,,--None--,CF_NIV_SUIV,False,,,,False,CF_NIV_SUIV,,,,,,,,,False,CF_NIV_SUIV,12.0,,,,,,CF_NIV_SUIV,False,False,False,False,True,,,,,CF_NIV_SUIV,,,,,,,,,,,,,,,,,,,,,,,,,,,,,,,,,,,,,,,,,,,,,,,,,,,,,,,,,,,,,
