BOAMP_AVIS_NUM,D_13_01_Conditionparticipation_Critereselection,D_13_02_Conditionparticipation_Situationjuridique,D_13_03_Conditionparticipation_Situationjuridiquesst,D_13_04_Conditionparticipation_Capecomarcheoui,D_13_05_Conditionparticipation_Capecomarchenon,D_13_06_Conditionparticipation_Capeco,D_13_07_Conditionparticipation_Capecosst,D_13_08_Conditionparticipation_Capeconiveaumini,D_13_09_Conditionparticipation_Capeconiveauminisst,D_13_10_Conditionparticipation_Captechoffreoui,D_13_11_Conditionparticipation_Captechoffrenon,D_13_12_Conditionparticipation_Captech,D_13_13_Conditionparticipation_Captechsst,D_13_14_Conditionparticipation_Captechniveaumini,D_13_15_Conditionparticipation_Captechniveauminisst,D_13_16_Conditionparticipation_Criteresparticipation,D_13_17_Conditionparticipation_Marchereserveoui,D_13_17_01_Conditionparticipation_Marchereserveoui_Ateliersproteges,D_13_17_02_Conditionparticipation_Marchereserveoui_Emploisproteges,D_13_18_Conditionparticipation_Marchereservenon,D_13_19_Conditionparticipation_Prestationreserveeoui,D_13_20_Conditionparticipation_Prestationreserveenon,D_13_21_Conditionparticipation_Conditionparticuliereexecution,D_13_22_Conditionparticipation_Indicationobligatoirenomqualificationsoui,D_13_23_Conditionparticipation_Indicationobligatoirenomqualificationsnon,D_13_24_Conditionparticipation_Justificatifscandidat,D_13_24_01_Conditionparticipation_Justificatifscandidat_P,D_13_25_Conditionparticipation_Eligiblemps,D_13_25_01_Conditionparticipation_Eligiblemps_Oui,D_13_25_02_Conditionparticipation_Eligiblemps_Non
21-114011,,,,,False,,,,,,False,,,,,,CF_NIV_SUIV,False,False,True,,True,,False,True,CF_NIV_SUIV,,CF_NIV_SUIV,False,True
21-129515,,"Critères relatifs à la situation personnelle d'opérateurs économiques (susceptibles d'entraîner leur exclusion), y compris exigences relatives à leur inscription à un registre professionnel ou du commerce.Renseignements et formalités nécessaires pour évaluer si ces exigences sont remplies : cf 1) Conditions de participation : liste des éléments et documents exigés des candidats à la rubrique Vi.3 du présent AAPC. Il est rappelé que la fourniture de ces éléments listés à la rubrique Vi.3 est primordiale, sous peine de rejet de la candidature de l'opérateur économique.Critères relatifs à la situation personnelle de sous-traitants (susceptibles d'entraîner leur rejet), y compris exigences relatives à leur inscription à un registre professionnel ou du commerce.Renseignements et formalités nécessaires pour évaluer si ces exigences sont remplies : cf 1) Conditions de participation : liste des éléments et documents exigés des candidats à la rubrique Vi.3 du présent AAPC. Il est rappelé que la fourniture de ces éléments listés à la rubrique Vi.3 est primordiale, sous peine de rejet de la candidature de l'opérateur économique.",,,False,"Critères relatifs à la situation économique et financière d'opérateurs économiques (susceptibles d'entraîner leur exclusion).Renseignements et formalités nécessaires pour évaluer si ces exigences sont remplies : cf 1) Conditions de participation : liste des éléments et documents exigés des candidats à la rubrique Vi.3 du présent AAPC. Il est rappelé que la fourniture des éléments listés à la rubrique Vi.3 est primordiale, sous peine de rejet de la candidature de l'opérateur économique.Critères relatifs à la situation économique et financière de sous-traitants (susceptibles d'entraîner leur rejet).Renseignements et formalités nécessaires pour évaluer si ces exigences sont remplies : cf 1) Conditions de participation : liste des éléments et documents exigés des candidats à la rubrique Vi.3 du présent AAPC. Il est rappelé que la fourniture de ces éléments listés à la rubrique Vi.3 est primordiale, sous peine de rejet de la candidature de l'opérateur économique.",,,,,False,"Critères relatifs à la capacité technique et/ou professionnelle d'opérateurs économiques (susceptibles d'entraîner leur exclusion).Renseignements et formalités nécessaires pour évaluer si ces exigences sont remplies : cf 1) Conditions de participation : liste des éléments et documents exigés des candidats à la rubrique Vi.3 du présent AAPC. Il est rappelé que la fourniture des éléments listés à la rubrique Vi.3 est primordiale, sous peine de rejet de la candidature de l'opérateur économique.Critères relatifs à la capacité technique et/ou professionnelle de sous-traitants (susceptibles d'entraîner leur rejet).Renseignements et formalités nécessaires pour évaluer si ces exigences sont remplies : cf 1) Conditions de participation : liste des éléments et documents exigés des candidats à la rubrique Vi.3 du présent AAPC. Il est rappelé que la fourniture de ces éléments listés à la rubrique Vi.3 est primordiale, sous peine de rejet de la candidature de l'opérateur économique.",,,,,CF_NIV_SUIV,False,False,False,,True,,False,True,CF_NIV_SUIV,,CF_NIV_SUIV,False,False
21-158657,,,,,False,,,,,,False,,,,,,CF_NIV_SUIV,False,False,False,,False,,False,False,CF_NIV_SUIV,,CF_NIV_SUIV,False,True
21-159240,,,,,False,,,,,,False,,,,,,CF_NIV_SUIV,False,False,False,,False,,False,False,CF_NIV_SUIV,Autres renseignements demandés,CF_NIV_SUIV,False,True
21-159240,,,,,False,,,,,,False,,,,,,CF_NIV_SUIV,False,False,False,,False,,False,False,CF_NIV_SUIV,"Conformément aux articles R.2144-1 à R.2144-7 du Code de la commande publique, les candidats qui se trouvent dans un cas d'interdiction de soumissionner, qui ne disposent pas de la capacité économique et financière, des capacités techniques et professionnelles ou qui ne peuvent produire dans le délai imparti les documents justificatifs, les moyens de preuve, les compléments ou explications requis par le pouvoir adjudicateur sont éliminés.",CF_NIV_SUIV,False,True
21-159240,,,,,False,,,,,,False,,,,,,CF_NIV_SUIV,False,False,False,,False,,False,False,CF_NIV_SUIV,Autres renseignements demandés,CF_NIV_SUIV,False,True
21-159240,,,,,False,,,,,,False,,,,,,CF_NIV_SUIV,False,False,False,,False,,False,False,CF_NIV_SUIV,"Situation juridique - références requises : -Une lettre de candidature complétée, avec, en cas de groupement, la désignation du mandataire par ses cotraitants (formulaire Dc1 version du 01/04/2019).",CF_NIV_SUIV,False,True
21-159240,,,,,False,,,,,,False,,,,,,CF_NIV_SUIV,False,False,False,,False,,False,False,CF_NIV_SUIV,Autres renseignements demandés,CF_NIV_SUIV,False,True
21-159240,,,,,False,,,,,,False,,,,,,CF_NIV_SUIV,False,False,False,,False,,False,False,CF_NIV_SUIV,"-Si le candidat est en redressement judiciaire au sens de l'article L.631-1 du code de commerce, ou est admis à une procédure équivalente régie par un droit étranger, la copie du ou des jugements prononcés à cet effet.Capacité économique et financière - références requises : -Une déclaration concernant le chiffre d'affaire global et le chiffre d'affaire concernant l'objet du marché, réalisé au cours des trois derniers exercices disponibles (Dc2 version du 01/04/2019)Référence professionnelle et capacité technique - références requises : -Les effectifs moyens annuels du candidat pour chacune des trois dernières années.-Une liste de trois (3) références, de moins de 3 ans, d'importance et de complexité comparables à l'objet du marché (opération de réhabilitation et extension d'un équipement public d'envergure).Pour chaque référence le candidat précisera dans l'annexe 1 au présent RC 'Cadre de réponse candidature' prévu à cet effet.",CF_NIV_SUIV,False,True
21-160234,,,,,False,,,,,,False,,,,,,CF_NIV_SUIV,False,False,False,,False,,False,False,CF_NIV_SUIV,"Documents à produire obligatoirement par le candidat, à l'appui de sa candidature",CF_NIV_SUIV,True,False
21-160234,,,,,False,,,,,,False,,,,,,CF_NIV_SUIV,False,False,False,,False,,False,False,CF_NIV_SUIV,"Copie du ou des jugements prononcés, si le candidat est en redressement judiciaire",CF_NIV_SUIV,True,False
21-160234,,,,,False,,,,,,False,,,,,,CF_NIV_SUIV,False,False,False,,False,,False,False,CF_NIV_SUIV,"Déclaration sur l'honneur du candidat justifiant qu'il n'entre dans aucun des cas d'interdiction de soumissionner obligatoires prévus aux articles 45 et 48 de l'ordonnance no 2015-899 du 23 juillet 2015 ou, pour les marchés publics de défense ou de sécurité, qu'il n'entre dans aucun des cas d'interdiction de soumissionner obligatoires prévus aux articles 45 ,46 et 48 de l'ordonnance no 2015-899 du 23 juillet 2015 (si cette déclaration n'est pas déjà demandée dans le cadre du formulaire DC1, ci-après)",CF_NIV_SUIV,True,False
21-160234,,,,,False,,,,,,False,,,,,,CF_NIV_SUIV,False,False,False,,False,,False,False,CF_NIV_SUIV,"Déclaration sur l'honneur du candidat attestant qu'il est en règle, au cours de l'année précédant celle au cours de laquelle a lieu le lancement de la consultation, au regard des articles L. 5212-1, L. 5212-2, L. 5212 5 et L. 5212-9 du code du travail, concernant l'emploi des travailleurs handicapés",CF_NIV_SUIV,True,False
21-160234,,,,,False,,,,,,False,,,,,,CF_NIV_SUIV,False,False,False,,False,,False,False,CF_NIV_SUIV,"Si le candidat est établi en France, une déclaration sur l'honneur du candidat justifiant que le travail est effectué par des salariés employés régulièrement au regard des articles L. 1221-10, L. 3243-2 et R. 3243-1 du code du travail (dans le cas où le candidat emploie des salariés, conformément à l'article D. 8222-5-3° du code du travail)",CF_NIV_SUIV,True,False
21-160234,,,,,False,,,,,,False,,,,,,CF_NIV_SUIV,False,False,False,,False,,False,False,CF_NIV_SUIV,"Si le candidat est établi ou domicilié à l'étranger, une déclaration sur l'honneur du candidat attestant qu'il fournit à ses salariés des bulletins de paie comportant les mentions prévues à l'article R. 3243-1 du code du travail, ou des documents équivalents",CF_NIV_SUIV,True,False
21-160234,,,,,False,,,,,,False,,,,,,CF_NIV_SUIV,False,False,False,,False,,False,False,CF_NIV_SUIV,"Documents à produire à l'appui des candidatures par le candidat, au choix de l'acheteur public",CF_NIV_SUIV,True,False
21-160234,,,,,False,,,,,,False,,,,,,CF_NIV_SUIV,False,False,False,,False,,False,False,CF_NIV_SUIV,"Déclaration concernant le chiffre d'affaires global et le chiffre d'affaires concernant les fournitures, services ou travaux objet du marché, réalisés au cours des trois derniers exercices disponibles",CF_NIV_SUIV,True,False
21-160234,,,,,False,,,,,,False,,,,,,CF_NIV_SUIV,False,False,False,,False,,False,False,CF_NIV_SUIV,Déclaration appropriée de banques ou preuve d'une assurance pour les risques professionnels,CF_NIV_SUIV,True,False
21-160234,,,,,False,,,,,,False,,,,,,CF_NIV_SUIV,False,False,False,,False,,False,False,CF_NIV_SUIV,"Bilans ou extraits de bilans, concernant les trois dernières années, des opérateurs économiques pour lesquels l'établissement des bilans est obligatoire en vertu de la loi",CF_NIV_SUIV,True,False
21-160234,,,,,False,,,,,,False,,,,,,CF_NIV_SUIV,False,False,False,,False,,False,False,CF_NIV_SUIV,Déclaration indiquant les effectifs moyens annuels du candidat et l'importance du personnel d'encadrement pour chacune des trois dernières années,CF_NIV_SUIV,True,False
21-160234,,,,,False,,,,,,False,,,,,,CF_NIV_SUIV,False,False,False,,False,,False,False,CF_NIV_SUIV,"Présentation d'une liste des travaux exécutés au cours des cinq dernières années, appuyée d'attestations de bonne exécution pour les travaux les plus importants. Ces attestations indiquent le montant, l'époque et le lieu d'exécution des travaux et précisent s'ils ont été effectués selon les règles de l'art et menés régulièrement à bonne fin",CF_NIV_SUIV,True,False
21-160234,,,,,False,,,,,,False,,,,,,CF_NIV_SUIV,False,False,False,,False,,False,False,CF_NIV_SUIV,Indication des titres d'études et professionnels de l'opérateur économique,CF_NIV_SUIV,True,False
21-160234,,,,,False,,,,,,False,,,,,,CF_NIV_SUIV,False,False,False,,False,,False,False,CF_NIV_SUIV,Indication des titres d'études et professionnels des cadres de l'entreprise et notamment des responsables de prestation de services ou de conduite des travaux de même nature que celle du marché,CF_NIV_SUIV,True,False
21-160234,,,,,False,,,,,,False,,,,,,CF_NIV_SUIV,False,False,False,,False,,False,False,CF_NIV_SUIV,"Déclaration indiquant l'outillage, le matériel et l'équipement technique dont le candidat dispose pour la réalisation de marchés de même nature",CF_NIV_SUIV,True,False
21-160234,,,,,False,,,,,,False,,,,,,CF_NIV_SUIV,False,False,False,,False,,False,False,CF_NIV_SUIV,"Certificats de qualifications professionnelles. La preuve de la capacité du candidat peut être apportée par tout moyen, notamment par des certificats d'identité professionnelle ou des références de travaux attestant de la compétence de l'opérateur économique à réaliser la prestation pour laquelle il se porte candidat",CF_NIV_SUIV,True,False
21-160234,,,,,False,,,,,,False,,,,,,CF_NIV_SUIV,False,False,False,,False,,False,False,CF_NIV_SUIV,"Formulaire DC1, Lettre de candidature - Habilitation du mandataire par ses co-traitants (disponible à l'adresse suivante : http://www.economie.gouv.fr/directions_services/daj/marches_publics/formulaires/DC/daj_dc.htm)",CF_NIV_SUIV,True,False
21-160234,,,,,False,,,,,,False,,,,,,CF_NIV_SUIV,False,False,False,,False,,False,False,CF_NIV_SUIV,"Formulaire DC2, Déclaration du candidat individuel ou du membre du groupement (disponible à l'adresse suivante : http://www.economie.gouv.fr/directions_services/daj/marches_publics/formulaires/DC/daj_dc.htm)",CF_NIV_SUIV,True,False
21-160234,,,,,False,,,,,,False,,,,,,CF_NIV_SUIV,False,False,False,,False,,False,False,CF_NIV_SUIV,Les pièces prévues aux articles D. 8222-5 ou D. 8222-7 et D. 8222-8 du code du travail,CF_NIV_SUIV,True,False
21-160234,,,,,False,,,,,,False,,,,,,CF_NIV_SUIV,False,False,False,,False,,False,False,CF_NIV_SUIV,"Si l'attributaire est établi en France, les attestations et certificats délivrés par les administrations et organismes compétents prouvant qu'il a satisfait à ses obligations fiscales et sociales ou un état annuel des certificats reçus",CF_NIV_SUIV,True,False
21-160234,,,,,False,,,,,,False,,,,,,CF_NIV_SUIV,False,False,False,,False,,False,False,CF_NIV_SUIV,"Si l'attributaire est établi dans un Etat autre que la France, un certificat établi par les administrations et organismes du pays d'origine. Lorsqu'un tel certificat n'est pas délivré par le pays concerné, il peut être remplacé par une déclaration sous serment, ou dans les Etats où un tel serment n'existe pas, par une déclaration solennelle faite par l'intéressé devant l'autorité judiciaire ou administrative compétente, un notaire ou un organisme professionnel qualifié du pays",CF_NIV_SUIV,True,False
21-160234,,,,,False,,,,,,False,,,,,,CF_NIV_SUIV,False,False,False,,False,,False,False,CF_NIV_SUIV,"Si les documents fournis par le candidat ne sont pas établis en langue française, ils doivent être accompagnés d'une traduction en français, certifiée conforme à l'original par un traducteur assermenté",CF_NIV_SUIV,True,False
21-162358,,,,,False,,,,,,False,,,,,,CF_NIV_SUIV,False,False,False,,False,,False,False,CF_NIV_SUIV,"Documents à produire à l'appui des candidatures par le candidat, au choix de l'acheteur public",CF_NIV_SUIV,False,True
21-162358,,,,,False,,,,,,False,,,,,,CF_NIV_SUIV,False,False,False,,False,,False,False,CF_NIV_SUIV,"Déclaration concernant le chiffre d'affaires global et le chiffre d'affaires concernant les fournitures, services ou travaux objet du marché, réalisés au cours des trois derniers exercices disponibles",CF_NIV_SUIV,False,True
21-162358,,,,,False,,,,,,False,,,,,,CF_NIV_SUIV,False,False,False,,False,,False,False,CF_NIV_SUIV,"Déclaration indiquant l'outillage, le matériel et l'équipement technique dont le candidat dispose pour la réalisation de marchés de même nature",CF_NIV_SUIV,False,True
21-162358,,,,,False,,,,,,False,,,,,,CF_NIV_SUIV,False,False,False,,False,,False,False,CF_NIV_SUIV,"Certificats de qualifications professionnelles. La preuve de la capacité du candidat peut être apportée par tout moyen, notamment par des certificats d'identité professionnelle ou des références de travaux attestant de la compétence de l'opérateur économique à réaliser la prestation pour laquelle il se porte candidat",CF_NIV_SUIV,False,True
21-162358,,,,,False,,,,,,False,,,,,,CF_NIV_SUIV,False,False,False,,False,,False,False,CF_NIV_SUIV,Autres renseignements demandés,CF_NIV_SUIV,False,True
21-162358,,,,,False,,,,,,False,,,,,,CF_NIV_SUIV,False,False,False,,False,,False,False,CF_NIV_SUIV,"Remplir le CCTP, le DQE et le Mémoire technique pour les prestations de fourniture et mise en place de plants.",CF_NIV_SUIV,False,True
21-165066,,,,,False,,,,,,False,,,,,,CF_NIV_SUIV,False,False,False,,False,,False,False,CF_NIV_SUIV,"Documents à produire obligatoirement par le candidat, à l'appui de sa candidature",CF_NIV_SUIV,False,True
21-165066,,,,,False,,,,,,False,,,,,,CF_NIV_SUIV,False,False,False,,False,,False,False,CF_NIV_SUIV,"Copie du ou des jugements prononcés, si le candidat est en redressement judiciaire",CF_NIV_SUIV,False,True
21-165066,,,,,False,,,,,,False,,,,,,CF_NIV_SUIV,False,False,False,,False,,False,False,CF_NIV_SUIV,"Déclaration sur l'honneur du candidat justifiant qu'il n'entre dans aucun des cas d'interdiction de soumissionner obligatoires prévus aux articles 45 et 48 de l'ordonnance no 2015-899 du 23 juillet 2015 ou, pour les marchés publics de défense ou de sécurité, qu'il n'entre dans aucun des cas d'interdiction de soumissionner obligatoires prévus aux articles 45 ,46 et 48 de l'ordonnance no 2015-899 du 23 juillet 2015 (si cette déclaration n'est pas déjà demandée dans le cadre du formulaire DC1, ci-après)",CF_NIV_SUIV,False,True
21-165066,,,,,False,,,,,,False,,,,,,CF_NIV_SUIV,False,False,False,,False,,False,False,CF_NIV_SUIV,"Déclaration sur l'honneur du candidat attestant qu'il est en règle, au cours de l'année précédant celle au cours de laquelle a lieu le lancement de la consultation, au regard des articles L. 5212-1, L. 5212-2, L. 5212 5 et L. 5212-9 du code du travail, concernant l'emploi des travailleurs handicapés",CF_NIV_SUIV,False,True
21-165066,,,,,False,,,,,,False,,,,,,CF_NIV_SUIV,False,False,False,,False,,False,False,CF_NIV_SUIV,"Documents à produire à l'appui des candidatures par le candidat, au choix de l'acheteur public",CF_NIV_SUIV,False,True
21-165066,,,,,False,,,,,,False,,,,,,CF_NIV_SUIV,False,False,False,,False,,False,False,CF_NIV_SUIV,"Déclaration concernant le chiffre d'affaires global et le chiffre d'affaires concernant les fournitures, services ou travaux objet du marché, réalisés au cours des trois derniers exercices disponibles",CF_NIV_SUIV,False,True
21-165066,,,,,False,,,,,,False,,,,,,CF_NIV_SUIV,False,False,False,,False,,False,False,CF_NIV_SUIV,Déclaration appropriée de banques ou preuve d'une assurance pour les risques professionnels,CF_NIV_SUIV,False,True
21-165066,,,,,False,,,,,,False,,,,,,CF_NIV_SUIV,False,False,False,,False,,False,False,CF_NIV_SUIV,Déclaration indiquant les effectifs moyens annuels du candidat et l'importance du personnel d'encadrement pour chacune des trois dernières années,CF_NIV_SUIV,False,True
21-165066,,,,,False,,,,,,False,,,,,,CF_NIV_SUIV,False,False,False,,False,,False,False,CF_NIV_SUIV,"Présentation d'une liste des principales fournitures ou des principaux services effectués au cours des trois dernières années, indiquant le montant, la date et le destinataire public ou privé. Les livraisons et les prestations de services sont prouvées par des attestations du destinataire ou, à défaut, par une déclaration de l'opérateur économique",CF_NIV_SUIV,False,True
21-165066,,,,,False,,,,,,False,,,,,,CF_NIV_SUIV,False,False,False,,False,,False,False,CF_NIV_SUIV,Indication des titres d'études et professionnels de l'opérateur économique,CF_NIV_SUIV,False,True
21-165066,,,,,False,,,,,,False,,,,,,CF_NIV_SUIV,False,False,False,,False,,False,False,CF_NIV_SUIV,"Formulaire DC1, Lettre de candidature - Habilitation du mandataire par ses co-traitants (disponible à l'adresse suivante : http://www.economie.gouv.fr/directions_services/daj/marches_publics/formulaires/DC/daj_dc.htm)",CF_NIV_SUIV,False,True
21-165066,,,,,False,,,,,,False,,,,,,CF_NIV_SUIV,False,False,False,,False,,False,False,CF_NIV_SUIV,"Formulaire DC2, Déclaration du candidat individuel ou du membre du groupement (disponible à l'adresse suivante : http://www.economie.gouv.fr/directions_services/daj/marches_publics/formulaires/DC/daj_dc.htm)",CF_NIV_SUIV,False,True
21-168564,,"Lettre de candidature Dc1, Déclaration du candidat Dc2, copie du jugement prononcé si le candidat est en redressement judiciaire, extrait Kbis ou DUME (Document Unique des Marchés Européens (Adresse : https://dume.chorus-pro.gouv.fr).",,,True,"Déclaration du chiffre d'affaires des 3 dernières années, attestations d'assurance en cours de validité, déclaration appropriée de banque si la société est nouvellement créée",,,,,True,"Références professionnelles, moyens humains et matériels, certificats de bonne exécution.",,,,,CF_NIV_SUIV,False,False,True,,True,,False,True,CF_NIV_SUIV,,CF_NIV_SUIV,True,False
21-168967,,,,,False,,,,,,False,,,,,,CF_NIV_SUIV,False,False,False,,False,,False,False,CF_NIV_SUIV,,CF_NIV_SUIV,False,True
21-169175,,,,,False,,,,,,False,,,,,,CF_NIV_SUIV,False,False,False,,False,,False,False,CF_NIV_SUIV,,CF_NIV_SUIV,False,True
21-170143,,,,,False,,,,,,False,,,,,,CF_NIV_SUIV,False,False,False,,False,,False,False,CF_NIV_SUIV,"Documents à produire obligatoirement par le candidat, à l'appui de sa candidature",CF_NIV_SUIV,True,False
21-170143,,,,,False,,,,,,False,,,,,,CF_NIV_SUIV,False,False,False,,False,,False,False,CF_NIV_SUIV,"Copie du ou des jugements prononcés, si le candidat est en redressement judiciaire",CF_NIV_SUIV,True,False
21-170143,,,,,False,,,,,,False,,,,,,CF_NIV_SUIV,False,False,False,,False,,False,False,CF_NIV_SUIV,"Déclaration sur l'honneur du candidat justifiant qu'il n'entre dans aucun des cas d'interdiction de soumissionner obligatoires prévus aux articles 45 et 48 de l'ordonnance no 2015-899 du 23 juillet 2015 ou, pour les marchés publics de défense ou de sécurité, qu'il n'entre dans aucun des cas d'interdiction de soumissionner obligatoires prévus aux articles 45 ,46 et 48 de l'ordonnance no 2015-899 du 23 juillet 2015 (si cette déclaration n'est pas déjà demandée dans le cadre du formulaire DC1, ci-après)",CF_NIV_SUIV,True,False
21-170143,,,,,False,,,,,,False,,,,,,CF_NIV_SUIV,False,False,False,,False,,False,False,CF_NIV_SUIV,"Déclaration sur l'honneur du candidat attestant qu'il est en règle, au cours de l'année précédant celle au cours de laquelle a lieu le lancement de la consultation, au regard des articles L. 5212-1, L. 5212-2, L. 5212 5 et L. 5212-9 du code du travail, concernant l'emploi des travailleurs handicapés",CF_NIV_SUIV,True,False
21-170143,,,,,False,,,,,,False,,,,,,CF_NIV_SUIV,False,False,False,,False,,False,False,CF_NIV_SUIV,"Si le candidat est établi en France, une déclaration sur l'honneur du candidat justifiant que le travail est effectué par des salariés employés régulièrement au regard des articles L. 1221-10, L. 3243-2 et R. 3243-1 du code du travail (dans le cas où le candidat emploie des salariés, conformément à l'article D. 8222-5-3° du code du travail)",CF_NIV_SUIV,True,False
21-170143,,,,,False,,,,,,False,,,,,,CF_NIV_SUIV,False,False,False,,False,,False,False,CF_NIV_SUIV,"Si le candidat est établi ou domicilié à l'étranger, une déclaration sur l'honneur du candidat attestant qu'il fournit à ses salariés des bulletins de paie comportant les mentions prévues à l'article R. 3243-1 du code du travail, ou des documents équivalents",CF_NIV_SUIV,True,False
21-170143,,,,,False,,,,,,False,,,,,,CF_NIV_SUIV,False,False,False,,False,,False,False,CF_NIV_SUIV,"Documents à produire à l'appui des candidatures par le candidat, au choix de l'acheteur public",CF_NIV_SUIV,True,False
21-170143,,,,,False,,,,,,False,,,,,,CF_NIV_SUIV,False,False,False,,False,,False,False,CF_NIV_SUIV,"Déclaration concernant le chiffre d'affaires global et le chiffre d'affaires concernant les fournitures, services ou travaux objet du marché, réalisés au cours des trois derniers exercices disponibles",CF_NIV_SUIV,True,False
21-170143,,,,,False,,,,,,False,,,,,,CF_NIV_SUIV,False,False,False,,False,,False,False,CF_NIV_SUIV,Déclaration appropriée de banques ou preuve d'une assurance pour les risques professionnels,CF_NIV_SUIV,True,False
21-170143,,,,,False,,,,,,False,,,,,,CF_NIV_SUIV,False,False,False,,False,,False,False,CF_NIV_SUIV,"Présentation d'une liste des principales fournitures ou des principaux services effectués au cours des trois dernières années, indiquant le montant, la date et le destinataire public ou privé. Les livraisons et les prestations de services sont prouvées par des attestations du destinataire ou, à défaut, par une déclaration de l'opérateur économique",CF_NIV_SUIV,True,False
21-170143,,,,,False,,,,,,False,,,,,,CF_NIV_SUIV,False,False,False,,False,,False,False,CF_NIV_SUIV,"Déclaration indiquant l'outillage, le matériel et l'équipement technique dont le candidat dispose pour la réalisation de marchés de même nature",CF_NIV_SUIV,True,False
