22-17006,,,CF_NIV_SUIV,CF_NIV_SUIV,False,False,False,CF_NIV_SUIV,False,False,,,,,Fourniture de matériel neuf et d'occasion avec reprise pour le service espaces verts (suite au marché 2021M034 classé sans suite),CF_NIV_SUIV,,,CF_NIV_SUIV,Au Centre Technique Municipal,62800.0,LIEVIN,,CF_NIV_SUIV,,CF_NIV_SUIV,,,,,,,,,,,,,False,False,CF_NIV_SUIV,False,,CF_NIV_SUIV,False,False,,CF_NIV_SUIV,,,,,,,,CF_NIV_SUIV,,,CF_NIV_SUIV,,,CF_NIV_SUIV,,,,,,False,True,CF_NIV_SUIV,Chaque lot fera l'objet d'une attribution séparée,Fourniture de matériel neuf et d'occasion avec reprise pour le service espaces verts (suite au marché 2021M034 classé sans suite),CF_NIV_SUIV,,,CF_NIV_SUIV,,,CF_NIV_SUIV,,,CF_NIV_SUIV,,,,--None--,CF_NIV_SUIV,False,,,,False,CF_NIV_SUIV,,,,,,,,,False,CF_NIV_SUIV,,,,,,,CF_NIV_SUIV,True,False,False,True,False,,,,,CF_NIV_SUIV,CF_NIV_SUIV,3,,Acquisition d'une lame de déneigement neuve pour tracteurAcquisition d'une lame de déneigement neuve pour tracteur,CF_NIV_SUIV,,,,,CF_NIV_SUIV,False,CF_NIV_SUIV,CF_NIV_SUIV,,,CF_NIV_SUIV,CF_NIV_SUIV,,,CF_NIV_SUIV,,,CF_NIV_SUIV,,,CF_NIV_SUIV,,,CF_NIV_SUIV,,,,,,,,,,,,,False,,,CF_NIV_SUIV,,,,,,False,False,False,,,,,False,,,
22-17018,,,CF_NIV_SUIV,CF_NIV_SUIV,False,False,False,CF_NIV_SUIV,False,False,,,,,Marché de travaux de plantations arborées sur les espaces publics de la Ville de Blagnac,CF_NIV_SUIV,45112710.0,,CF_NIV_SUIV,,,,,CF_NIV_SUIV,,CF_NIV_SUIV,,,,,,,,,,,,,False,False,CF_NIV_SUIV,False,,CF_NIV_SUIV,False,False,,CF_NIV_SUIV,,,,,,,,CF_NIV_SUIV,,,CF_NIV_SUIV,,,CF_NIV_SUIV,,,,,,False,False,CF_NIV_SUIV,,,CF_NIV_SUIV,,,CF_NIV_SUIV,,,CF_NIV_SUIV,,,CF_NIV_SUIV,,,,--None--,CF_NIV_SUIV,False,,,,False,CF_NIV_SUIV,,,,,,,,,False,CF_NIV_SUIV,,,,,,,CF_NIV_SUIV,False,False,False,False,False,,,,,CF_NIV_SUIV,,,,,,,,,,,,,,,,,,,,,,,,,,,,,,,,,,,,,,,,,,,,,,,,,,,,,,,,,,,,,
22-17020,,,CF_NIV_SUIV,CF_NIV_SUIV,False,False,False,CF_NIV_SUIV,False,False,,,,,PRESTATIONS D'ASSURANCE DOMMAGE-OUVRAGE POUR LA REHABILITATION ET L'EXTENSION EN VUE DE LA REALISATION DE LA MAISON DE L'ENERGIE DU SEHV,CF_NIV_SUIV,,,CF_NIV_SUIV,,,,,CF_NIV_SUIV,,CF_NIV_SUIV,,,,,,,,,,,,,False,False,CF_NIV_SUIV,False,,CF_NIV_SUIV,False,False,,CF_NIV_SUIV,,,,,,,,CF_NIV_SUIV,,,CF_NIV_SUIV,,,CF_NIV_SUIV,,,,,,False,False,CF_NIV_SUIV,,,CF_NIV_SUIV,,,CF_NIV_SUIV,,,CF_NIV_SUIV,,,CF_NIV_SUIV,,,,--None--,CF_NIV_SUIV,False,,,,False,CF_NIV_SUIV,,,,,,,,,False,CF_NIV_SUIV,,,,,,,CF_NIV_SUIV,False,False,False,False,False,,,,,CF_NIV_SUIV,,,,,,,,,,,,,,,,,,,,,,,,,,,,,,,,,,,,,,,,,,,,,,,,,,,,,,,,,,,,,
22-17023,,,CF_NIV_SUIV,CF_NIV_SUIV,False,False,False,CF_NIV_SUIV,False,False,,,,,Prestations foncières et topographiques - Intervention pour servir aux acquisitions et aux cessions de terrains et aux études générales et de maîtrise d'oeuvre des infrastructures dans le cadre du projet d'aménagement de la Clouterie.,CF_NIV_SUIV,,,CF_NIV_SUIV,La Clouterie à Maubeuge.,,,,CF_NIV_SUIV,,CF_NIV_SUIV,,,,,,,,,,,,,False,False,CF_NIV_SUIV,False,,CF_NIV_SUIV,False,False,,CF_NIV_SUIV,,,,,,,,CF_NIV_SUIV,,,CF_NIV_SUIV,,,CF_NIV_SUIV,,,,,,False,True,CF_NIV_SUIV,Marché de prestations intellectuelles traité en lot unique. La durée du marché est de 36 mois à compter de la notification du marché.Une avance est prévue conformément aux dispositions du CCAP.La proposition de variantes n'est pas autorisée. Le marché ne comporte pas de prestation supplémentaire éventuelle.La visite du site n'est pas obligatoire pour présenter une offre.,Prestations foncières et topographiques - Intervention pour servir aux acquisitions et aux cessions de terrains et aux études générales et de maîtrise d'oeuvre des infrastructures dans le cadre du projet d'aménagement de la Clouterie.,CF_NIV_SUIV,,,CF_NIV_SUIV,,,CF_NIV_SUIV,,,CF_NIV_SUIV,,,,--None--,CF_NIV_SUIV,False,,,,False,CF_NIV_SUIV,,,,,,,,,False,CF_NIV_SUIV,,,,,,,CF_NIV_SUIV,False,False,False,False,True,,,,,CF_NIV_SUIV,,,,,,,,,,,,,,,,,,,,,,,,,,,,,,,,,,,,,,,,,,,,,,,,,,,,,,,,,,,,,
22-17024,,,CF_NIV_SUIV,CF_NIV_SUIV,True,False,False,CF_NIV_SUIV,False,False,,,,,Accord-cadre à bons de commande de travaux de démolition et de Préparation de terrain pour le compte de Hauts-de-Seine HABITAT-OPH,CF_NIV_SUIV,45111000.0,,CF_NIV_SUIV,Patrimoine de Hauts de Seine Habitat - OPH,,,FR105,CF_NIV_SUIV,,CF_NIV_SUIV,,,,,,,,,,,,,False,True,CF_NIV_SUIV,False,,CF_NIV_SUIV,False,False,,CF_NIV_SUIV,,,,,,,,CF_NIV_SUIV,,,CF_NIV_SUIV,,,CF_NIV_SUIV,,,,,,False,False,CF_NIV_SUIV,,,CF_NIV_SUIV,,,CF_NIV_SUIV,,,CF_NIV_SUIV,,,CF_NIV_SUIV,,,,--None--,CF_NIV_SUIV,False,,,,False,CF_NIV_SUIV,,,,,,,,,False,CF_NIV_SUIV,,,,,,,CF_NIV_SUIV,False,False,False,False,False,,,,,CF_NIV_SUIV,,,,,,,,,,,,,,,,,,,,,,,,,,,,,,,,,,,,,,,,,,,,,,,,,,,,,,,,,,,,,
22-17027,,,CF_NIV_SUIV,CF_NIV_SUIV,True,False,False,CF_NIV_SUIV,False,False,,,,,Marché de travaux de réfection complète des toitures terrasses avec remplacement de l'isolation thermique existante et mise en place de corps de sécurité sur les Résidences sises aux 1/3/5/7/9/11 rue Marc Sangnier 92330 SCEAUX- patrimoine de Hauts-de-Seine Habitat OPH,CF_NIV_SUIV,45261410.0,,CF_NIV_SUIV,1/3/5/7/9 et 11 rue Marc Sangnier,92330.0,SCEAUX,FR105,CF_NIV_SUIV,,CF_NIV_SUIV,,,,,,,,,,,,,False,True,CF_NIV_SUIV,False,,CF_NIV_SUIV,False,False,,CF_NIV_SUIV,,,,,,,,CF_NIV_SUIV,,,CF_NIV_SUIV,,,CF_NIV_SUIV,,,,,,False,False,CF_NIV_SUIV,,,CF_NIV_SUIV,,,CF_NIV_SUIV,,,CF_NIV_SUIV,,,CF_NIV_SUIV,,,,--None--,CF_NIV_SUIV,False,,,,False,CF_NIV_SUIV,,,,,,,,,False,CF_NIV_SUIV,,,,,,,CF_NIV_SUIV,False,False,False,False,False,,,,,CF_NIV_SUIV,,,,,,,,,,,,,,,,,,,,,,,,,,,,,,,,,,,,,,,,,,,,,,,,,,,,,,,,,,,,,
22-17027,,,CF_NIV_SUIV,CF_NIV_SUIV,True,False,False,CF_NIV_SUIV,False,False,,,,,Marché de travaux de réfection complète des toitures terrasses avec remplacement de l'isolation thermique existante et mise en place de corps de sécurité sur les Résidences sises aux 1/3/5/7/9/11 rue Marc Sangnier 92330 SCEAUX- patrimoine de Hauts-de-Seine Habitat OPH,CF_NIV_SUIV,45261420.0,,CF_NIV_SUIV,1/3/5/7/9 et 11 rue Marc Sangnier,92330.0,SCEAUX,FR105,CF_NIV_SUIV,,CF_NIV_SUIV,,,,,,,,,,,,,False,True,CF_NIV_SUIV,False,,CF_NIV_SUIV,False,False,,CF_NIV_SUIV,,,,,,,,CF_NIV_SUIV,,,CF_NIV_SUIV,,,CF_NIV_SUIV,,,,,,False,False,CF_NIV_SUIV,,,CF_NIV_SUIV,,,CF_NIV_SUIV,,,CF_NIV_SUIV,,,CF_NIV_SUIV,,,,--None--,CF_NIV_SUIV,False,,,,False,CF_NIV_SUIV,,,,,,,,,False,CF_NIV_SUIV,,,,,,,CF_NIV_SUIV,False,False,False,False,False,,,,,CF_NIV_SUIV,,,,,,,,,,,,,,,,,,,,,,,,,,,,,,,,,,,,,,,,,,,,,,,,,,,,,,,,,,,,,
22-17028,,,CF_NIV_SUIV,CF_NIV_SUIV,True,False,False,CF_NIV_SUIV,False,False,,,,,"Marché de travaux à tranches de remplacement d'une chaudière (tranche ferme) et de refection des réseaux chauffage (tranche optionnelle), de la RPA MARTIGNON 42 rue Martignon 92500 Rueil-Malmaison",CF_NIV_SUIV,45331110.0,,CF_NIV_SUIV,42 rue Martignon,92500.0,Rueil-Malmaison,FR105,CF_NIV_SUIV,,CF_NIV_SUIV,,,,,,,,,,,,,False,True,CF_NIV_SUIV,False,,CF_NIV_SUIV,False,False,,CF_NIV_SUIV,,,,,,,,CF_NIV_SUIV,,,CF_NIV_SUIV,,,CF_NIV_SUIV,,,,,,False,False,CF_NIV_SUIV,,,CF_NIV_SUIV,,,CF_NIV_SUIV,,,CF_NIV_SUIV,,,CF_NIV_SUIV,,,,--None--,CF_NIV_SUIV,False,,,,False,CF_NIV_SUIV,,,,,,,,,False,CF_NIV_SUIV,,,,,,,CF_NIV_SUIV,False,False,False,False,False,,,,,CF_NIV_SUIV,,,,,,,,,,,,,,,,,,,,,,,,,,,,,,,,,,,,,,,,,,,,,,,,,,,,,,,,,,,,,
22-17034,,,CF_NIV_SUIV,CF_NIV_SUIV,False,False,False,CF_NIV_SUIV,True,False,,,,,Acquisition de mobilier scolaire,CF_NIV_SUIV,39160000.0,,CF_NIV_SUIV,Antibes,6600.0,Antibes,FRL03,CF_NIV_SUIV,,CF_NIV_SUIV,,,,,,,,,,,,,False,True,CF_NIV_SUIV,False,,CF_NIV_SUIV,False,False,,CF_NIV_SUIV,,,,,,,,CF_NIV_SUIV,,,CF_NIV_SUIV,,,CF_NIV_SUIV,,,,,,False,False,CF_NIV_SUIV,,,CF_NIV_SUIV,,,CF_NIV_SUIV,,,CF_NIV_SUIV,,,CF_NIV_SUIV,,,,--None--,CF_NIV_SUIV,False,,,,False,CF_NIV_SUIV,,,,,,,,,False,CF_NIV_SUIV,,,,,,,CF_NIV_SUIV,False,False,False,False,False,,,,,CF_NIV_SUIV,,,,,,,,,,,,,,,,,,,,,,,,,,,,,,,,,,,,,,,,,,,,,,,,,,,,,,,,,,,,,
22-17046,,,CF_NIV_SUIV,CF_NIV_SUIV,False,False,False,CF_NIV_SUIV,False,False,,,,,Travaux pour implantation d'un matériel mise sous pli Kern 1600,CF_NIV_SUIV,,,CF_NIV_SUIV,CTI Rouen CEIRO 1 rue Newton,14540.0,Grentheville,,CF_NIV_SUIV,,CF_NIV_SUIV,,,,,,,,,,,,,False,False,CF_NIV_SUIV,False,,CF_NIV_SUIV,False,False,,CF_NIV_SUIV,,,,,,,,CF_NIV_SUIV,,,CF_NIV_SUIV,,,CF_NIV_SUIV,,,,,,False,False,CF_NIV_SUIV,,Travaux pour implantation d'un matériel mise sous pli Kern 1600,CF_NIV_SUIV,,,CF_NIV_SUIV,,,CF_NIV_SUIV,,,CF_NIV_SUIV,,,,--None--,CF_NIV_SUIV,False,,,,False,CF_NIV_SUIV,,,,,,,,,False,CF_NIV_SUIV,,,,,,,CF_NIV_SUIV,True,False,True,False,False,,,,,CF_NIV_SUIV,CF_NIV_SUIV,5,,Remplacement portes sectionnelles,CF_NIV_SUIV,,,,,CF_NIV_SUIV,False,CF_NIV_SUIV,CF_NIV_SUIV,,,CF_NIV_SUIV,CF_NIV_SUIV,,,CF_NIV_SUIV,,,CF_NIV_SUIV,,,CF_NIV_SUIV,,,CF_NIV_SUIV,,,,,,,,,,1649628000000.0,1654812000000.0,,False,,,CF_NIV_SUIV,,,,,,False,False,False,,,,,False,,,
22-17063,,,CF_NIV_SUIV,CF_NIV_SUIV,False,False,False,CF_NIV_SUIV,False,False,,,,,21M0502PA Travaux de rénovation du cintre du théâtre du Capitole. VA/SG,CF_NIV_SUIV,45212322.0,,CF_NIV_SUIV,,,,,CF_NIV_SUIV,,CF_NIV_SUIV,,,,,,,,,,,,,False,False,CF_NIV_SUIV,False,,CF_NIV_SUIV,False,False,,CF_NIV_SUIV,,,,,,,,CF_NIV_SUIV,,,CF_NIV_SUIV,,,CF_NIV_SUIV,,,,,,False,False,CF_NIV_SUIV,,,CF_NIV_SUIV,,,CF_NIV_SUIV,,,CF_NIV_SUIV,,,CF_NIV_SUIV,,,,--None--,CF_NIV_SUIV,False,,,,False,CF_NIV_SUIV,,,,,,,,,False,CF_NIV_SUIV,,,,,,,CF_NIV_SUIV,False,False,False,False,False,,,,,CF_NIV_SUIV,,,,,,,,,,,,,,,,,,,,,,,,,,,,,,,,,,,,,,,,,,,,,,,,,,,,,,,,,,,,,
22-17066,,,CF_NIV_SUIV,CF_NIV_SUIV,False,False,False,CF_NIV_SUIV,False,False,,,,,Investigations et missions d'ingénierie géotechnique - cimetière d'Ondina,CF_NIV_SUIV,71332000.0,,CF_NIV_SUIV,,,,,CF_NIV_SUIV,,CF_NIV_SUIV,,,,,,,,,,,,,False,False,CF_NIV_SUIV,False,,CF_NIV_SUIV,False,False,,CF_NIV_SUIV,,,,,,,,CF_NIV_SUIV,,,CF_NIV_SUIV,,,CF_NIV_SUIV,,,,,,False,False,CF_NIV_SUIV,,,CF_NIV_SUIV,,,CF_NIV_SUIV,,,CF_NIV_SUIV,,,CF_NIV_SUIV,,,,--None--,CF_NIV_SUIV,False,,,,False,CF_NIV_SUIV,,,,,,,,,False,CF_NIV_SUIV,,,,,,,CF_NIV_SUIV,False,False,False,False,False,,,,,CF_NIV_SUIV,,,,,,,,,,,,,,,,,,,,,,,,,,,,,,,,,,,,,,,,,,,,,,,,,,,,,,,,,,,,,
22-17070,,,CF_NIV_SUIV,CF_NIV_SUIV,False,False,False,CF_NIV_SUIV,False,False,,,,,"Réalisation d'une étude Etude de faisabilité Géothermie sur Champ de Sondes et de test de réponse thermique dans le cadre du regroupement de l'école polytechnique universitaire (Polytec'Tours) sur le site universitaire "" PORTALIS "" à tours (37)",CF_NIV_SUIV,,,CF_NIV_SUIV,Tours (37).,,,,CF_NIV_SUIV,,CF_NIV_SUIV,,,,,,,,,,,,,False,False,CF_NIV_SUIV,False,,CF_NIV_SUIV,False,False,,CF_NIV_SUIV,,,,,,,,CF_NIV_SUIV,,,CF_NIV_SUIV,,,CF_NIV_SUIV,,,,,,False,True,CF_NIV_SUIV,"Le présent marché a pour objet la réalisation d'une étude de faisabilité Géothermie sur Champ de Sondes et de Test de Réponse Thermique dans le cadre du regroupement de l'école polytechnique universitaire (Polytec'Tours) sur le site universitaire "" PORTALIS "" à tours (37).Les prestations font l'objet d'un marché unique.Les prestations font l'objet d'un Marché unique.",Voir le cahier des clauses techniques particulières (CCTP).,CF_NIV_SUIV,,,CF_NIV_SUIV,,,CF_NIV_SUIV,,,CF_NIV_SUIV,,,,--None--,CF_NIV_SUIV,False,,,,False,CF_NIV_SUIV,,,,,,,,,False,CF_NIV_SUIV,,,,,2022-03-17 23:00:00,,CF_NIV_SUIV,False,False,False,False,True,,,,,CF_NIV_SUIV,,,,,,,,,,,,,,,,,,,,,,,,,,,,,,,,,,,,,,,,,,,,,,,,,,,,,,,,,,,,,
22-17082,,,CF_NIV_SUIV,CF_NIV_SUIV,False,False,False,CF_NIV_SUIV,False,False,,,,,VISITES THEATRALISEES DU CHATEAU DE CHAVANIAC-LAFAYETTE ET VISITES THEATRALISEES ET MUSICALES DE L'HOTEL DU DEPARTEMENT,CF_NIV_SUIV,,,CF_NIV_SUIV,Département de la Haute-Loire,,,,CF_NIV_SUIV,,CF_NIV_SUIV,,,,,,,,,,,,,False,False,CF_NIV_SUIV,False,,CF_NIV_SUIV,False,False,,CF_NIV_SUIV,,,,,,,,CF_NIV_SUIV,,,CF_NIV_SUIV,,,CF_NIV_SUIV,,,,,,False,True,CF_NIV_SUIV,Chaque lot fera l'objet d'une attribution séparée,VISITES THEATRALISEES DU CHATEAU DE CHAVANIAC-LAFAYETTE ET VISITES THEATRALISEES ET MUSICALES DE L'HOTEL DU DEPARTEMENT,CF_NIV_SUIV,,,CF_NIV_SUIV,,,CF_NIV_SUIV,,,CF_NIV_SUIV,,,,--None--,CF_NIV_SUIV,False,,,,False,CF_NIV_SUIV,,,,,,,,,False,CF_NIV_SUIV,12.0,,,,,,CF_NIV_SUIV,True,False,False,True,False,,,,,CF_NIV_SUIV,CF_NIV_SUIV,01,,Visites théâtralisées du château de Chavaniac-LafayetteVisites théâtralisées du château de Chavaniac-Lafayette,CF_NIV_SUIV,,,,,CF_NIV_SUIV,False,CF_NIV_SUIV,CF_NIV_SUIV,,,CF_NIV_SUIV,CF_NIV_SUIV,,,CF_NIV_SUIV,,,CF_NIV_SUIV,,,CF_NIV_SUIV,,,CF_NIV_SUIV,,,,,,,,,,,,,False,,,CF_NIV_SUIV,,,,,,False,False,False,,,,,False,,,
22-17082,,,CF_NIV_SUIV,CF_NIV_SUIV,False,False,False,CF_NIV_SUIV,False,False,,,,,VISITES THEATRALISEES DU CHATEAU DE CHAVANIAC-LAFAYETTE ET VISITES THEATRALISEES ET MUSICALES DE L'HOTEL DU DEPARTEMENT,CF_NIV_SUIV,,,CF_NIV_SUIV,Département de la Haute-Loire,,,,CF_NIV_SUIV,,CF_NIV_SUIV,,,,,,,,,,,,,False,False,CF_NIV_SUIV,False,,CF_NIV_SUIV,False,False,,CF_NIV_SUIV,,,,,,,,CF_NIV_SUIV,,,CF_NIV_SUIV,,,CF_NIV_SUIV,,,,,,False,True,CF_NIV_SUIV,Chaque lot fera l'objet d'une attribution séparée,VISITES THEATRALISEES DU CHATEAU DE CHAVANIAC-LAFAYETTE ET VISITES THEATRALISEES ET MUSICALES DE L'HOTEL DU DEPARTEMENT,CF_NIV_SUIV,,,CF_NIV_SUIV,,,CF_NIV_SUIV,,,CF_NIV_SUIV,,,,--None--,CF_NIV_SUIV,False,,,,False,CF_NIV_SUIV,,,,,,,,,False,CF_NIV_SUIV,12.0,,,,,,CF_NIV_SUIV,True,False,False,True,False,,,,,CF_NIV_SUIV,CF_NIV_SUIV,02,,visites théâtralisées et musicales de l'Hôtel du Départementvisites théâtralisées et musicales de l'Hôtel du Département,CF_NIV_SUIV,,,,,CF_NIV_SUIV,False,CF_NIV_SUIV,CF_NIV_SUIV,,,CF_NIV_SUIV,CF_NIV_SUIV,,,CF_NIV_SUIV,,,CF_NIV_SUIV,,,CF_NIV_SUIV,,,CF_NIV_SUIV,,,,,,,,,,,,,False,,,CF_NIV_SUIV,,,,,,False,False,False,,,,,False,,,
22-17086,,,CF_NIV_SUIV,CF_NIV_SUIV,False,False,False,CF_NIV_SUIV,False,False,,,,,Nettoyage des vitrages extérieurs et intérieurs de l'Hôtel du Département à Carcassonne- Option (Prestation Supplémentaire Éventuelle) : nettoyage des avancées de toit.,CF_NIV_SUIV,,,CF_NIV_SUIV,,,,,CF_NIV_SUIV,,CF_NIV_SUIV,,,,,,,,,,,,,False,False,CF_NIV_SUIV,False,,CF_NIV_SUIV,False,False,,CF_NIV_SUIV,,,,,,,,CF_NIV_SUIV,,,CF_NIV_SUIV,,,CF_NIV_SUIV,,,,,,False,False,CF_NIV_SUIV,,,CF_NIV_SUIV,,,CF_NIV_SUIV,,,CF_NIV_SUIV,,,CF_NIV_SUIV,,,,--None--,CF_NIV_SUIV,False,,,,False,CF_NIV_SUIV,,,,,,,,,False,CF_NIV_SUIV,,,,,,,CF_NIV_SUIV,False,False,False,False,False,,,,,CF_NIV_SUIV,,,,,,,,,,,,,,,,,,,,,,,,,,,,,,,,,,,,,,,,,,,,,,,,,,,,,,,,,,,,,
22-17087,,,CF_NIV_SUIV,CF_NIV_SUIV,False,False,False,CF_NIV_SUIV,False,False,,,,,FOURNITURE DE DENREES ALIMENTAIRES POUR TOUS LES SERVICES DE LA VILLE D AJACCIO - RELANCE LOT 14,CF_NIV_SUIV,,,CF_NIV_SUIV,Ville d'Ajaccio,20000.0,Ajaccio,,CF_NIV_SUIV,,CF_NIV_SUIV,,,,,,,,,,,,,False,False,CF_NIV_SUIV,False,,CF_NIV_SUIV,False,False,,CF_NIV_SUIV,,,,,,,,CF_NIV_SUIV,,,CF_NIV_SUIV,,,CF_NIV_SUIV,,,,,,False,False,CF_NIV_SUIV,L'accord-cadre sera exécuté par l'émission de bons de commande.Fourniture de denrées alimentaires pour tous les services de la Ville d'AjaccioRelance Lot 14 - Alimentation bébé,FOURNITURE DE DENREES ALIMENTAIRES POUR TOUS LES SERVICES DE LA VILLE D AJACCIO - RELANCE LOT 14,CF_NIV_SUIV,,,CF_NIV_SUIV,,,CF_NIV_SUIV,,,CF_NIV_SUIV,,,,--None--,CF_NIV_SUIV,False,,,,False,CF_NIV_SUIV,,,,,,,,,False,CF_NIV_SUIV,,,,,,,CF_NIV_SUIV,False,False,False,False,True,,,,,CF_NIV_SUIV,,,,,,,,,,,,,,,,,,,,,,,,,,,,,,,,,,,,,,,,,,,,,,,,,,,,,,,,,,,,,
22-17088,,,CF_NIV_SUIV,CF_NIV_SUIV,False,False,False,CF_NIV_SUIV,False,False,,,,,Etude pré-opérationnelle à un programme d'amélioration de l'habitat,CF_NIV_SUIV,,,CF_NIV_SUIV,,,,,CF_NIV_SUIV,,CF_NIV_SUIV,,,,,,,,,,,,,False,False,CF_NIV_SUIV,False,,CF_NIV_SUIV,False,False,,CF_NIV_SUIV,,,,,,,,CF_NIV_SUIV,,,CF_NIV_SUIV,,,CF_NIV_SUIV,,,,,,False,False,CF_NIV_SUIV,La présente consultation a pour objet la désignation d'un prestataire spécialisé en vue d'accompagner la Communauté de communes Coeur de Charente dans la réalisation d'une étude pré-opérationnelle à un programme d'amélioration de l'habitat,"La mission comprend une tranche ferme et une tranche conditionnelle.* TRANCHE FERME :-Phase 1 : Analyse du territoire et du parc privé.-Phase 2 : Proposition de scenarii, choix de la stratégie d'intervention et modalités de mise en oeuvre.* TRANCHE CONDITIONNELLE :-Phase 3 : Préparation des projets de convention OPAH et/ou PIG et/ou OPAH-RU",CF_NIV_SUIV,,,CF_NIV_SUIV,,,CF_NIV_SUIV,,,CF_NIV_SUIV,,,,--None--,CF_NIV_SUIV,False,,,,False,CF_NIV_SUIV,,,,,,,,,False,CF_NIV_SUIV,,,,,,,CF_NIV_SUIV,False,False,False,False,True,,,,,CF_NIV_SUIV,,,,,,,,,,,,,,,,,,,,,,,,,,,,,,,,,,,,,,,,,,,,,,,,,,,,,,,,,,,,,
22-17093,,,CF_NIV_SUIV,CF_NIV_SUIV,False,False,False,CF_NIV_SUIV,False,False,,,,,Télésurveillance et gardiennage des bâtiments du Conseil Départemental,CF_NIV_SUIV,,,CF_NIV_SUIV,,,,,CF_NIV_SUIV,,CF_NIV_SUIV,,,,,,,,,,,,,False,False,CF_NIV_SUIV,False,,CF_NIV_SUIV,False,False,,CF_NIV_SUIV,,,,,,,,CF_NIV_SUIV,,,CF_NIV_SUIV,,,CF_NIV_SUIV,,,,,,False,True,CF_NIV_SUIV,"La procédure de passation utilisée est la procédure adaptée ouverte. Elle est soumise aux dispositions des articles L. 2123-1 et R. 2123-1 3° du Code de la commande publique. L'accord-cadre avec maximum est passé en application des articles L2125-1 1°, R. 2162-1 à R. 2162-6, R. 2162-13 et R. 2162-14 du Code de la commande publique. Il donnera lieu à l'émission de bons de commande. Les prestations sont réparties en 2 lots. Chaque accord-cadre sera attribué à un seul opérateur économique. L'accord-cadre est conclu pour une durée de 4 ans à compter de sa notification.",Télésurveillance et gardiennage des bâtiments du Conseil Départemental,CF_NIV_SUIV,,,CF_NIV_SUIV,,,CF_NIV_SUIV,,,CF_NIV_SUIV,,,,--None--,CF_NIV_SUIV,False,,,,False,CF_NIV_SUIV,,,,,,,,,False,CF_NIV_SUIV,,,,,,,CF_NIV_SUIV,True,False,False,True,False,,,,,CF_NIV_SUIV,CF_NIV_SUIV,Télésurveillance et levée de doute,,"Le montant total des prestations pour la durée totale de l'accord-cadre est défini(e) comme suit : 50 000,00 euros HT",CF_NIV_SUIV,,,,,CF_NIV_SUIV,False,CF_NIV_SUIV,CF_NIV_SUIV,,,CF_NIV_SUIV,CF_NIV_SUIV,,,CF_NIV_SUIV,,,CF_NIV_SUIV,,,CF_NIV_SUIV,,,CF_NIV_SUIV,,,,,,,,,,,,,False,,,CF_NIV_SUIV,,,,,,False,False,False,,,,,False,,,
22-17093,,,CF_NIV_SUIV,CF_NIV_SUIV,False,False,False,CF_NIV_SUIV,False,False,,,,,Télésurveillance et gardiennage des bâtiments du Conseil Départemental,CF_NIV_SUIV,,,CF_NIV_SUIV,,,,,CF_NIV_SUIV,,CF_NIV_SUIV,,,,,,,,,,,,,False,False,CF_NIV_SUIV,False,,CF_NIV_SUIV,False,False,,CF_NIV_SUIV,,,,,,,,CF_NIV_SUIV,,,CF_NIV_SUIV,,,CF_NIV_SUIV,,,,,,False,True,CF_NIV_SUIV,"La procédure de passation utilisée est la procédure adaptée ouverte. Elle est soumise aux dispositions des articles L. 2123-1 et R. 2123-1 3° du Code de la commande publique. L'accord-cadre avec maximum est passé en application des articles L2125-1 1°, R. 2162-1 à R. 2162-6, R. 2162-13 et R. 2162-14 du Code de la commande publique. Il donnera lieu à l'émission de bons de commande. Les prestations sont réparties en 2 lots. Chaque accord-cadre sera attribué à un seul opérateur économique. L'accord-cadre est conclu pour une durée de 4 ans à compter de sa notification.",Télésurveillance et gardiennage des bâtiments du Conseil Départemental,CF_NIV_SUIV,,,CF_NIV_SUIV,,,CF_NIV_SUIV,,,CF_NIV_SUIV,,,,--None--,CF_NIV_SUIV,False,,,,False,CF_NIV_SUIV,,,,,,,,,False,CF_NIV_SUIV,,,,,,,CF_NIV_SUIV,True,False,False,True,False,,,,,CF_NIV_SUIV,CF_NIV_SUIV,Gardiennage et ronde,,"Le montant total des prestations pour la durée totale de l'accord-cadre est défini(e) comme suit : 35 000,00 euros HT",CF_NIV_SUIV,,,,,CF_NIV_SUIV,False,CF_NIV_SUIV,CF_NIV_SUIV,,,CF_NIV_SUIV,CF_NIV_SUIV,,,CF_NIV_SUIV,,,CF_NIV_SUIV,,,CF_NIV_SUIV,,,CF_NIV_SUIV,,,,,,,,,,,,,False,,,CF_NIV_SUIV,,,,,,False,False,False,,,,,False,,,
22-17112,,,CF_NIV_SUIV,CF_NIV_SUIV,False,False,False,CF_NIV_SUIV,False,False,,,,,Marché de services d'assurances,CF_NIV_SUIV,66510000.0,,CF_NIV_SUIV,,,,,CF_NIV_SUIV,,CF_NIV_SUIV,,,,,,,,,,,,,False,False,CF_NIV_SUIV,False,,CF_NIV_SUIV,False,False,,CF_NIV_SUIV,,,,,,,,CF_NIV_SUIV,,,CF_NIV_SUIV,,,CF_NIV_SUIV,,,,,,False,False,CF_NIV_SUIV,,,CF_NIV_SUIV,,,CF_NIV_SUIV,,,CF_NIV_SUIV,,,CF_NIV_SUIV,,,,--None--,CF_NIV_SUIV,False,,,,False,CF_NIV_SUIV,,,,,,,,,False,CF_NIV_SUIV,,,,,,,CF_NIV_SUIV,False,False,False,False,False,,,,,CF_NIV_SUIV,,,,,,,,,,,,,,,,,,,,,,,,,,,,,,,,,,,,,,,,,,,,,,,,,,,,,,,,,,,,,
22-17114,,,CF_NIV_SUIV,CF_NIV_SUIV,False,False,False,CF_NIV_SUIV,False,False,,,,,Étude de la qualité des eaux sur le territoire de la Loire et de ses affluents vellaves,CF_NIV_SUIV,,,CF_NIV_SUIV,,,,,CF_NIV_SUIV,,CF_NIV_SUIV,,,,,,,,,,,,,False,False,CF_NIV_SUIV,False,,CF_NIV_SUIV,False,False,,CF_NIV_SUIV,,,,,,,,CF_NIV_SUIV,,,CF_NIV_SUIV,,,CF_NIV_SUIV,,,,,,False,True,CF_NIV_SUIV,Marché subdivisé en 2 lots (le lot 1 comporte 1 tranche ferme et une tranche optionnelle),Étude de la qualité des eaux sur le territoire de la Loire et de ses affluents vellaves,CF_NIV_SUIV,,,CF_NIV_SUIV,,,CF_NIV_SUIV,,,CF_NIV_SUIV,,,,--None--,CF_NIV_SUIV,False,,,,False,CF_NIV_SUIV,,,,,,,,,False,CF_NIV_SUIV,11.0,,,,,,CF_NIV_SUIV,True,False,True,False,False,,,,,CF_NIV_SUIV,CF_NIV_SUIV,"Etude, prélèvements et analyses hors inventaires piscicoles",,"Étude, prélèvements et analyses hors inventaires piscicoles",CF_NIV_SUIV,,,,,CF_NIV_SUIV,False,CF_NIV_SUIV,CF_NIV_SUIV,,,CF_NIV_SUIV,CF_NIV_SUIV,,,CF_NIV_SUIV,,,CF_NIV_SUIV,,,CF_NIV_SUIV,,,CF_NIV_SUIV,,,,,,,,,,,,,False,,,CF_NIV_SUIV,,,,,,False,False,False,,,,,False,,,
22-17114,,,CF_NIV_SUIV,CF_NIV_SUIV,False,False,False,CF_NIV_SUIV,False,False,,,,,Étude de la qualité des eaux sur le territoire de la Loire et de ses affluents vellaves,CF_NIV_SUIV,,,CF_NIV_SUIV,,,,,CF_NIV_SUIV,,CF_NIV_SUIV,,,,,,,,,,,,,False,False,CF_NIV_SUIV,False,,CF_NIV_SUIV,False,False,,CF_NIV_SUIV,,,,,,,,CF_NIV_SUIV,,,CF_NIV_SUIV,,,CF_NIV_SUIV,,,,,,False,True,CF_NIV_SUIV,Marché subdivisé en 2 lots (le lot 1 comporte 1 tranche ferme et une tranche optionnelle),Étude de la qualité des eaux sur le territoire de la Loire et de ses affluents vellaves,CF_NIV_SUIV,,,CF_NIV_SUIV,,,CF_NIV_SUIV,,,CF_NIV_SUIV,,,,--None--,CF_NIV_SUIV,False,,,,False,CF_NIV_SUIV,,,,,,,,,False,CF_NIV_SUIV,11.0,,,,,,CF_NIV_SUIV,True,False,True,False,False,,,,,CF_NIV_SUIV,CF_NIV_SUIV,Inventaires piscicoles,,Inventaires piscicoles,CF_NIV_SUIV,,,,,CF_NIV_SUIV,False,CF_NIV_SUIV,CF_NIV_SUIV,,,CF_NIV_SUIV,CF_NIV_SUIV,,,CF_NIV_SUIV,,,CF_NIV_SUIV,,,CF_NIV_SUIV,,,CF_NIV_SUIV,,,,,,,,,,,,,False,,,CF_NIV_SUIV,,,,,,False,False,False,,,,,False,,,
22-17115,,,CF_NIV_SUIV,CF_NIV_SUIV,False,False,False,CF_NIV_SUIV,False,False,,,,,Travaux de remplacement des menuiseries extérieures de l'Hôtel de ville,CF_NIV_SUIV,45421000.0,,CF_NIV_SUIV,2 RUE DU GENERAL DE GAULLE,27600.0,GAILLON,,CF_NIV_SUIV,,CF_NIV_SUIV,,,,,,,,,,,,,False,False,CF_NIV_SUIV,False,,CF_NIV_SUIV,False,False,,CF_NIV_SUIV,,,,,,,,CF_NIV_SUIV,,,CF_NIV_SUIV,,,CF_NIV_SUIV,,,,,,False,False,CF_NIV_SUIV,,,CF_NIV_SUIV,,,CF_NIV_SUIV,,,CF_NIV_SUIV,,,CF_NIV_SUIV,,,,--None--,CF_NIV_SUIV,False,,,,False,CF_NIV_SUIV,,,,,,,,,False,CF_NIV_SUIV,,,,,,,CF_NIV_SUIV,False,False,False,False,False,,,,,CF_NIV_SUIV,,,,,,,,,,,,,,,,,,,,,,,,,,,,,,,,,,,,,,,,,,,,,,,,,,,,,,,,,,,,,
22-17128,,,CF_NIV_SUIV,CF_NIV_SUIV,False,False,False,CF_NIV_SUIV,False,False,,,,,Maintenance des matériels de cuisine (Offices - cuisson - froid),CF_NIV_SUIV,,,CF_NIV_SUIV,Cuisine centrale et Structures,2320.0,Prémontré,,CF_NIV_SUIV,,CF_NIV_SUIV,,,,,,,,,,,,,False,False,CF_NIV_SUIV,False,,CF_NIV_SUIV,False,False,,CF_NIV_SUIV,,,,,,,,CF_NIV_SUIV,,,CF_NIV_SUIV,,,CF_NIV_SUIV,,,,,,False,False,CF_NIV_SUIV,"Le présent contrat est conclu pour une durée de 1 an, renouvelable 2 fois par tacite reconductionUne visite sur site est obligatoire",,CF_NIV_SUIV,,,CF_NIV_SUIV,,,CF_NIV_SUIV,,,CF_NIV_SUIV,,,,--None--,CF_NIV_SUIV,False,,,,False,CF_NIV_SUIV,,,,,,,,,False,CF_NIV_SUIV,36.0,,,,2022-03-31 22:00:00,,CF_NIV_SUIV,False,False,False,False,False,,,,,CF_NIV_SUIV,,,,,,,,,,,,,,,,,,,,,,,,,,,,,,,,,,,,,,,,,,,,,,,,,,,,,,,,,,,,,
22-17133,,,CF_NIV_SUIV,CF_NIV_SUIV,False,False,False,CF_NIV_SUIV,False,False,,,,,Accord-cadre d'études de diagnostic et de maîtrise d'oeuvre - Gallardon - Eglise Saint-Pierre-et-Saint-Paul - Restauration générale,CF_NIV_SUIV,,,CF_NIV_SUIV,place de l'église,28320.0,gallardon,,CF_NIV_SUIV,,CF_NIV_SUIV,,,,,,,,,,,,,False,False,CF_NIV_SUIV,False,,CF_NIV_SUIV,False,False,,CF_NIV_SUIV,,,,,,,,CF_NIV_SUIV,,,CF_NIV_SUIV,,,CF_NIV_SUIV,,,,,,False,False,CF_NIV_SUIV,,,CF_NIV_SUIV,,,CF_NIV_SUIV,,,CF_NIV_SUIV,,,CF_NIV_SUIV,,,,--None--,CF_NIV_SUIV,False,,,,False,CF_NIV_SUIV,,,,,,,,,False,CF_NIV_SUIV,72.0,,,,2022-04-30 22:00:00,,CF_NIV_SUIV,False,False,False,False,False,,,,,CF_NIV_SUIV,,,,,,,,,,,,,,,,,,,,,,,,,,,,,,,,,,,,,,,,,,,,,,,,,,,,,,,,,,,,,
22-17135,,,CF_NIV_SUIV,CF_NIV_SUIV,False,False,False,CF_NIV_SUIV,False,False,,,,,Mission de maîtrise d'oeuvre pour les travaux de rénovation des vestiaires du personnel et la construction d'une extension en toiture de l'Opéra Bastille,CF_NIV_SUIV,71300000.0,,CF_NIV_SUIV,,,,,CF_NIV_SUIV,,CF_NIV_SUIV,,,,,,,,,,,,,False,False,CF_NIV_SUIV,False,,CF_NIV_SUIV,False,False,,CF_NIV_SUIV,,,,,,,,CF_NIV_SUIV,,,CF_NIV_SUIV,,,CF_NIV_SUIV,,,,,,False,False,CF_NIV_SUIV,,,CF_NIV_SUIV,,,CF_NIV_SUIV,,,CF_NIV_SUIV,,,CF_NIV_SUIV,,,,--None--,CF_NIV_SUIV,False,,,,False,CF_NIV_SUIV,,,,,,,,,False,CF_NIV_SUIV,,,,,,,CF_NIV_SUIV,False,False,False,False,False,,,,,CF_NIV_SUIV,,,,,,,,,,,,,,,,,,,,,,,,,,,,,,,,,,,,,,,,,,,,,,,,,,,,,,,,,,,,,
